ISSN,dataset,doi,journal,title,url,pdf
2052-4463,"dataset-741, dataset-742, dataset-743, dataset-614",10.1038/s41597-019-0333-x,Scientific data,An extreme sea level indicator for the contiguous United States coastline.,https://doi.org/10.1038/s41597-019-0333-x,https://www.nature.com/articles/s41597-019-0333-x.pdf
2045-2322,"dataset-757, dataset-758, dataset-759",10.1038/s41598-019-54239-2,Scientific reports,"Global ocean freshening, ocean mass increase and global mean sea level rise over 2005-2015.",https://doi.org/10.1038/s41598-019-54239-2,https://www.nature.com/articles/s41598-019-54239-2.pdf
1424-8220,dataset-768,10.3390/s19214770,"Sensors (Basel, Switzerland)",Prediction of Sea Level Nonlinear Trends around Shandong Peninsula from Satellite Altimetry.,https://doi.org/10.3390/s19214770,https://www.ncbi.nlm.nih.gov/pmc/articles/PMC6864553/pdf/sensors-19-04770.pdf
2352-3409,dataset-767,10.1016/j.dib.2019.104600,Data in brief,Relative sea-level data from the SEAMIS database compared to ICE-5G model predictions of glacial isostatic adjustment.,https://doi.org/10.1016/j.dib.2019.104600,
2352-3409,dataset-786,10.1016/j.dib.2019.104585,Data in brief,Dataset of global extreme climatic indices due to an acceleration of ice sheet melting during the 21st century.,https://doi.org/10.1016/j.dib.2019.104585,
2041-1723,dataset-618,10.1038/s41467-019-12808-z,Nature communications,New elevation data triple estimates of global vulnerability to sea-level rise and coastal flooding.,https://doi.org/10.1038/s41467-019-12808-z,https://www.nature.com/articles/s41467-019-12808-z.pdf
1476-4687,dataset-787,10.1038/s41586-019-1550-3,Nature,Rapid expansion of Greenland's low-permeability ice slabs.,https://doi.org/10.1038/s41586-019-1550-3,https://www.nature.com/articles/s41586-019-1550-3.pdf
2041-1723,dataset-789,10.1038/s41467-019-11602-1,Nature communications,Mekong delta much lower than previously assumed in sea-level rise impact assessments.,https://doi.org/10.1038/s41467-019-11602-1,https://www.nature.com/articles/s41467-019-11602-1.pdf
1932-6203,"dataset-623, dataset-631, dataset-790, dataset-791, dataset-702, dataset-803, dataset-804, dataset-805, dataset-806, dataset-807, dataset-813",10.1371/journal.pone.0218558,PloS one,Insights into estuary habitat loss in the western United States using a new method for mapping maximum extent of tidal wetlands.,https://doi.org/10.1371/journal.pone.0218558,https://journals.plos.org/plosone/article/file?id=10.1371/journal.pone.0218558&type=printable