title,journal,doi,authors,search_term,dataset_id
The OWLeS IOP2b Lake-Effect Snowstorm: Mechanisms Contributing to the Tug Hill Precipitation Maximum,Monthly Weather Review,10.1175/mwr-d-16-0461.1,"Campbell, Leah S., Steenburgh, W. James",Next Generation Weather Radar,dataset-612
A New Radio Frequency Interference Filter for Weather Radars,Journal of Atmospheric and Oceanic Technology,10.1175/jtech-d-17-0028.1,"Cho, John Y. N.",Next Generation Weather Radar,dataset-612
A terrain‐based weighted random forests method for radar quantitative precipitation estimation,Meteorological Applications,10.1002/met.1638,"Yang, Xuebing, Kuang, Qiuming, Zhang, Wensheng, Zhang, Guoping",Next Generation Weather Radar,dataset-612
The OWLeS IOP2b Lake-Effect Snowstorm: Dynamics of the Secondary Circulation,Monthly Weather Review,10.1175/mwr-d-16-0462.1,"Bergmaier, Philip T., Geerts, Bart, Campbell, Leah S., Steenburgh, W. James",Next Generation Weather Radar,dataset-612
Detecting Beam Blockage in Radar-Based Precipitation Estimates,Journal of Atmospheric and Oceanic Technology,10.1175/jtech-d-16-0174.1,"McRoberts, D. Brent, Nielsen-Gammon, John W.",Next Generation Weather Radar,dataset-612
The OWLeS IOP2b Lake-Effect Snowstorm: Shoreline Geometry and the Mesoscale Forcing of Precipitation,Monthly Weather Review,10.1175/mwr-d-16-0460.1,"Steenburgh, W. James, Campbell, Leah S.",Next Generation Weather Radar,dataset-612
Development of a Station Based Climate Database for SWAT and APEX Assessments in the US,Water,10.3390/w9060437,"White, Michael J., Gambone, Marilyn, Haney, Elizabeth, Arnold, Jeffrey, Gao, Jungang",Next Generation Weather Radar,dataset-612
The Influence of PBL Parameterization on the Practical Predictability of Convection Initiation during the Mesoscale Predictability Experiment (MPEX),Weather and Forecasting,10.1175/waf-d-16-0174.1,"Burlingame, Bryan M., Evans, Clark, Roebber, Paul J.",Next Generation Weather Radar,dataset-612
How Frequent is Precipitation over the Contiguous United States? Perspectives from Ground-Based and Spaceborne Radars,Journal of Hydrometeorology,10.1175/jhm-d-16-0242.1,"Smalley, Mark, Kirstetter, Pierre-Emmanuel, L’Ecuyer, Tristan",Next Generation Weather Radar,dataset-612
Development of high-resolution dynamic dust source function - A case study with a strong dust storm in a regional model,Atmospheric Environment,10.1016/j.atmosenv.2017.03.045,"Kim, Dongchul, Chin, Mian, Kemp, Eric M., Tao, Zhining, Peters-Lidard, Christa D., Ginoux, Paul",Next Generation Weather Radar,dataset-612
Simulated Polarimetric Fields of Ice Vapor Growth Using the Adaptive Habit Model. Part II: A Case Study from the FROST Experiment,Monthly Weather Review,10.1175/mwr-d-16-0062.1,"Sulia, Kara J., Kumjian, Matthew R.",Next Generation Weather Radar,dataset-612
