title,journal,authors,doi,search_term,dataset_id
"Social vulnerability assessment of dog intake location data as a planning tool for community health program development: A case study in Athens-Clarke County, GA, 2014-2016.",PloS one,"Dyer, Jessie L, Milot, Lisa",10.1371/journal.pone.0225282,Social Vulnerability Index,dataset-613
The geography of suicide in older adults in Hong Kong: An ecological study.,International journal of geriatric psychiatry,"Guo, Yingqi, Chau, Patsy P H, Chang, Qingsong, Woo, Jean, Wong, Moses, Yip, Paul S F",10.1002/gps.5225,Social Vulnerability Index,dataset-613
Long-Term Care Admissions Following Hospitalization: The Role of Social Vulnerability.,"Healthcare (Basel, Switzerland)","Godin, Judith, Theou, Olga, Black, Karen, McNeil, Shelly A, Andrew, Melissa K",10.3390/healthcare7030091,Social Vulnerability Index,dataset-613
Assessing Community Vulnerability to Floods and Hurricanes along the U.S. Gulf Coast.,Disasters,"Shao, Wanyun, Jackson, Nida Pino, Ha, Hoehun, Winemiller, Terrence",10.1111/disa.12383,Social Vulnerability Index,dataset-613
Application of the Social Vulnerability Index for Identifying Teen Pregnancy Intervention Need in the United States.,Maternal and child health journal,"Yee, Chloe W, Cunningham, Shayna D, Ickovics, Jeannette R",10.1007/s10995-019-02792-7,Social Vulnerability Index,dataset-613
Measuring social vulnerability to natural hazards at the district level in Botswana.,"Jamba (Potchefstroom, South Africa)","Dintwa, Kakanyo F, Letamo, Gobopamang, Navaneetham, Kannan",10.4102/jamba.v11i1.447,Social Vulnerability Index,dataset-613
"Residential flood vulnerability along the developed North Carolina, USA coast: High resolution social and physical data for decision support.",Data in brief,"Pricope, Narcisa G, Halls, Joanne N, Rosul, Lauren M, Hidalgo, Christopher",10.1016/j.dib.2019.103975,Social Vulnerability Index,dataset-613
Using the Social Vulnerability Index to Examine Local Disparities in Emergent and Elective Cholecystectomy.,The Journal of surgical research,"Carmichael, Heather, Moore, Allison, Steward, Lauren, Velopulos, Catherine G",10.1016/j.jss.2019.05.022,Social Vulnerability Index,dataset-613
(Un)Equitable distribution of health resources and the judicialization of healthcare: 10 years of experience in Brazil.,International journal for equity in health,"Lopes, Luciana de Melo Nunes, Acurcio, Francisco de Assis, Diniz, Semíramis Domingues, Coelho, Tiago Lopes, Andrade, Eli Iola Gurgel",10.1186/s12939-019-0914-5,Social Vulnerability Index,dataset-613
Social Vulnerability in Patients with Multimorbidity: A Cross-Sectional Analysis.,International journal of environmental research and public health,"Nguyen, Tu N, Ngangue, Patrice, Bouhali, Tarek, Ryan, Bridget L, Stewart, Moira, Fortin, Martin",10.3390/ijerph16071244,Social Vulnerability Index,dataset-613
"Spatial clustering, social vulnerability and risk of leprosy in an endemic area in Northeast Brazil: an ecological study.",Journal of the European Academy of Dermatology and Venereology : JEADV,"de Souza, C D F, Rocha, V S, Santos, N F, Leal, T C, de Paiva, J P S, Oliveira, C C C, Martins-Filho, P R S, Magalhães, M A F M, Cuevas, L E, Santos, V S",10.1111/jdv.15596,Social Vulnerability Index,dataset-613
"Factors associated with the social, individual and programmatic vulnerability of older adults living at home.",Revista da Escola de Enfermagem da U S P,"Fernandes Bolina, Alisson, Rodrigues, Rosalina Aparecida Partezani, Tavares, Darlene Mara Dos Santos, Haas, Vanderlei José",10.1590/S1980-220X2017050103429,Social Vulnerability Index,dataset-613
"Malocclusion and social vulnerability: a representative study with adolescents from Belo Horizonte, Brazil.",Ciencia & saude coletiva,"Martins, Letícia Pereira, Bittencourt, Jéssica Madeira, Bendo, Cristiane Baccin, Vale, Miriam Pimenta, Paiva, Saul Martins",10.1590/1413-81232018242.33082016,Social Vulnerability Index,dataset-613
The Social Vulnerability Index: Assessing Replicability in Predicting Mortality Over 27 Years.,Journal of the American Geriatrics Society,"Ouvrard, Camille, Avila-Funes, José Alberto, Dartigues, Jean-François, Amieva, Hélène, Tabue-Teguo, Maturin",10.1111/jgs.15812,Social Vulnerability Index,dataset-613
"GIS-Based Integration of Social Vulnerability and Level 3 Probabilistic Risk Assessment to Advance Emergency Preparedness, Planning, and Response for Severe Nuclear Power Plant Accidents.",Risk analysis : an official publication of the Society for Risk Analysis,"Pence, Justin, Miller, Ian, Sakurahara, Tatsuya, Whitacre, James, Reihani, Seyed, Kee, Ernie, Mohaghegh, Zahra",10.1111/risa.13241,Social Vulnerability Index,dataset-613
The impact of frailty and cognitive impairment on quality of life: employment and social context matter.,International psychogeriatrics,"Godin, Judith, Armstrong, Joshua J, Wallace, Lindsay, Rockwood, Kenneth, Andrew, Melissa K",10.1017/S1041610218001710,Social Vulnerability Index,dataset-613
"Sociodemographic determinants of attrition in the HIV continuum of care in Brazil, in 2016.",Medicine,"Pascom, Ana Roberta Pati, Meireles, Mariana Veloso, Benzaken, Adele Schwartz",10.1097/MD.0000000000009857,Social Vulnerability Index,dataset-613
The influence of urban heat islands and socioeconomic factors on the spatial distribution of Aedes aegypti larval habitats.,Geospatial health,"De Azevedo, Thiago S, Bourke, Brian Patrick, Piovezan, Rafael, Sallum, Maria Anice M",10.4081/gh.2018.623,Social Vulnerability Index,dataset-613
Risk analysis of technological hazards: Simulation of scenarios and application of a local vulnerability index.,Journal of hazardous materials,"Sanchez, E Y, Represa, S, Mellado, D, Balbi, K B, Acquesta, A D, Colman Lerner, J E, Porta, A A",10.1016/j.jhazmat.2018.03.034,Social Vulnerability Index,dataset-613
"Bayesian spatial models of the association between interpersonal violence, animal abuse and social vulnerability in São Paulo, Brazil.",Preventive veterinary medicine,"Baquero, Oswaldo Santos, Ferreira, Fernando, Robis, Marcelo, Neto, José Soares Ferreira, Onell, Jason Ardila",10.1016/j.prevetmed.2018.01.008,Social Vulnerability Index,dataset-613
Alcohol intake among adolescent students and association with social capital and socioeconomic status.,Ciencia & saude coletiva,"Jorge, Kelly Oliva, Paiva, Paula Cristina Pelli, Ferreira, Efigênia Ferreira E, Vale, Miriam Pimenta do, Kawachi, Ichiro, Zarzar, Patrícia Maria",10.1590/1413-81232018233.05982016,Social Vulnerability Index,dataset-613
Spatial risk of tuberculosis mortality and social vulnerability in Northeast Brazil.,Revista da Sociedade Brasileira de Medicina Tropical,"Berra, Thaís Zamboni, Queiroz, Ana Angélica Rêgo de, Yamamura, Mellina, Arroyo, Luiz Henrique, Garcia, Maria Concebida da Cunha, Popolin, Marcela Paschoal, Santos, Danielle Talita Dos, Ramos, Antonio Carlos Vieira, Alves, Luana Seles, Fronteira, Inês Estevinho, Chiaravalloti, Francisco, Palha, Pedro Fredemir, Arcêncio, Ricardo Alexandre",10.1590/0037-8682-0160-2017,Social Vulnerability Index,dataset-613
Cross-Cultural Adaptation of the Social Vulnerability Index for Use in the Dutch Context.,International journal of environmental research and public health,"Bunt, Steven, Steverink, Nardi, Andrew, Melissa K, Schans, Cees P van der, Hobbelen, Hans",10.3390/ijerph14111387,Social Vulnerability Index,dataset-613
"[Identification of risk areas for the transmission of tuberculosis in the municipality of São Carlos, São Paulo State, Brazil, 2008 to 2013].",Epidemiologia e servicos de saude : revista do Sistema Unico de Saude do Brasil,"Arroyo, Luiz Henrique, Yamamura, Mellina, Protti-Zanatta, Simone Terezinha, Fusco, Alcione Pereira Biffi, Palha, Pedro Fredemir, Ramos, Antônio Carlos Vieira, Uchoa, Severina Alice, Arcêncio, Ricardo Alexandre",10.5123/S1679-49742017000300010,Social Vulnerability Index,dataset-613
Social vulnerability and factors associated with oral impact on daily performance among adolescents.,Health and quality of life outcomes,"da Cunha, Inara Pereira, Pereira, Antônio Carlos, Frias, Antônio Carlos, Vieira, Vladen, de Castro Meneghim, Marcelo, Batista, Marília Jesus, Cortellazzi, Karine Laura, Bulgareli, Jaqueline Vilela",10.1186/s12955-017-0746-1,Social Vulnerability Index,dataset-613
Assessing social vulnerability to drought in South Africa: Policy implication for drought risk reduction.,"Jamba (Potchefstroom, South Africa)","Muyambo, Fumiso, Jordaan, Andries J, Bahta, Yonas T",10.4102/jamba.v9i1.326,Social Vulnerability Index,dataset-613
Social vulnerability effect over obesity anthropometric indexes: results from population-based epidemiological study.,Revista brasileira de epidemiologia = Brazilian journal of epidemiology,"Freitas, Isabel Cristina Martins de, Moraes, Suzana Alves de",10.1590/1980-5497201600020018,Social Vulnerability Index,dataset-613
The Geography of Child Maltreatment: A Spatiotemporal Analysis Using Bayesian Hierarchical Analysis With Integrated Nested Laplace Approximation.,Journal of interpersonal violence,"Barboza,Gia Elise",10.1177/0886260516639583,Social Vulnerability Index,dataset-613
Can the Social Vulnerability Index Be Used for More Than Emergency Preparedness? An Examination Using Youth Physical Fitness Data.,Journal of physical activity & health,"Gay, Jennifer L, Robb, Sara W, Benson, Kelsey M, White, Alice",10.1123/jpah.2015-0042,Social Vulnerability Index,dataset-613
Socioeconomic and regional inequalities of pap smear coverage.,Revista gaucha de enfermagem,"Manica, Silvia Troyahn, Drachler, Maria de Lourdes, Teixeira, Luciana Barcellos, Ferla, Alcindo Antônio, Gouveia, Helga Geremias, Anschau, Fernando, Oliveira, Dora Lúcia Leidens Correa de",10.1590/1983-1447.2016.01.52287,Social Vulnerability Index,dataset-613
[Homicides and social vulnerability].,Ciencia & saude coletiva,"Tavares, Ricardo, Catalan, Valeria Dutra Batista, Romano, Pedro Machado de Melo, Melo, Elza Machado",10.1590/1413-81232015213.12362015,Social Vulnerability Index,dataset-613
Dental caries and social factors: impact on quality of life in Brazilian children.,Brazilian oral research,"Martins, Milene Torres, Sardenberg, Fernanda, Vale, Míriam Pimenta, Paiva, Saul Martins, Pordeus, Isabela Almeida",10.1590/1807-3107BOR-2015.vol29.0133,Social Vulnerability Index,dataset-613
"Risk of alcohol dependence: prevalence, related problems and socioeconomic factors.",Ciencia & saude coletiva,"Martins-Oliveira, Juliana Gabrielle, Jorge, Kelly Oliva, Ferreira, Raquel Conceição, Ferreira, Efigênia Ferreira E, Vale, Míriam Pimenta, Zarzar, Patrícia Maria",10.1590/1413-81232015211.00652015,Social Vulnerability Index,dataset-613
Social Vulnerability and Leisure-time Physical Inactivity among US Adults.,American journal of health behavior,"An, Ruopeng, Xiang, Xiaoling",10.5993/AJHB.39.6.2,Social Vulnerability Index,dataset-613
Social Vulnerability and Ebola Virus Disease in Rural Liberia.,PloS one,"Stanturf, John A, Goodrick, Scott L, Warren, Melvin L, Charnley, Susan, Stegall, Christie M",10.1371/journal.pone.0137208,Social Vulnerability Index,dataset-613
Oral Health-Related Quality of Life and Traumatic Dental Injuries in Young Permanent Incisors in Brazilian Schoolchildren: A Multilevel Approach.,PloS one,"Freire-Maia, Fernanda Bartolomeo, Auad, Sheyla Márcia, Abreu, Mauro Henrique Nogueira Guimarães de, Sardenberg, Fernanda, Martins, Milene Torres, Paiva, Saul Martins, Pordeus, Isabela Almeida, Vale, Míriam Pimenta",10.1371/journal.pone.0135369,Social Vulnerability Index,dataset-613
"Cumulative impact of health deficits, social vulnerabilities, and protective factors on cognitive dynamics in late life: a multistate modeling approach.",Alzheimer's research & therapy,"Armstrong, Joshua J, Mitnitski, Arnold, Andrew, Melissa K, Launer, Lenore J, White, Lon R, Rockwood, Kenneth",10.1186/s13195-015-0120-7,Social Vulnerability Index,dataset-613
Tobacco use and friendship networks: a cross-sectional study among Brazilian adolescents.,Ciencia & saude coletiva,"Jorge, Kelly Oliva, Cota, Luís Otavio, e Ferreira, Efigênia Ferreira, do Vale, Miriam Pimenta, Kawachi, Ichiro, Zarzar, Patrícia Maria",10.1590/1413-81232015205.13542014,Social Vulnerability Index,dataset-613
Modelling social vulnerability in sub-Saharan West Africa using a geographical information system.,"Jamba (Potchefstroom, South Africa)","Lawal, Olanrewaju, Arokoyu, Samuel B",10.4102/jamba.v7i1.155,Social Vulnerability Index,dataset-613
Social vulnerability and survival across levels of frailty in the Honolulu-Asia Aging Study.,Age and ageing,"Armstrong, Joshua J, Andrew, Melissa K, Mitnitski, Arnold, Launer, Lenore J, White, Lon R, Rockwood, Kenneth",10.1093/ageing/afv016,Social Vulnerability Index,dataset-613
Social vulnerability index for the older people-Hong Kong and New York City as examples.,Journal of urban health : bulletin of the New York Academy of Medicine,"Chau, Pui Hing, Gusmano, Michael K, Cheng, Joanna O Y, Cheung, Sai Hei, Woo, Jean",10.1007/s11524-014-9901-8,Social Vulnerability Index,dataset-613
"Social vulnerability as a predictor of mortality and disability: cross-country differences in the survey of health, aging, and retirement in Europe (SHARE).",Aging clinical and experimental research,"Wallace, Lindsay M K, Theou, Olga, Pena, Fernando, Rockwood, Kenneth, Andrew, Melissa K",10.1007/s40520-014-0271-6,Social Vulnerability Index,dataset-613
[Development and validation of a social vulnerability index applied to public policies of the Unified Health System (SUS)].,Ciencia & saude coletiva,"Drachler, Maria de Lourdes, Lobato, Marcos Antônio de Oliveira, Lermen, José Inácio, Fagundes, Sandra, Ferla, Alcindo Antonio, Drachler, Carlos Wietzke, Teixeira, Luciana Barcellos, Leite, José Carlos de Carvalho",,Social Vulnerability Index,dataset-613
[The social vulnerability index regarding Medellín's disabled population].,"Revista de salud publica (Bogota, Colombia)","Cardona-Arango, Doris, Agudelo-Martínez, Alejandra, Restrepo-Molina, Lucas, Segura-Cardona, Angela M",,Social Vulnerability Index,dataset-613
Social vulnerability from a social ecology perspective: a cohort study of older adults from the National Population Health Survey of Canada.,BMC geriatrics,"Andrew, Melissa K, Keefe, Janice M",10.1186/1471-2318-14-90,Social Vulnerability Index,dataset-613
"The prevalence of inhalant use and associated factors among adolescents in Belo Horizonte, Brazil.",Ciencia & saude coletiva,"Silva-Oliveira, Fernando, Jorge, Kelly Oliva, Ferreira e Ferreira, Efigênia, Vale, Míriam Pimenta, Kawachi, Ichiro, Zarzar, Patrícia Maria",,Social Vulnerability Index,dataset-613
Local spatial and temporal factors influencing population and societal vulnerability to natural disasters.,Risk analysis : an official publication of the Society for Risk Analysis,"Zhou, Yang, Li, Ning, Wu, Wenxiang, Wu, Jidong, Shi, Peijun",10.1111/risa.12193,Social Vulnerability Index,dataset-613
Adherence of the dysphonic teachers in speech therapy.,CoDAS,"Santos, Lívia Rodrigues, Almeida, Letícia, Teixeira, Letícia Caldas, Bassi, Iara, Assunção, Ada Ávila, Gama, Ana Cristina Côrtes",,Social Vulnerability Index,dataset-613
Factors associated with dental caries in Brazilian children: a multilevel approach.,Community dentistry and oral epidemiology,"Martins, M T, Sardenberg, F, Abreu, M H, Vale, M P, Paiva, S M, Pordeus, I A",10.1111/cdoe.12087,Social Vulnerability Index,dataset-613
"Relationship between tasks performed, personality traits, and sleep bruxism in Brazilian school children--a population-based cross-sectional study.",PloS one,"Serra-Negra, Junia Maria, Paiva, Saul Martins, Abreu, Mauro Henrique, Flores-Mendoza, Carmen Elvira, Pordeus, Isabela Almeida",10.1371/journal.pone.0080075,Social Vulnerability Index,dataset-613
"Signs, symptoms, parafunctions and associated factors of parent-reported sleep bruxism in children: a case-control study.",Brazilian dental journal,"Serra-Negra, Júnia Maria, Paiva, Saul Martins, Auad, Sheyla Márcia, Ramos-Jorge, Maria Letícia, Pordeus, Isabela Almeida",,Social Vulnerability Index,dataset-613
Social vulnerability and traumatic dental injury among Brazilian schoolchildren: a population-based study.,International journal of environmental research and public health,"Bendo, Cristiane B, Vale, Miriam P, Figueiredo, Lícian D, Pordeus, Isabela A, Paiva, Saul M",,Social Vulnerability Index,dataset-613
Measuring Capacity for Resilience among Coastal Counties of the US Northern Gulf of Mexico Region.,American journal of climate change,"Reams, Margaret A, Lam, Nina S N, Baker, Ariele",,Social Vulnerability Index,dataset-613
Cumulative environmental vulnerability and environmental justice in California's San Joaquin Valley.,International journal of environmental research and public health,"Huang, Ganlin, London, Jonathan K",10.3390/ijerph9051593,Social Vulnerability Index,dataset-613
"Association between binge drinking, type of friends and gender: a cross-sectional study among Brazilian adolescents.",BMC public health,"Zarzar, Patrícia M, Jorge, Kelly O, Oksanen, Tuula, Vale, Miriam P, Ferreira, Efigênia F, Kawachi, Ichiro",10.1186/1471-2458-12-257,Social Vulnerability Index,dataset-613
Self-reported dental fear among dental students and their patients.,International journal of environmental research and public health,"Serra-Negra, Junia, Paiva, Saul M, Oliveira, Mauricio, Ferreira, Efigenia, Freire-Maia, Fernanda, Pordeus, Isabela",10.3390/ijerph9010044,Social Vulnerability Index,dataset-613
"Mapping cumulative environmental effects, social vulnerability, and health in the San Joaquin Valley, California.",American journal of public health,"Huang, Ganlin, London, Jonathan",10.2105/AJPH.2011.300466,Social Vulnerability Index,dataset-613
The relationship of pain and cognitive impairment with social vulnerability--an analysis of the Canadian Study of Health and Aging.,"Pain medicine (Malden, Mass.)","Shega, Joseph W, Andrew, Melissa, Hemmerich, Josh, Cagney, Kathleen A, Ersek, Mary, Weiner, Debra K, Dale, William",10.1111/j.1526-4637.2011.01309.x,Social Vulnerability Index,dataset-613
Prevalence and association of dental injuries with socioeconomic conditions and alcohol/drug use in adolescents between 15 and 19 years of age.,Dental traumatology : official publication of International Association for Dental Traumatology,"Jorge, Kelly O, Oliveira Filho, Paulo M, Ferreira, Efigênia F, Oliveira, Ana C, Vale, Miriam P, Zarzar, Patrícia M",10.1111/j.1600-9657.2011.01056.x,Social Vulnerability Index,dataset-613
"[Teenage pregnancy rates and socioeconomic characteristics of municipalities in São Paulo State, Southeast Brazil: a spatial analysis].",Cadernos de saude publica,"Martinez, Edson Zangiacomi, Roza, Daiane Leite da, Caccia-Bava, Maria do Carmo Gullaci Guimarães, Achcar, Jorge Alberto, Dal-Fabbro, Amaury Lelis",,Social Vulnerability Index,dataset-613
Association between treated/untreated traumatic dental injuries and impact on quality of life of Brazilian schoolchildren.,Health and quality of life outcomes,"Bendo, Cristiane B, Paiva, Saul M, Torres, Cíntia S, Oliveira, Ana C, Goursand, Daniela, Pordeus, Isabela A, Vale, Miriam P",10.1186/1477-7525-8-114,Social Vulnerability Index,dataset-613
Prevalence of sleep bruxism in a group of Brazilian schoolchildren.,European archives of paediatric dentistry : official journal of the European Academy of Paediatric Dentistry,"Serra-Negra, J M, Paiva, S M, Seabra, A P, Dorella, C, Lemos, B F, Pordeus, I A",,Social Vulnerability Index,dataset-613
Prevalence and associated factors of traumatic dental injuries in Brazilian schoolchildren.,Journal of public health dentistry,"Bendo, Cristiane B, Paiva, Saul M, Oliveira, Ana C, Goursand, Daniela, Torres, Cíntia S, Pordeus, Isabela A, Vale, Miriam P",10.1111/j.1752-7325.2010.00190.x,Social Vulnerability Index,dataset-613
Predisposing factors for traumatic dental injuries in Brazilian preschool children.,European journal of paediatric dentistry,"Viegas, C M, Scarpelli, A C, Carvalho, A C, Ferreira, F M, Pordeus, I A, Paiva, S M",,Social Vulnerability Index,dataset-613
Social vulnerability predicts cognitive decline in a prospective cohort of older Canadians.,Alzheimer's & dementia : the journal of the Alzheimer's Association,"Andrew, Melissa K, Rockwood, Kenneth",10.1016/j.jalz.2009.11.001,Social Vulnerability Index,dataset-613
Family and social vulnerability: a study with octogenarians.,Revista latino-americana de enfermagem,"Pavarini, Sofia Cristina Iost, Barha, Elizabeth Joan, Mendiondo, Marisa Silvana Zazzetta de, Filizola, Carmen Lucia Alves, Petrilli Filho, José Fernando, Santos, Ariene Angelini Dos",,Social Vulnerability Index,dataset-613
Influence of psychosocial factors on the development of sleep bruxism among children.,International journal of paediatric dentistry,"Serra-Negra, Junia M, Ramos-Jorge, Maria L, Flores-Mendoza, Carmen E, Paiva, Saul M, Pordeus, Isabela A",10.1111/j.1365-263X.2009.00973.x,Social Vulnerability Index,dataset-613
[Birth weight intra-urban differentials in the city of São Paulo].,Revista de saude publica,"Minuci, Elaine Garcia, Almeida, Márcia Furquim de",,Social Vulnerability Index,dataset-613
Prevalence and factors associated to dental trauma in infants 1-3 years of age.,Dental traumatology : official publication of International Association for Dental Traumatology,"Jorge, Kelly Oliva, Moysés, Samuel Jorge, Ferreira e Ferreira, Efigênia, Ramos-Jorge, Maria Letícia, de Araújo Zarzar, Patrícia Maria Pereira",10.1111/j.1600-9657.2008.00730.x,Social Vulnerability Index,dataset-613
A sensitivity analysis of the social vulnerability index.,Risk analysis : an official publication of the Society for Risk Analysis,"Schmidtlein, Mathew C, Deutsch, Roland C, Piegorsch, Walter W, Cutter, Susan L",10.1111/j.1539-6924.2008.01072.x,Social Vulnerability Index,dataset-613
"Social vulnerability, frailty and mortality in elderly people.",PloS one,"Andrew, Melissa K, Mitnitski, Arnold B, Rockwood, Kenneth",10.1371/journal.pone.0002232,Social Vulnerability Index,dataset-613
[Health problems and social vulnerability in immigrants admitted for an infectious disease: a case-control study].,Revista clinica espanola,"Faura, T, García, F, Isla, P, López, C, Robau, M, Moreno, A, Tricas, A, Ligero, C, Robles, D, Carmona, S, Miró, J M, Gatell, J M",,Social Vulnerability Index,dataset-613
"[Social vulnerability, social isolation of chronic psychiatric patients].",Wiener medizinische Wochenschrift (1946),"Henkel, H, Schmitz, M, Berghofer, G, Lang, A, Kager, A, Steiner, E, Schmidl, F, Rudas, S",,Social Vulnerability Index,dataset-613
Creation of a social vulnerability index for justice in health planning.,Family & community health,"Dever, G E, Sciegaj, M, Wade, T E, Lofton, T C",,Social Vulnerability Index,dataset-613
