api,doi,title,url,search_term,dataset,valid,pdf
dimensions,10.1111/agec.12497,Off‐farm work and technical efficiency on U.S. dairies,https://app.dimensions.ai/discover/publication?search_type=kws&search_field=full_search&search_text=Off%E2%80%90farm%20work%20and%20technical%20efficiency%20on%20U.S.%20dairies,Agricultural Resource Management Survey,dataset-870,,
dimensions,10.1111/cjag.12027,"Off‐Farm Work, Intensity of Government Payments, and Farm Exits: Evidence from a National Survey in the United States",https://app.dimensions.ai/discover/publication?search_type=kws&search_field=full_search&search_text=Off%E2%80%90Farm%20Work%2C%20Intensity%20of%20Government%20Payments%2C%20and%20Farm%20Exits%3A%20Evidence%20from%20a%20National%20Survey%20in%20the%20United%20States,Agricultural Resource Management Survey,dataset-870,,
dimensions,10.1093/ajae/aat004,Old Farmer Pension Program and Farm Succession: Evidence from a Population‐Based Survey of Farm Households in Taiwan,https://app.dimensions.ai/discover/publication?search_type=kws&search_field=full_search&search_text=Old%20Farmer%20Pension%20Program%20and%20Farm%20Succession%3A%20Evidence%20from%20a%20Population%E2%80%90Based%20Survey%20of%20Farm%20Households%20in%20Taiwan,Agricultural Resource Management Survey,dataset-870,,
openaire,,OLT COUNTY'S RURAL DEVELOPMENT THROUGH AGROTOURISM,http://managementjournal.usamv.ro/pdf/vol3_4/Art45.pdf,Agricultural Resource Management Survey,dataset-870,,
dimensions,10.1016/j.csda.2017.10.001,On nonparametric estimation of the latent distribution for ordinal data,https://app.dimensions.ai/discover/publication?search_type=kws&search_field=full_search&search_text=On%20nonparametric%20estimation%20of%20the%20latent%20distribution%20for%20ordinal%20data,Agricultural Resource Management Survey,dataset-870,,
openaire,10.22004/ag.econ.291945,On the Doorstep of the Information Age: Recent Adoption of Precision Agriculture,http://dx.doi.org/10.22004/ag.econ.291945,Agricultural Resource Management Survey,dataset-870,,
dimensions,10.13128/bae-19162,Once part-timer always part-timer? Causes for persistence in off farm work state of farmers,https://app.dimensions.ai/discover/publication?search_type=kws&search_field=full_search&search_text=Once%20part-timer%20always%20part-timer%3F%20Causes%20for%20persistence%20in%20off%20farm%20work%20state%20of%20farmers,Agricultural Resource Management Survey,dataset-870,,
dimensions,10.3389/fclim.2019.00002,Opportunities for Carbon Dioxide Removal Within the United States Department of Agriculture,https://app.dimensions.ai/discover/publication?search_type=kws&search_field=full_search&search_text=Opportunities%20for%20Carbon%20Dioxide%20Removal%20Within%20the%20United%20States%20Department%20of%20Agriculture,Agricultural Resource Management Survey,dataset-870,,
dimensions,10.1093/ajae/aau055,Optimal Sequential Plantings of Corn and Soybeans Under Price Uncertainty,https://app.dimensions.ai/discover/publication?search_type=kws&search_field=full_search&search_text=Optimal%20Sequential%20Plantings%20of%20Corn%20and%20Soybeans%20Under%20Price%20Uncertainty,Agricultural Resource Management Survey,dataset-870,,
dimensions,10.1016/j.ijpe.2019.06.011,Optimal strategies for a three-level contract-farming supply chain with subsidy,https://app.dimensions.ai/discover/publication?search_type=kws&search_field=full_search&search_text=Optimal%20strategies%20for%20a%20three-level%20contract-farming%20supply%20chain%20with%20subsidy,Agricultural Resource Management Survey,dataset-870,,
pubmed,10.7717/peerj.690,Optimization in the utility maximization framework for conservation planning: a comparison of solution procedures in a study of multifunctional agriculture.,https://www.ncbi.nlm.nih.gov/pubmed/25538868,Agricultural Resource Management Survey,dataset-870,,
openaire,10.4314/ijard.v7i1.2623,"Optimization of resource use among pig farmers in Imo State, Nigeria",https://www.ajol.info/index.php/ijard/article/view/2623,Agricultural Resource Management Survey,dataset-870,,
dimensions,10.1016/j.ecolecon.2012.03.013,Organic farmers or conventional farmers: Where's the money?,https://app.dimensions.ai/discover/publication?search_type=kws&search_field=full_search&search_text=Organic%20farmers%20or%20conventional%20farmers%3A%20Where%27s%20the%20money%3F,Agricultural Resource Management Survey,dataset-870,,
dimensions,10.1093/ajae/aas072,Panel Data Estimation Techniques and Farm‐level Data Models,https://app.dimensions.ai/discover/publication?search_type=kws&search_field=full_search&search_text=Panel%20Data%20Estimation%20Techniques%20and%20Farm%E2%80%90level%20Data%20Models,Agricultural Resource Management Survey,dataset-870,,
pubmed,10.1007/s11250-019-01968-1,"Participatory definition of trait preferences and breeding practices of goats in Aba'ala, Afar region: as input for designing genetic improvement program.",https://www.ncbi.nlm.nih.gov/pubmed/31273581,Agricultural Resource Management Survey,dataset-870,,
openaire,10.22004/ag.econ.189084,Pasture-Based versus Conventional Milk Production: Where Is the Profit?,http://dx.doi.org/10.22004/ag.econ.189084,Agricultural Resource Management Survey,dataset-870,,
openaire,,Pasture-Based versus Conventional Milk Production: Where Is the Profit?,http://purl.umn.edu/189084,Agricultural Resource Management Survey,dataset-870,,
dimensions,10.1017/s1074070800029096,Pasture-Based versus Conventional Milk Production: Where Is the Profit?,https://app.dimensions.ai/discover/publication?search_type=kws&search_field=full_search&search_text=Pasture-Based%20versus%20Conventional%20Milk%20Production%3A%20Where%20Is%20the%20Profit%3F,Agricultural Resource Management Survey,dataset-870,,
pubmed,,Pathogens of domestic and free-ranging ungulates: global climate change in temperate to boreal latitudes across North America.,https://www.ncbi.nlm.nih.gov/pubmed/18819675,Agricultural Resource Management Survey,dataset-870,,
openaire,10.22004/ag.econ.97465,Pathways of development in the hillsides of Honduras,http://dx.doi.org/10.22004/ag.econ.97465,Agricultural Resource Management Survey,dataset-870,,
openaire,10.22004/ag.econ.124277,"Pathways through the Plantation: Oil Palm Smallholders and Livelihood Strategies in Sarawak, Malaysia",http://dx.doi.org/10.22004/ag.econ.124277,Agricultural Resource Management Survey,dataset-870,,
pubmed,10.2166/wh.2014.212,Perceived agricultural runoff impact on drinking water.,https://www.ncbi.nlm.nih.gov/pubmed/25252352,Agricultural Resource Management Survey,dataset-870,,
openaire,10.4314/ejesm.v6i6.3,"Perception of “Fadama” III Participating Farmers on Pests and Diseases and the use of Integrated Pest Management Control Strategy in Kwara State, Nigeria",https://www.ajol.info/index.php/ejesm/article/view/96658,Agricultural Resource Management Survey,dataset-870,,
pubmed,,"Perceptions, preferences, and reactions of local inhabitants in Vikos-Aoos National Park, Greece.",https://www.ncbi.nlm.nih.gov/pubmed/11568846,Agricultural Resource Management Survey,dataset-870,,
pubmed,10.1007/s11250-008-9294-3,Performance and limitation of two dairy production systems in the North western Ethiopian highlands.,https://www.ncbi.nlm.nih.gov/pubmed/19083118,Agricultural Resource Management Survey,dataset-870,,
openaire,10.33772/bpsosek.v13i24.5942,Perilaku Petani Dalam Manajemen Sumber Daya Pertanian Tanaman Pangan di Wilayah Muna Barat Provinsi Sulawesi Tenggara,http://ojs.uho.ac.id/index.php/sosek/article/view/5942,Agricultural Resource Management Survey,dataset-870,,
dimensions,10.1016/j.iswcr.2019.03.002,Persistence in tillage decisions: Aggregate data analysis,https://app.dimensions.ai/discover/publication?search_type=kws&search_field=full_search&search_text=Persistence%20in%20tillage%20decisions%3A%20Aggregate%20data%20analysis,Agricultural Resource Management Survey,dataset-870,,
pubmed,10.5993/AJHB.39.4.9,Perspectives of Stakeholders on Implementing a Farm-to-University Program at an HBCU.,https://www.ncbi.nlm.nih.gov/pubmed/26018101,Agricultural Resource Management Survey,dataset-870,,
pubmed,10.1007/s11356-017-0493-1,Perspectives on impacts of water quality on agriculture and community well-being-a key informant study from Sri Lanka.,https://www.ncbi.nlm.nih.gov/pubmed/29103115,Agricultural Resource Management Survey,dataset-870,,