api,doi,title,url,search_term,dataset,pdf
dimensions,10.1111/agec.12497,Off‐farm work and technical efficiency on U.S. dairies,https://onlinelibrary.wiley.com/doi/full/10.1111/agec.12497,Agricultural Resource Management Survey,dataset-870,
dimensions,10.1111/cjag.12027,"Off‐Farm Work, Intensity of Government Payments, and Farm Exits: Evidence from a National Survey in the United States",https://onlinelibrary.wiley.com/doi/10.1111/cjag.12027,Agricultural Resource Management Survey,dataset-870,
dimensions,10.1016/j.csda.2017.10.001,On nonparametric estimation of the latent distribution for ordinal data,http://mason.gmu.edu/~lzhang18/papers/mimeo2661_Ghosh.pdf,Agricultural Resource Management Survey,dataset-870,http://mason.gmu.edu/~lzhang18/papers/mimeo2661_Ghosh.pdf
openaire,10.22004/ag.econ.291945,On the Doorstep of the Information Age: Recent Adoption of Precision Agriculture,http://dx.doi.org/10.22004/ag.econ.291945,Agricultural Resource Management Survey,dataset-870,https://www.ers.usda.gov/webdocs/publications/44573/5731_eib80_reportsummary_1_.pdf?v=0
dimensions,10.1016/j.ecolecon.2012.03.013,Organic farmers or conventional farmers: Where's the money?,https://www.sciencedirect.com/science/article/pii/S0921800912001279,Agricultural Resource Management Survey,dataset-870,
openaire,10.22004/ag.econ.189084,Pasture-Based versus Conventional Milk Production: Where Is the Profit?,http://dx.doi.org/10.22004/ag.econ.189084,Agricultural Resource Management Survey,dataset-870,https://www.cambridge.org/core/services/aop-cambridge-core/content/view/9EC2B93EBFD2DBC4C2FC02C681ECC007/S1074070800029096a.pdf/pasturebased_versus_conventional_milk_production_where_is_the_profit.pdf
