author,year,publication and journal,dataset,datadrop origin,title,doi,url,valid
"Prenovitz, S. J., G. R. Cohen, R. G. Ehrenberg and G. H. Jakubson ",2016,"""An evaluation of the Mellon Mays Undergraduate Fellowship's effect on PhD production at non-UNCF institutions."" Economics of Education Review 53: 284-295.",dataset-370,EndNote SED library 11/7/2017,,,,
"Fiegener, M. K. and S. L. Proudfoot ",2013,"Baccalaureate Origins of U.S.-trained S&E Doctorate Recipients. InfoBrief, National Science Foundation.",dataset-370,EndNote SED library 11/7/2017,,,,
"Mervis, J. ",2016,"""BEHIND THE NUMBERS. 'Employment crisis' for new Ph.D.s is an illusion."" Science 352(6288): 880.",dataset-370,EndNote SED library 11/7/2017,,,,
"Sharpe, R. V. and O. H. Swinton ",2012,"""Beyond Anecdotes: A Quantitative Examination of Black Women in Academe."" The Review of Black Political Economy 39(3): 341-352.",dataset-370,EndNote SED library 11/7/2017,,,,
"Jones, E. ",2002-03 ,"""Beyond supply and demand: Assessing the Ph.D. job market."" Occupational Outlook Quarterly (BLS)(Winter 2002-03).",dataset-370,EndNote SED library 11/7/2017,,,,