datasets,doi,journal,search_term,title,url
dataset-623,10.3390/rs11212493,Remote Sensing,C-CAP data,Quantifying Spatiotemporal Patterns and Major Explanatory Factors of Urban Expansion in Miami Metropolitan Area During 1992–2016,http://dx.doi.org/10.3390/rs11212493
dataset-623,10.3389/fmars.2019.00511,Frontiers in Marine Science,C-CAP data,Voluntary Restoration: Mitigation's Silent Partner in the Quest to Reverse Coastal Wetland Loss in the USA,http://dx.doi.org/10.3389/fmars.2019.00511
dataset-623,10.1016/j.jag.2019.03.013,"{'id': 'jour.1045706', 'title': 'International Journal of Applied Earth Observation and Geoinformation'}",C-CAP data,High-resolution mapping of biomass and distribution of marsh and forested wetlands in southeastern coastal Louisiana,
dataset-623,10.1080/10402381.2019.1606868,"{'id': 'jour.1045776', 'title': 'Lake and Reservoir Management'}",C-CAP data,Stability of Lake Sammamish phosphorus despite land use changes,
dataset-623,10.1016/j.landusepol.2019.01.029,"{'id': 'jour.1027840', 'title': 'Land Use Policy'}",C-CAP data,Specialized governance and regional land-use outcomes: A spatial analysis of Florida community development districts,
dataset-623,10.1002/jwmg.21605,"{'id': 'jour.1013866', 'title': 'Journal of Wildlife Management'}",C-CAP data,Seasonal habitat selection and movements by mottled ducks,
dataset-623,10.1016/j.landurbplan.2018.04.018,Landscape and Urban Planning,C-CAP data,Modeling non-stationary urban growth: The SPRAWL model and the ecological impacts of development,https://doi.org/10.1016/j.landurbplan.2018.04.018
dataset-623,10.1016/j.coastaleng.2017.11.005,"{'id': 'jour.1137566', 'title': 'Coastal Engineering'}",C-CAP data,The influence of bed friction variability due to land cover on storm-driven barrier island morphodynamics,
dataset-623,10.1080/09640568.2017.1301896,"{'id': 'jour.1138132', 'title': 'Journal of Environmental Planning and Management'}",C-CAP data,"Flexible, collaborative, and meaningful? The case of the US coastal nonpoint pollution control program",
dataset-623,10.1016/j.landurbplan.2017.09.008,"{'id': 'jour.1028245', 'title': 'Landscape and Urban Planning'}",C-CAP data,Disamenity to amenity: Spatial and temporal patterns of social response to river restoration progress,
dataset-623,10.1016/j.apgeog.2017.11.003,"{'id': 'jour.1027530', 'title': 'Applied Geography'}",C-CAP data,"Land cover, lightning frequency, and turbulent fluxes over Southern Louisiana",
dataset-623,10.1016/j.landurbplan.2017.07.003,"{'id': 'jour.1028245', 'title': 'Landscape and Urban Planning'}",C-CAP data,Evaluating the effects of open space configurations in reducing flood damage along the Gulf of Mexico coast,
dataset-623,10.1007/s12237-017-0209-2,"{'id': 'jour.1295073', 'title': 'Chesapeake Science'}",C-CAP data,Changes in Habitat Availability for Multiple Life Stages of Diamondback Terrapins (Malaclemys terrapin) in Chesapeake Bay in Response to Sea Level Rise,
dataset-623,10.1016/j.ocecoaman.2016.12.014,Ocean & Coastal Management,C-CAP data,Threatened protection: Sea level rise and coastal protected lands of the eastern United States,https://doi.org/10.1016/j.ocecoaman.2016.12.014
dataset-623,10.1175/mwr-d-16-0149.1,"{'id': 'jour.1136879', 'title': 'Monthly Weather Review'}",C-CAP data,A Measure-Theoretic Algorithm for Estimating Bottom Friction in a Coastal Inlet: Case Study of Bay St. Louis during Hurricane Gustav (2008),
dataset-623,10.14358/pers.82.9.711,"{'id': 'jour.1042026', 'title': 'Photogrammetric Engineering & Remote Sensing'}",C-CAP data,Accuracy Assessment of NOAA Coastal Change Analysis Program 2006-2010 Land Cover and Land Cover Change Data,
dataset-623,10.1080/13658816.2016.1144886,"{'id': 'jour.1027881', 'title': 'International Journal of Geographical Information Science'}",C-CAP data,The impact of Hurricane Katrina on urban growth in Louisiana: an analysis using data mining and simulation approaches,
dataset-623,10.1016/s0099-1112(16)30122-7,"{'id': 'jour.1042026', 'title': 'Photogrammetric Engineering & Remote Sensing'}",C-CAP data,Accuracy Assessment of NOAA Coastal Change Analysis Program 2006-2010 Land Cover and Land Cover Change Data,
dataset-623,10.3390/land5030025,Land,C-CAP data,Analysis and Prediction of Land Use Changes Related to Invasive Species and Major Driving Forces in the State of Connecticut,http://www.mdpi.com/2073-445X/5/3/25/pdf
dataset-623,10.3390/rs70911695,Remote Sensing,C-CAP data,Evaluation of Airborne Lidar Elevation Surfaces for Propagation of Coastal Inundation: The Importance of Hydrologic Connectivity,https://doi.org/10.3390/rs70911695
dataset-623,10.1007/s12237-014-9855-9,"{'id': 'jour.1295073', 'title': 'Chesapeake Science'}",C-CAP data,A National Assessment of Stressors to Estuarine Fish Habitats in the Contiguous USA,
dataset-623,10.4031/mtsj.49.2.13,"{'id': 'jour.1127195', 'title': 'Marine Technology Society Journal'}",C-CAP data,The National Ocean Service: Positioning America for the Future,
dataset-623,10.1007/s10661-015-4298-8,"{'id': 'jour.1095684', 'title': 'Environmental Monitoring and Assessment'}",C-CAP data,Modeling land use and land cover changes in a vulnerable coastal region using artificial neural networks and cellular automata,
dataset-623,10.1007/s12237-013-9647-7,"{'id': 'jour.1295073', 'title': 'Chesapeake Science'}",C-CAP data,Stakeholder Perceptions of Coastal Habitat Ecosystem Services,
dataset-623,10.3390/rs6087424,Remote Sensing,C-CAP data,The Multi-Resolution Land Characteristics (MRLC) Consortium — 20 Years of Development and Integration of USA National Land Cover Data,https://www.mdpi.com/2072-4292/6/8/7424/pdf
dataset-623,10.1080/10106049.2013.798357,Geocarto International,C-CAP data,"Geospatial method for computing supplemental multi-decadal US coastal land use and land cover classification products, using Landsat data and C-CAP products",http://hdl.handle.net/2060/20120014242
dataset-623,10.1007/s10661-014-3631-y,"{'id': 'jour.1095684', 'title': 'Environmental Monitoring and Assessment'}",C-CAP data,Application of a three-tier framework to assess ecological condition of Gulf of Mexico coastal wetlands,
dataset-623,10.1080/02723646.2014.898126,"{'id': 'jour.1141431', 'title': 'Physical Geography'}",C-CAP data,"Spatial persistence and temporal patterns in vegetation cover across Florida, 1982–2006",
dataset-623,10.1002/2013jc009604,Journal of Geophysical Research Oceans,C-CAP data,Uncertainty in hurricane surge simulation due to land cover specification,https://agupubs.onlinelibrary.wiley.com/doi/pdf/10.1002/2013JC009604
dataset-623,10.1016/j.landurbplan.2013.05.004,"{'id': 'jour.1028245', 'title': 'Landscape and Urban Planning'}",C-CAP data,"Identifying, quantifying and classifying agricultural opportunities for land use planning",
dataset-623,10.1111/gcb.12126,"{'id': 'jour.1132303', 'title': 'Global Change Biology'}",C-CAP data,Winter climate change and coastal wetland foundation species: salt marshes vs. mangrove forests in the southeastern United States,
dataset-623,10.1016/j.ecohyd.2013.03.003,"{'id': 'jour.1142317', 'title': 'Ecohydrology & Hydrobiology'}",C-CAP data,Temporal land cover analysis for net ecosystem improvement,
dataset-623,10.1007/s11270-011-1007-2,"{'id': 'jour.1320065', 'title': 'Water, Air, & Soil Pollution'}",C-CAP data,"Relationship Between Watershed Land-Cover/Land-Use Change and Water Turbidity Status of Tampa Bay Major Tributaries, Florida, USA",
dataset-623,10.2747/1548-1603.49.2.202,"{'id': 'jour.1046300', 'title': 'GIScience & Remote Sensing'}",C-CAP data,Observational Scale and Modeled Potential Residential Loss from a Storm Surge,
dataset-623,10.1016/j.jhydrol.2012.01.023,"{'id': 'jour.1126746', 'title': 'Journal of Hydrology'}",C-CAP data,Hydrologic effect of groundwater development in a small mountainous tropical watershed,
dataset-623,10.1559/152304063913,"{'id': 'jour.1041893', 'title': 'Cartography and Geographic Information Science'}",C-CAP data,A Process Oriented Areal Interpolation Technique: A Coastal County Example,
dataset-623,10.1097/aia.0b013e31821a00d0,International Anesthesiology Clinics,C-CAP data,"Forecast for Perineural Analgesia Procedures for Ambulatory Surgery of the Knee, Foot, and Ankle: Applying Patient-centered Paradigm Shifts",http://europepmc.org/articles/pmc3427650?pdf=render
dataset-623,10.1111/j.1365-2486.2011.02497.x,"{'id': 'jour.1132303', 'title': 'Global Change Biology'}",C-CAP data,"The impact of sea‐level rise on Snowy Plovers in Florida: integrating geomorphological, habitat, and metapopulation models",
dataset-623,10.1007/s00267-011-9690-8,Environmental Management,C-CAP data,The Vulnverability Cube: A Multi-Dimensional Framework for Assessing Relative Vulnerability,https://link.springer.com/content/pdf/10.1007%2Fs00267-011-9690-8.pdf
dataset-623,10.1109/geoinformatics.2011.5981058,,C-CAP data,"Data Application of Multi-temporal and Multi-source Data for Land Cover Change Detection in Guam, USA",
dataset-623,10.1007/s11852-010-0127-y,"{'id': 'jour.1136116', 'title': 'Journal of Coastal Conservation'}",C-CAP data,"An assessment of coastal land-use and land-cover change from 1974–2008 in the vicinity of Mobile Bay, Alabama",
dataset-623,10.1007/s10661-010-1381-z,"{'id': 'jour.1095684', 'title': 'Environmental Monitoring and Assessment'}",C-CAP data,"An environmental assessment of a small shallow lake (Little Black Lake, MI) threatened by urbanization",
dataset-623,10.1016/j.jhydrol.2010.06.002,"{'id': 'jour.1126746', 'title': 'Journal of Hydrology'}",C-CAP data,"An analysis of the relationship between land use and arsenic, vanadium, nitrate and boron contamination in the Gulf Coast aquifer of Texas",
dataset-623,10.1007/s00267-010-9453-y,"{'id': 'jour.1086396', 'title': 'Environmental Management'}",C-CAP data,A Water Quality Model for Regional Stream Assessment and Conservation Strategy Development,
dataset-623,10.1016/j.apgeog.2008.08.009,"{'id': 'jour.1027530', 'title': 'Applied Geography'}",C-CAP data,Tsunami exposure estimation with land-cover data: Oregon and the Cascadia subduction zone,
dataset-623,10.1111/j.1752-1688.2008.00215.x,"{'id': 'jour.1081849', 'title': 'JAWRA Journal of the American Water Resources Association'}",C-CAP data,Estimating the Variability and Confidence of Land Use and Imperviousness Relationships at a Regional Scale1,
dataset-623,10.1177/153944920702700404,"{'id': 'jour.1294821', 'title': 'OTJR Occupation Participation and Health'}",C-CAP data,The Client-Clinician Assessment Protocol (C-CAP): Evaluation of its Psychometric Properties for Use with People Aging with Disabilities in Need of Home Modifications,
dataset-623,10.3394/0380-1330(2006)32[607:lulcci]2.0.co;2,Journal of Great Lakes Research,C-CAP data,Land Use Land Cover Change in the U.S. Great Lakes Basin 1992 to 2001,http://files.dnr.state.mn.us/forestry/um/mnforestresources.pdf
dataset-623,10.1109/amtrsi.2005.1469868,,C-CAP data,GIS Management Tools for Estimating Change Trends in Surface Water Quality: An Application of Multi-Temporal Land Cover Data,
dataset-623,10.1109/amtrsi.2005.1469874,,C-CAP data,The Coastal Change Analysis Program: Mapping Change and Monitoring Change Trends in the Coastal Zone,
dataset-623,10.1080/014311699213163,"{'id': 'jour.1122771', 'title': 'International Journal of Remote Sensing'}",C-CAP data,Mapping coastal ecosystems over a steep development gradient using C-CAP protocols,
