rank,publication_id,doi,url,pmid,pmcid,title,source_title,anthology_title,publisher,mesh_terms,pubyear,volume,issue,pagination,open_access,publication_type,authors,authors_affiliations,research_organizations_-_standardized,grid_ids,city_of_research_organization,state_of_research_organization,country_of_research_organization,funder,funder_group,funder_country,uids_of_supporting_grants,supporting_grants,times_cited,recent_citations,rcr,fcr,source_linkout,dimensions_url,for_(anzsrc)_categories,for_1,for_2,for_3,for_4,for_5,rcdc_categories,rcdc_1,rcdc_2,rcdc_3,rcdc_4,rcdc_5,hrcs_hc_categories,hrcs_hc_1,hrcs_hc_2,hrcs_hc_3,hrcs_hc_4,hrcs_hc_5,hrcs_rac_categories,hrcs_rac_1,hrcs_rac_2,hrcs_rac_3,hrcs_rac_4,hrcs_rac_5,health_research_areas,broad_research_areas,icrp_cancer_types,icrp_cancer_types_1,icrp_cancer_types_2,icrp_cancer_types_3,icrp_cancer_types_4,icrp_cancer_types_5,icrp_cso_categories,icrp_cso_1,icrp_cso_2,icrp_cso_3,icrp_cso_4,icrp_cso_5,domain,search_note,norm_rank,dataset
642,pub.1090370297,10.1016/j.jneb.2017.04.026,www.doi.org/10.1016/j.jneb.2017.04.026,28689560,,The Impact of Federal Policy Changes and Initiatives on Breastfeeding Initiation Rates and Attitudes Toward Breastfeeding Among WIC Participants,Journal of Nutrition Education and Behavior,,Elsevier,"Adult; Breast Feeding; Child Nutritional Physiological Phenomena; Child, Preschool; Female; Food Assistance; Health Knowledge, Attitudes, Practice; Health Plan Implementation; Health Promotion; Healthy Diet; Humans; Infant; Infant Nutritional Physiological Phenomena; Infant, Newborn; Male; Maternal Nutritional Physiological Phenomena; Nutrition Policy; United States; United States Department of Agriculture; Young Adult",2017,49,7,s207-s211.e1,Closed,article,"Panzera, Anthony Dominic; Castellanos-Brown, Karen; Paolicelli, Courtney; Morgan, Ruth; Potter, Anna; Berman, Danielle","Panzera, Anthony Dominic (Food and Nutrition Service); Castellanos-Brown, Karen (Food and Nutrition Service); Paolicelli, Courtney (Food and Nutrition Service); Morgan, Ruth (Food and Nutrition Service); Potter, Anna (Food and Nutrition Service); Berman, Danielle (Food and Nutrition Service)",Food and Nutrition Service,grid.478135.c,Alexandria,Virginia,United States,,,,,,5,5,2.68,2.91,,https://app.dimensions.ai/details/publication/pub.1090370297,1117 Public Health and Health Services,1117 Public Health and Health Services,,,,,Pediatric; Prevention; Nutrition,Pediatric,Prevention,Nutrition,,,,,,,,,,,,,,,Population & Society,Public Health,,,,,,,,,,,,,usda,"'(FNS OR ""Food and Nutrition Service "") AND (WIC OR ""women, infants and Children"") AND ""Program Data""'",1,dataset-346
641,pub.1090370297,10.1016/j.jneb.2017.04.026,www.doi.org/10.1016/j.jneb.2017.04.026,28689560,,The Impact of Federal Policy Changes and Initiatives on Breastfeeding Initiation Rates and Attitudes Toward Breastfeeding Among WIC Participants,Journal of Nutrition Education and Behavior,,Elsevier,"Adult; Breast Feeding; Child Nutritional Physiological Phenomena; Child, Preschool; Female; Food Assistance; Health Knowledge, Attitudes, Practice; Health Plan Implementation; Health Promotion; Healthy Diet; Humans; Infant; Infant Nutritional Physiological Phenomena; Infant, Newborn; Male; Maternal Nutritional Physiological Phenomena; Nutrition Policy; United States; United States Department of Agriculture; Young Adult",2017,49,7,s207-s211.e1,Closed,article,"Panzera, Anthony Dominic; Castellanos-Brown, Karen; Paolicelli, Courtney; Morgan, Ruth; Potter, Anna; Berman, Danielle","Panzera, Anthony Dominic (Food and Nutrition Service); Castellanos-Brown, Karen (Food and Nutrition Service); Paolicelli, Courtney (Food and Nutrition Service); Morgan, Ruth (Food and Nutrition Service); Potter, Anna (Food and Nutrition Service); Berman, Danielle (Food and Nutrition Service)",Food and Nutrition Service,grid.478135.c,Alexandria,Virginia,United States,,,,,,5,5,2.68,2.91,,https://app.dimensions.ai/details/publication/pub.1090370297,1117 Public Health and Health Services,1117 Public Health and Health Services,,,,,Pediatric; Prevention; Nutrition,Pediatric,Prevention,Nutrition,,,,,,,,,,,,,,,Population & Society,Public Health,,,,,,,,,,,,,usda,"'(FNS OR ""Food and Nutrition Service "") AND (WIC OR ""women, infants and Children"") AND ""Program Data""'",1,dataset-346
622,pub.1107111621,10.1177/0890334418797318,www.doi.org/10.1177/0890334418797318,30231211,,Another Look at WIC’s Breastfeeding Data: State Totals Reveal More Than Regional Averages,Journal of Human Lactation,,SAGE Publications,,2019,35,1,37-41,Closed,article,"Berkowitz, Shari Salzhauer","Berkowitz, Shari Salzhauer (Mercy College)",Mercy College,grid.419740.f,Dobbs Ferry,New York,United States,,,,,,1,1,0,0,,https://app.dimensions.ai/details/publication/pub.1107111621,1117 Public Health and Health Services,1117 Public Health and Health Services,,,,,Pediatric; Nutrition,Pediatric,Nutrition,,,,,,,,,,,,,,,,,,,,,,,,,,,,,,usda,"'(FNS OR ""Food and Nutrition Service "") AND ( USDA OR "" Economic Research Service"") AND (WIC OR ""women, Infants and children"") AND (State AND (agency OR agencies))'",1,dataset-346
486,pub.1113175197,10.1542/peds.2018-2841,www.doi.org/10.1542/peds.2018-2841,30936251,,WIC Food Package Changes: Trends in Childhood Obesity Prevalence,Pediatrics,,American Academy of Pediatrics (AAP),,2019,143,5,e20182841,Closed,article,"Daepp, Madeleine I.G.; Gortmaker, Steven L.; Wang, Y. Claire; Long, Michael W.; Kenney, Erica L.","Daepp, Madeleine I.G. (Massachusetts Institute of Technology); Gortmaker, Steven L. (); Wang, Y. Claire (Columbia University; New York Academy of Medicine); Long, Michael W. (George Washington University); Kenney, Erica L. (Harvard University)",Massachusetts Institute of Technology; Columbia University; George Washington University; Harvard University; New York Academy of Medicine,grid.116068.8; grid.21729.3f; grid.253615.6; grid.38142.3c; grid.410402.3,Cambridge; New York; Washington D.C.; Cambridge; New York,Massachusetts; New York; District of Columbia; Massachusetts; New York,United States; United States; United States; United States; United States,,,,,,0,0,0,0,,https://app.dimensions.ai/details/publication/pub.1113175197,1117 Public Health and Health Services,1117 Public Health and Health Services,,,,,Pediatric; Prevention; Obesity; Nutrition,Pediatric,Prevention,Obesity,Nutrition,,Oral and Gastrointestinal; Cancer; Cardiovascular; Metabolic and Endocrine,Oral and Gastrointestinal,Cancer,Cardiovascular,Metabolic and Endocrine,,,,,,,,Population & Society,Public Health,,,,,,,,,,,,,usda,"'(FNS OR ""Food and Nutrition Service "") AND ( USDA OR "" Economic Research Service"") AND (WIC OR ""women, Infants and children"") AND (State AND (agency OR agencies)) AND (yr=2014 OR yr=2015)'",1,dataset-346
581,pub.1104305285,10.1177/0890117118778243,www.doi.org/10.1177/0890117118778243,29847997,,WIC Households’ Bread and Cold Cereal Purchases: When They Use Benefits Versus Paying Out of Pocket,American Journal of Health Promotion,,SAGE Publications,,2019,33,1,79-86,Closed,article,"Stewart, Hayden; McLaughlin, Patrick W.; Dong, Diansheng; Frazão, Elizabeth","Stewart, Hayden (Agricultural Research Service); McLaughlin, Patrick W. (Agricultural Research Service); Dong, Diansheng (Agricultural Research Service); Frazão, Elizabeth (Agricultural Research Service)",Agricultural Research Service,grid.463419.d,Washington D.C.,District of Columbia,United States,,,,,,1,1,0,0,,https://app.dimensions.ai/details/publication/pub.1104305285,1117 Public Health and Health Services,1117 Public Health and Health Services,,,,,Clinical Research,Clinical Research,,,,,,,,,,,3.3 Nutrition and chemoprevention,3.3 Nutrition and chemoprevention,,,,,Clinical,,,,,,,,,,,,,,usda,"'(FNS OR ""Food and Nutrition Service "") AND ( USDA OR "" Economic Research Service"") AND (WIC OR ""women, Infants and children"") AND (State AND (agency OR agencies))'",0.933977456,dataset-346
524,pub.1110283638,10.1016/j.jneb.2018.10.005,www.doi.org/10.1016/j.jneb.2018.10.005,30514654,PMC6369002,Trends in Breastfeeding Disparities in US Infants by WIC Eligibility and Participation,Journal of Nutrition Education and Behavior,,Elsevier,,2019,51,Matern Child Health J 16 2002,182-189,Closed,article,"Zhang, Qi; Lamichhane, Rajan; Wright, Mia; McLaughlin, Patrick W.; Stacy, Brian","Zhang, Qi (Old Dominion University); Lamichhane, Rajan (Eastern Virginia Medical School); Wright, Mia (Old Dominion University); McLaughlin, Patrick W. (Economic Research Service); Stacy, Brian (Economic Research Service)",Old Dominion University; Economic Research Service; Eastern Virginia Medical School,grid.261368.8; grid.482913.5; grid.255414.3,Norfolk; Washington D.C.; Norfolk,Virginia; District of Columbia; Virginia,United States; United States; United States,United States Department of Agriculture; National Institute of Child Health and Human Development,USDA; NIH,United States; United States,grant.6541295,R03HD090387,0,0,0,0,,https://app.dimensions.ai/details/publication/pub.1110283638,1117 Public Health and Health Services,1117 Public Health and Health Services,,,,,Prevention; Pediatric; Pediatric Research Initiative; Nutrition,Prevention,Pediatric,Pediatric Research Initiative,Nutrition,,,,,,,,,,,,,,Population & Society,Public Health,,,,,,,,,,,,,usda,"'(FNS OR ""Food and Nutrition Service "") AND ( USDA OR "" Economic Research Service"") AND (WIC OR ""women, Infants and children"") AND (State AND (agency OR agencies))'",0.842190016,dataset-346
519,pub.1074706034,,www.doi.org/,11010682,,"Special Supplemental Nutrition Program for Women, Infants and Children (WIC): non-discretionary funding provisions of the William F. Goodling Child Nutrition Reauthorization Act of 1998. Food and Nutrition Service, USDA. Final rule.",Federal Register,,,"Breast Feeding; Child, Preschool; Female; Financing, Government; Humans; Infant; Infant Nutritional Physiological Phenomena; Nutritional Status; Suction; United States",1999,64,233,67997-8000,Closed,article,,,,,,,,,,,,,1,0,0.05,0,,https://app.dimensions.ai/details/publication/pub.1074706034,1117 Public Health and Health Services,1117 Public Health and Health Services,,,,,,,,,,,,,,,,,,,,,,,,,,,,,,,,,,,,,usda,"'(FNS OR ""Food and Nutrition Service "") AND ( USDA OR "" Economic Research Service"") AND (WIC OR ""women, Infants and children"") AND (State AND (agency OR agencies))'",0.834138486,dataset-346
503,pub.1074706036,,www.doi.org/,11010684,,"Special Supplemental Nutrition Program for Women, Infants, and Children (WIC): bloodwork requirements. Food and Nutrition Service, USDA. Final rule.",Federal Register,,,"Blood Chemical Analysis; Child, Preschool; Eligibility Determination; Female; Humans; Infant; Nutrition Assessment; Nutritional Status; United States",1999,64,241,70173-8,Closed,article,,,,,,,,,,,,,2,0,0,0,,https://app.dimensions.ai/details/publication/pub.1074706036,1111 Nutrition and Dietetics,1111 Nutrition and Dietetics,,,,,Prevention; Nutrition; Pediatric,Prevention,Nutrition,Pediatric,,,Cardiovascular,Cardiovascular,,,,,,,,,,,Population & Society,,,,,,,,,,,,,,usda,"'(FNS OR ""Food and Nutrition Service "") AND ( USDA OR "" Economic Research Service"") AND (WIC OR ""women, Infants and children"") AND (State AND (agency OR agencies))'",0.808373591,dataset-346
494,pub.1104164933,10.1016/j.amepre.2018.04.003,www.doi.org/10.1016/j.amepre.2018.04.003,29776784,PMC6020687,"100% Juice, Fruit, and Vegetable Intake Among Children in the Special Supplemental Nutrition Program for Women, Infants, and Children and Nonparticipants",American Journal of Preventive Medicine,,Elsevier,,2018,55,1,e11-e18,Closed,article,"Vercammen, Kelsey A.; Moran, Alyssa J.; Zatz, Laura Y.; Rimm, Eric B.","Vercammen, Kelsey A. (Harvard University); Moran, Alyssa J. (Harvard University); Zatz, Laura Y. (Harvard University); Rimm, Eric B. (Harvard University)",Harvard University,grid.38142.3c,Cambridge,Massachusetts,United States,National Institute of Diabetes and Digestive and Kidney Diseases,NIH,United States,grant.2683287,T32DK007703,0,0,0,0,,https://app.dimensions.ai/details/publication/pub.1104164933,1117 Public Health and Health Services,1117 Public Health and Health Services,,,,,Prevention; Nutrition; Pediatric,Prevention,Nutrition,Pediatric,,,,,,,,,,,,,,,Population & Society,Public Health,,,,,,,,,,,,,usda,"'(FNS OR ""Food and Nutrition Service "") AND ( USDA OR "" Economic Research Service"") AND (WIC OR ""women, Infants and children"") AND (State AND (agency OR agencies))'",0.793880837,dataset-346
487,pub.1113175197,10.1542/peds.2018-2841,www.doi.org/10.1542/peds.2018-2841,30936251,,WIC Food Package Changes: Trends in Childhood Obesity Prevalence,Pediatrics,,American Academy of Pediatrics (AAP),,2019,143,5,e20182841,Closed,article,"Daepp, Madeleine I.G.; Gortmaker, Steven L.; Wang, Y. Claire; Long, Michael W.; Kenney, Erica L.","Daepp, Madeleine I.G. (Massachusetts Institute of Technology); Gortmaker, Steven L. (); Wang, Y. Claire (Columbia University; New York Academy of Medicine); Long, Michael W. (George Washington University); Kenney, Erica L. (Harvard University)",Massachusetts Institute of Technology; Columbia University; George Washington University; Harvard University; New York Academy of Medicine,grid.116068.8; grid.21729.3f; grid.253615.6; grid.38142.3c; grid.410402.3,Cambridge; New York; Washington D.C.; Cambridge; New York,Massachusetts; New York; District of Columbia; Massachusetts; New York,United States; United States; United States; United States; United States,,,,,,0,0,0,0,,https://app.dimensions.ai/details/publication/pub.1113175197,1117 Public Health and Health Services,1117 Public Health and Health Services,,,,,Pediatric; Prevention; Obesity; Nutrition,Pediatric,Prevention,Obesity,Nutrition,,Oral and Gastrointestinal; Cancer; Cardiovascular; Metabolic and Endocrine,Oral and Gastrointestinal,Cancer,Cardiovascular,Metabolic and Endocrine,,,,,,,,Population & Society,Public Health,,,,,,,,,,,,,usda,"'(FNS OR ""Food and Nutrition Service "") AND ( USDA OR "" Economic Research Service"") AND (WIC OR ""women, Infants and children"") AND (State AND (agency OR agencies))'",0.782608696,dataset-346
461,pub.1110227705,10.1016/j.jand.2018.09.003,www.doi.org/10.1016/j.jand.2018.09.003,30502034,,WIC Recipients in the Retail Environment: A Qualitative Study Assessing Customer Experience and Satisfaction,Journal of the Academy of Nutrition and Dietetics,,Elsevier,,2019,119,JAMA 307 5 2012,416-424.e2,Closed,article,"Chauvenet, Christina; De Marco, Molly; Barnes, Carolyn; Ammerman, Alice S.","Chauvenet, Christina (); De Marco, Molly (); Barnes, Carolyn (); Ammerman, Alice S. ()",,,,,,,,,,,0,0,0,0,,https://app.dimensions.ai/details/publication/pub.1110227705,1117 Public Health and Health Services; 1701 Psychology,1117 Public Health and Health Services,1701 Psychology,,,,Prevention; Behavioral and Social Science; Pediatric; Clinical Trials and Supportive Activities; Clinical Research; Nutrition,Prevention,Behavioral and Social Science,Pediatric,Clinical Trials and Supportive Activities,Clinical Research,,,,,,,3.1 Primary prevention interventions to modify behaviours or promote well-being,3.1 Primary prevention interventions to modify behaviours or promote well-being,,,,,Population & Society,,,,,,,,,,,,,,usda,"'(FNS OR ""Food and Nutrition Service "") AND ( USDA OR "" Economic Research Service"") AND (WIC OR ""women, Infants and children"") AND (State AND (agency OR agencies))'",0.740740741,dataset-346
458,pub.1051742109,10.1177/0890334416679619,www.doi.org/10.1177/0890334416679619,28135478,PMC5366039,"Likelihood of Breastfeeding Within the USDA’s Food and Nutrition Service Special Supplemental Nutrition Program for Women, Infants, and Children Population",Journal of Human Lactation,,SAGE Publications,"Breast Feeding; Child, Preschool; Female; Food Assistance; Health Promotion; Humans; Infant; Infant, Newborn; Mothers; Socioeconomic Factors; United States; United States Department of Agriculture",2017,33,1,83-97,All OA; Bronze,article,"Houghtaling, Bailey; Shanks, Carmen Byker; Jenkins, Mica","Houghtaling, Bailey (Virginia Tech); Shanks, Carmen Byker (Montana State University); Jenkins, Mica (World Food Programme)",Virginia Tech; World Food Programme; Montana State University,grid.438526.e; grid.452890.2; grid.41891.35,Blacksburg; Rome; Bozeman,Virginia; ; Montana,United States; Italy; United States,National Institute of General Medical Sciences,NIH,United States,grant.2437908; grant.3805664,P20GM104417; P20GM103474,3,3,2,2.21,http://journals.sagepub.com/doi/pdf/10.1177/0890334416679619,https://app.dimensions.ai/details/publication/pub.1051742109,1117 Public Health and Health Services; 1605 Policy and Administration,1117 Public Health and Health Services,1605 Policy and Administration,,,,Prevention; Pediatric; Nutrition; Behavioral and Social Science,Prevention,Pediatric,Nutrition,Behavioral and Social Science,,Reproductive Health and Childbirth,Reproductive Health and Childbirth,,,,,,,,,,,Population & Society,Public Health,,,,,,,,,,,,,usda,"'(FNS OR ""Food and Nutrition Service "") AND ( USDA OR "" Economic Research Service"") AND (WIC OR ""women, Infants and children"") AND (State AND (agency OR agencies))'",0.735909823,dataset-346
444,pub.1033297379,10.1016/j.jand.2016.11.002,www.doi.org/10.1016/j.jand.2016.11.002,28017594,,"Delivering Summer Electronic Benefit Transfers for Children through the Supplemental Nutrition Assistance Program or the Special Supplemental Nutrition Program for Women, Infants, and Children: Benefit Use and Impacts on Food Security and Foods Consumed",Journal of the Academy of Nutrition and Dietetics,,Elsevier,Adolescent; Child; Family Characteristics; Female; Food Assistance; Food Supply; Humans; Male; Nutrition Policy; Poverty; Program Evaluation; Random Allocation; Seasons; United States,2017,117,3,367-375.e2,Closed,article,"Gordon, Anne R.; Briefel, Ronette R.; Collins, Ann M.; Rowe, Gretchen M.; Klerman, Jacob A.","Gordon, Anne R. (); Briefel, Ronette R. (); Collins, Ann M. (); Rowe, Gretchen M. (); Klerman, Jacob A. ()",,,,,,,,,,,6,6,0.57,3.5,,https://app.dimensions.ai/details/publication/pub.1033297379,1117 Public Health and Health Services,1117 Public Health and Health Services,,,,,Pediatric; Clinical Research,Pediatric,Clinical Research,,,,,,,,,,3.3 Nutrition and chemoprevention,3.3 Nutrition and chemoprevention,,,,,Population & Society,Public Health,,,,,,,,,,,,,usda,"'(FNS OR ""Food and Nutrition Service "") AND ( USDA OR "" Economic Research Service"") AND (WIC OR ""women, Infants and children"") AND (State AND (agency OR agencies))'",0.713365539,dataset-346
435,pub.1111993380,10.1542/peds.2018-2274,www.doi.org/10.1542/peds.2018-2274,30733238,,Food and Beverage Intake From 12 to 23 Months by WIC Status,Pediatrics,,American Academy of Pediatrics (AAP),,2019,143,3,e20182274,Closed,article,"Hamner, Heather C.; Paolicelli, Courtney; Casavale, Kellie O.; Haake, Melanie; Bartholomew, Anne","Hamner, Heather C. (National Center for Chronic Disease Prevention and Health Promotion); Paolicelli, Courtney (Food and Nutrition Service); Casavale, Kellie O. (Montgomery County Department of Health and Human Services); Haake, Melanie (Food and Nutrition Service); Bartholomew, Anne (Food and Nutrition Service)",Montgomery County Department of Health and Human Services; National Center for Chronic Disease Prevention and Health Promotion; Food and Nutrition Service,grid.414212.0; grid.416781.d; grid.478135.c,Rockville; Atlanta; Alexandria,Maryland; Georgia; Virginia,United States; United States; United States,,,,,,0,0,0,0,,https://app.dimensions.ai/details/publication/pub.1111993380,1117 Public Health and Health Services,1117 Public Health and Health Services,,,,,Pediatric; Nutrition,Pediatric,Nutrition,,,,,,,,,,3.3 Nutrition and chemoprevention,3.3 Nutrition and chemoprevention,,,,,Population & Society,,,,,,,,,,,,,,usda,"'(FNS OR ""Food and Nutrition Service "") AND ( USDA OR "" Economic Research Service"") AND (WIC OR ""women, Infants and children"") AND (State AND (agency OR agencies))'",0.698872786,dataset-346
426,pub.1017460370,10.1016/j.outlook.2013.05.010,www.doi.org/10.1016/j.outlook.2013.05.010,23993250,PMC4355911,"WIC (The Special Supplemental Nutrition Program for Women, Infants, and Children): Policy versus practice regarding breastfeeding",Nursing Outlook,,Elsevier,"Breast Feeding; Counseling; Female; Health Promotion; Humans; Infant; Infant Formula; Organizational Policy; Peer Group; Program Evaluation; Societies, Nursing; United States",2013,61,6,466-470,"All OA; Green, Accepted",article,"Baumgartel, Kelley L.; Spatz, Diane L.; Panel, American Academy of Nursing Expert Breastfeeding","Baumgartel, Kelley L. (University of Pittsburgh); Spatz, Diane L. (University of Pennsylvania); Panel, American Academy of Nursing Expert Breastfeeding (University of Pittsburgh; University of Pennsylvania)",University of Pennsylvania; University of Pittsburgh,grid.25879.31; grid.21925.3d,Philadelphia; Pittsburgh,Pennsylvania; Pennsylvania,United States; United States,National Institute of Nursing Research,NIH,United States,grant.2685523,T32NR009759,15,8,1.3,2.42,http://europepmc.org/articles/pmc4355911?pdf=render,https://app.dimensions.ai/details/publication/pub.1017460370,1117 Public Health and Health Services,1117 Public Health and Health Services,,,,,Prevention; Nutrition; Pediatric,Prevention,Nutrition,Pediatric,,,,,,,,,,,,,,,Population & Society,Public Health,,,,,,,,,,,,,usda,"'(FNS OR ""Food and Nutrition Service "") AND ( USDA OR "" Economic Research Service"") AND (WIC OR ""women, Infants and children"") AND (State AND (agency OR agencies))'",0.684380032,dataset-346
423,pub.1006874233,10.3945/ajcn.113.073585,www.doi.org/10.3945/ajcn.113.073585,24477040,,WIC Infant and Toddler Feeding Practices Study: protocol design and implementation,American Journal of Clinical Nutrition,,Oxford University Press (OUP),"Adult; Child Development; Child Nutritional Physiological Phenomena; Child, Preschool; Diet; Evidence-Based Medicine; Feeding Methods; Female; Food Assistance; Health Promotion; Humans; Infant; Infant, Newborn; Longitudinal Studies; Male; National Academies of Science, Engineering, and Medicine (U.S.) Health and Medicine Division; Nutrition Policy; Overweight; Policy Making; Research Design; United States; United States Department of Agriculture",2014,99,3,742s-746s,All OA; Bronze,article,"Harrison, Gail G; Hirschman, Jay D; Owens, Tameka A; McNutt, Suzanne W; Sallack, Linnea E","Harrison, Gail G (University of California Los Angeles); Hirschman, Jay D (University of California Los Angeles); Owens, Tameka A (University of California Los Angeles); McNutt, Suzanne W (University of California Los Angeles); Sallack, Linnea E (University of California Los Angeles)",University of California Los Angeles,grid.19006.3e,Los Angeles,California,United States,,,,,,5,2,0.46,0.94,https://academic.oup.com/ajcn/article-pdf/99/3/742S/23831829/742s.pdf,https://app.dimensions.ai/details/publication/pub.1006874233,1117 Public Health and Health Services,1117 Public Health and Health Services,,,,,Prevention; Pediatric; Nutrition,Prevention,Pediatric,Nutrition,,,,,,,,,"2.3 Psychological, social and economic factors","2.3 Psychological, social and economic factors",,,,,Population & Society,,,,,,,,,,,,,,usda,"'(FNS OR ""Food and Nutrition Service "") AND ( USDA OR "" Economic Research Service"") AND (WIC OR ""women, Infants and children"") AND (State AND (agency OR agencies))'",0.679549114,dataset-346
418,pub.1091501729,10.1016/j.jneb.2017.07.003,www.doi.org/10.1016/j.jneb.2017.07.003,28890264,,Breastfeeding Is Associated With Higher Retention in WIC After Age 1,Journal of Nutrition Education and Behavior,,Elsevier,Breast Feeding; Cross-Sectional Studies; Female; Food Assistance; Health Education; Humans; Infant,2017,49,10,810-816.e1,Closed,article,"Whaley, Shannon E.; Whaley, Mike; Au, Lauren E.; Gurzo, Klara; Ritchie, Lorrene D.","Whaley, Shannon E. (); Whaley, Mike (); Au, Lauren E. (University of California, Berkeley); Gurzo, Klara (University of California, Berkeley); Ritchie, Lorrene D. (University of California, Berkeley)","University of California, Berkeley",grid.47840.3f,Berkeley,California,United States,,,,,,0,0,0,0,,https://app.dimensions.ai/details/publication/pub.1091501729,1117 Public Health and Health Services,1117 Public Health and Health Services,,,,,Clinical Research; Nutrition; Pediatric; Pediatric Research Initiative; Prevention,Clinical Research,Nutrition,Pediatric,Pediatric Research Initiative,Prevention,Reproductive Health and Childbirth,Reproductive Health and Childbirth,,,,,,,,,,,Population & Society,Public Health,,,,,,,,,,,,,usda,"'(FNS OR ""Food and Nutrition Service "") AND ( USDA OR "" Economic Research Service"") AND (WIC OR ""women, Infants and children"") AND (State AND (agency OR agencies))'",0.671497585,dataset-346
