rank,publication_id,doi,url,pmid,pmcid,title,source_title,anthology_title,publisher,mesh_terms,pubyear,volume,issue,pagination,open_access,publication_type,authors,authors_affiliations,research_organizations_-_standardized,grid_ids,city_of_research_organization,state_of_research_organization,country_of_research_organization,funder,funder_group,funder_country,uids_of_supporting_grants,supporting_grants,times_cited,recent_citations,rcr,fcr,source_linkout,dimensions_url,for_(anzsrc)_categories,for_1,for_2,for_3,for_4,for_5,rcdc_categories,rcdc_1,rcdc_2,rcdc_3,rcdc_4,rcdc_5,hrcs_hc_categories,hrcs_hc_1,hrcs_hc_2,hrcs_hc_3,hrcs_hc_4,hrcs_hc_5,hrcs_rac_categories,hrcs_rac_1,hrcs_rac_2,hrcs_rac_3,hrcs_rac_4,hrcs_rac_5,health_research_areas,broad_research_areas,icrp_cancer_types,icrp_cancer_types_1,icrp_cancer_types_2,icrp_cancer_types_3,icrp_cancer_types_4,icrp_cancer_types_5,icrp_cso_categories,icrp_cso_1,icrp_cso_2,icrp_cso_3,icrp_cso_4,icrp_cso_5,domain,search_note,norm_rank,dataset
200,pub.1022028498,10.1016/j.jneb.2006.03.008,www.doi.org/10.1016/j.jneb.2006.03.008,16785091,,wichealth.org: Impact of a Stages of Change-Based Internet Nutrition Education Program,Journal of Nutrition Education and Behavior,,Elsevier,"Adult; Analysis of Variance; Chi-Square Distribution; Child Nutrition Sciences; Child, Preschool; Cross-Sectional Studies; Female; Food Services; Health Behavior; Health Knowledge, Attitudes, Practice; Health Promotion; Humans; Infant; Infant Nutritional Physiological Phenomena; Infant, Newborn; Internet; Male; Maternal Nutritional Physiological Phenomena; Nutritional Sciences; Pregnancy; United States",2006,38,4,222-229,Closed,article,"Bensley, Robert J.; Brusk, John J.; Anderson, Judith V.; Mercer, Nelda; Rivas, Jason; Broadbent, Lindsay N.","Bensley, Robert J. (Western Michigan University); Brusk, John J. (Western Michigan University); Anderson, Judith V. (Michigan Department of Health and Human Services); Mercer, Nelda (Michigan Department of Health and Human Services); Rivas, Jason (Western Michigan University); Broadbent, Lindsay N. (Western Michigan University)",Michigan Department of Health and Human Services; Western Michigan University,grid.467944.c; grid.268187.2,Lansing; Kalamazoo,Michigan; Michigan,United States; United States,United States Department of Agriculture,USDA,United States,,,21,5,1.01,1.68,,https://app.dimensions.ai/details/publication/pub.1022028498,1117 Public Health and Health Services,1117 Public Health and Health Services,,,,,Behavioral and Social Science; Clinical Research,Behavioral and Social Science,Clinical Research,,,,,,,,,,,,,,,,,,,,,,,,,,,,,,usda,"'(FNS OR ""Food and Nutrition Service "") AND ( USDA OR "" Economic Research Service"") AND (WIC OR ""women, Infants and children"") AND (State AND (agency OR agencies))'",0.320450886,dataset-346
200,pub.1113640072,10.1111/1468-0009.12385,www.doi.org/10.1111/1468-0009.12385,31016816,,Legal Feasibility of US Government Policies to Reduce Cancer Risk by Reducing Intake of Processed Meat,Milbank Quarterly,,Wiley,,2019,,,,Closed,article,"WILDE, PARKE; POMERANZ, JENNIFER L.; LIZEWSKI, LAUREN J.; RUAN, MENGYUAN; MOZAFFARIAN, DARIUSH; ZHANG, FANG FANG","WILDE, PARKE (Tufts University); POMERANZ, JENNIFER L. (); LIZEWSKI, LAUREN J. (Tufts University); RUAN, MENGYUAN (Tufts University); MOZAFFARIAN, DARIUSH (Tufts University); ZHANG, FANG FANG (Tufts University)",Tufts University,grid.429997.8,Medford,Massachusetts,United States,National Institute On Minority Health and Health Disparities,NIH,United States,grant.6443529,R01MD011501,0,0,0,0,,https://app.dimensions.ai/details/publication/pub.1113640072,1117 Public Health and Health Services; 1605 Policy and Administration,1117 Public Health and Health Services,1605 Policy and Administration,,,,Prevention; Cancer; Nutrition; Clinical Research,Prevention,Cancer,Nutrition,Clinical Research,,Cancer,Cancer,,,,,,,,,,,Population & Society,Public Health,Colon and Rectal Cancer; Not Site-Specific Cancer,Colon and Rectal Cancer,Not Site-Specific Cancer,,,,3.2 Nutritional Science in Cancer Prevention; 3.1 Interventions to Prevent Cancer: Personal Behaviors That Affect Cancer Risk,3.2 Nutritional Science in Cancer Prevention,,,,,usda,"'(FNS OR ""Food and Nutrition Service "") AND ( USDA OR "" Economic Research Service"") AND (WIC OR ""women, Infants and children"") AND (State AND (agency OR agencies))'",0.320450886,dataset-346
198,pub.1107167096,10.1016/j.jneb.2018.07.020,www.doi.org/10.1016/j.jneb.2018.07.020,30249521,,An Assessment of Perceived Barriers to Farmers’ Market Access,Journal of Nutrition Education and Behavior,,Elsevier,,2019,51,JAMA Intern Med 174 2014,48-56,Closed,article,"Ritter, Gaelen; Walkinshaw, Lina P.; Quinn, Emilee L.; Ickes, Scott; Johnson, Donna B.","Ritter, Gaelen (University of Washington); Walkinshaw, Lina P. (University of Washington); Quinn, Emilee L. (University of Washington); Ickes, Scott (University of Washington; Wheaton College); Johnson, Donna B. (University of Washington)",Wheaton College; University of Washington,grid.422662.6; grid.34477.33,Wheaton; Seattle,Illinois; Washington,United States; United States,United States Department of Agriculture; National Center for Advancing Translational Sciences,USDA; NIH,United States; United States,grant.2705230,UL1TR000423,0,0,0,0,,https://app.dimensions.ai/details/publication/pub.1107167096,1117 Public Health and Health Services,1117 Public Health and Health Services,,,,,Health Services; Clinical Research,Health Services,Clinical Research,,,,,,,,,,,,,,,,,,,,,,,,,,,,,,usda,"'(FNS OR ""Food and Nutrition Service "") AND ( USDA OR "" Economic Research Service"") AND (WIC OR ""women, Infants and children"") AND (State AND (agency OR agencies))'",0.317230274,dataset-346
197,pub.1038711330,10.1097/00017285-200207000-00007,www.doi.org/10.1097/00017285-200207000-00007,12352833,,An Overview of Food Security and Its Measurement,Nutrition Today,,Wolters Kluwer,,2002,37,4,156-162,Closed,article,"Holben, David H.","Holben, David H. (Ohio University)",Ohio University,grid.20627.31,Athens,Ohio,United States,,,,,,13,1,0.32,0.89,,https://app.dimensions.ai/details/publication/pub.1038711330,1111 Nutrition and Dietetics,1111 Nutrition and Dietetics,,,,,Nutrition; Obesity,Nutrition,Obesity,,,,,,,,,,,,,,,,,,,,,,,,,,,,,,usda,"'(FNS OR ""Food and Nutrition Service "") AND ( USDA OR "" Economic Research Service"") AND (WIC OR ""women, Infants and children"") AND (State AND (agency OR agencies))'",0.315619968,dataset-346
197,pub.1010592204,10.1111/j.1752-7325.2005.tb03018.x,www.doi.org/10.1111/j.1752-7325.2005.tb03018.x,16468460,,Determinants of Dental Referral Practices Among WIC Nutritionists in North Carolina,Journal of Public Health Dentistry,,Wiley,"Adult; Child; Child Health Services; Child, Preschool; Cross-Sectional Studies; Dental Care for Children; Dietetics; Health Knowledge, Attitudes, Practice; Humans; Infant; Infant, Newborn; Logistic Models; Middle Aged; North Carolina; Nutritional Physiological Phenomena; Referral and Consultation; Surveys and Questionnaires",2005,65,4,196-202,Closed,article,"Shick, Elizabeth A.; Lee, Jessica Y.; Rozier, R. Gary","Shick, Elizabeth A. (University of North Carolina at Chapel Hill); Lee, Jessica Y. (University of North Carolina at Chapel Hill); Rozier, R. Gary (University of North Carolina at Chapel Hill)",University of North Carolina at Chapel Hill,grid.10698.36,Chapel Hill,North Carolina,United States,United States Public Health Service,,United States,,,10,0,0.51,0.78,,https://app.dimensions.ai/details/publication/pub.1010592204,1117 Public Health and Health Services,1117 Public Health and Health Services,,,,,Clinical Research; Dental/Oral and Craniofacial Disease; Prevention,Clinical Research,Dental/Oral and Craniofacial Disease,Prevention,,,,,,,,,8.1 Organisation and delivery of services,8.1 Organisation and delivery of services,,,,,Health services & systems,Public Health,,,,,,,,,,,,,usda,"'(FNS OR ""Food and Nutrition Service "") AND ( USDA OR "" Economic Research Service"") AND (WIC OR ""women, Infants and children"") AND (State AND (agency OR agencies))'",0.315619968,dataset-346
196,pub.1039740738,10.1111/j.1744-6155.2010.00235.x,www.doi.org/10.1111/j.1744-6155.2010.00235.x,20367787,,Exploring Food Insecurity Among Young Mothers (15–24 Years),Journal for Specialists in Pediatric Nursing,,Wiley,"Adolescent; Child; Child, Preschool; Diet; Female; Food Supply; Health Promotion; Homeless Persons; Humans; Infant; Infant, Newborn; Mothers; Nutrition Surveys; Pilot Projects; Single Parent; Washington; Young Adult",2010,15,2,163-171,Closed,article,"Stevens, Christine A.","Stevens, Christine A. (University of Washington)",University of Washington,grid.34477.33,Seattle,Washington,United States,,,,,,25,10,0.81,2.5,,https://app.dimensions.ai/details/publication/pub.1039740738,1111 Nutrition and Dietetics,1111 Nutrition and Dietetics,,,,,Behavioral and Social Science; Nutrition,Behavioral and Social Science,Nutrition,,,,,,,,,,,,,,,,Population & Society,Public Health,,,,,,,,,,,,,usda,"'(FNS OR ""Food and Nutrition Service "") AND ( USDA OR "" Economic Research Service"") AND (WIC OR ""women, Infants and children"") AND (State AND (agency OR agencies))'",0.314009662,dataset-346
196,pub.1103603888,10.1016/j.jand.2018.02.025,www.doi.org/10.1016/j.jand.2018.02.025,29703343,,Practice Paper of the Academy of Nutrition and Dietetics: Comprehensive Nutrition Programs and Services in Schools,Journal of the Academy of Nutrition and Dietetics,,Elsevier,,2018,118,5,920-931,Closed,article,"Hayes, Dayle; Dodson, Linette","Hayes, Dayle (); Dodson, Linette ()",,,,,,,,,,,1,1,0,0,,https://app.dimensions.ai/details/publication/pub.1103603888,1303 Specialist Studies In Education; 1117 Public Health and Health Services,1303 Specialist Studies In Education,1117 Public Health and Health Services,,,,Pediatric; Nutrition,Pediatric,Nutrition,,,,,,,,,,,,,,,,,,,,,,,,,,,,,,usda,"'(FNS OR ""Food and Nutrition Service "") AND ( USDA OR "" Economic Research Service"") AND (WIC OR ""women, Infants and children"") AND (State AND (agency OR agencies))'",0.314009662,dataset-346
195,pub.1004390981,10.1016/j.jneb.2007.08.002,www.doi.org/10.1016/j.jneb.2007.08.002,18725151,,How to Strengthen and Enhance WIC Nutrition Education,Journal of Nutrition Education and Behavior,,Elsevier,"Adult; Child, Preschool; Feeding Behavior; Female; Food Services; Health Behavior; Health Education; Humans; Infant; Infant, Newborn; Male; Nevada; Nutrition Policy; Nutritional Sciences; Program Development; Public Assistance; Social Welfare; United States",2008,40,5,317-321,Closed,article,"Sigman-Grant, Madeleine; Rye, Alyssa; Loesch-Griffin, Deborah; Mitchell, Deborah","Sigman-Grant, Madeleine (University of Nevada, Las Vegas); Rye, Alyssa (University of Nevada Reno); Loesch-Griffin, Deborah (); Mitchell, Deborah (University of Nevada Reno)","University of Nevada, Las Vegas; University of Nevada Reno",grid.272362.0; grid.266818.3,Las Vegas; Reno,Nevada; Nevada,United States; United States,United States Department of Agriculture,USDA,United States,,,6,0,0.37,0,,https://app.dimensions.ai/details/publication/pub.1004390981,,,,,,,,,,,,,,,,,,,,,,,,,,,,,,,,,,,,,,,usda,"'(FNS OR ""Food and Nutrition Service "") AND ( USDA OR "" Economic Research Service"") AND (WIC OR ""women, Infants and children"") AND (State AND (agency OR agencies))'",0.312399356,dataset-346
152,pub.1040005314,10.1016/j.apnr.2015.03.009,www.doi.org/10.1016/j.apnr.2015.03.009,26856485,,"Food security, maternal feeding practices and child weight-for-length",Applied Nursing Research,,Elsevier,"Adult; Body Weight; Child, Preschool; Female; Food Supply; Humans; Infant; Male; Maternal Behavior; Pediatric Obesity",2016,29,,31-36,Closed,article,"Barroso, Cristina S.; Roncancio, Angelica; Moramarco, Michael W.; Hinojosa, Martha B.; Davila, Yolanda R.; Mendias, Elnora; Reifsnider, Elizabeth","Barroso, Cristina S. (University of Tennessee at Knoxville); Roncancio, Angelica (The University of Texas Health Science Center at Houston); Moramarco, Michael W. (Arizona State University); Hinojosa, Martha B. (); Davila, Yolanda R. (The University of Texas Medical Branch at Galveston); Mendias, Elnora (The University of Texas Medical Branch at Galveston); Reifsnider, Elizabeth (Arizona State University)",The University of Texas Health Science Center at Houston; Arizona State University; The University of Texas Medical Branch at Galveston; University of Tennessee at Knoxville,grid.267308.8; grid.215654.1; grid.176731.5; grid.411461.7,Houston; Tempe; Galveston; Knoxville,Texas; Arizona; Texas; Tennessee,United States; United States; United States; United States,National Institute of Diabetes and Digestive and Kidney Diseases; National Institute of Nursing Research; National Cancer Institute,NIH,United States; United States; United States,grant.2630842; grant.2616289; grant.2403606; grant.2500729,R29NR004882; R21NR010362; K01CA181437; R01DK096488,11,9,2.36,3.47,,https://app.dimensions.ai/details/publication/pub.1040005314,1117 Public Health and Health Services; 1111 Nutrition and Dietetics,1117 Public Health and Health Services,1111 Nutrition and Dietetics,,,,Clinical Research; Prevention; Obesity; Nutrition; Pediatric,Clinical Research,Prevention,Obesity,Nutrition,Pediatric,Metabolic and Endocrine; Cardiovascular; Stroke; Oral and Gastrointestinal; Cancer,Metabolic and Endocrine,Cardiovascular,Stroke,Oral and Gastrointestinal,Cancer,3.1 Primary prevention interventions to modify behaviours or promote well-being,3.1 Primary prevention interventions to modify behaviours or promote well-being,,,,,Population & Society,Public Health,,,,,,,,,,,,,usda,"'(FNS OR ""Food and Nutrition Service "") AND ( USDA OR "" Economic Research Service"") AND (WIC OR ""women, Infants and children"") AND (State AND (agency OR agencies)) AND (yr=2014 OR yr=2015)'",0.311340206,dataset-346
193,pub.1029330083,10.1016/j.jand.2014.06.001,www.doi.org/10.1016/j.jand.2014.06.001,25060139,,Position of the Academy of Nutrition and Dietetics: Nutrition Guidance for Healthy Children Ages 2 to 11 Years,Journal of the Academy of Nutrition and Dietetics,,Elsevier,"Academies and Institutes; Child; Child Nutritional Physiological Phenomena; Child, Preschool; Diet; Energy Intake; Food Quality; Food Supply; Health Promotion; Humans; Motor Activity; Nutritional Status; Pediatric Obesity; Recommended Dietary Allowances",2014,114,8,1257-1276,Closed,article,"Ogata, Beth N; Hayes, Dayle","Ogata, Beth N (University of Washington); Hayes, Dayle ()",University of Washington,grid.34477.33,Seattle,Washington,United States,,,,,,58,38,4.98,10.39,,https://app.dimensions.ai/details/publication/pub.1029330083,1117 Public Health and Health Services; 1111 Nutrition and Dietetics,1117 Public Health and Health Services,1111 Nutrition and Dietetics,,,,Cardiovascular; Prevention; Obesity; Behavioral and Social Science; Cancer; Nutrition; Pediatric,Cardiovascular,Prevention,Obesity,Behavioral and Social Science,Cancer,Cancer; Stroke; Cardiovascular; Oral and Gastrointestinal; Metabolic and Endocrine,Cancer,Stroke,Cardiovascular,Oral and Gastrointestinal,Metabolic and Endocrine,3.1 Primary prevention interventions to modify behaviours or promote well-being; 3.3 Nutrition and chemoprevention,3.1 Primary prevention interventions to modify behaviours or promote well-being,3.3 Nutrition and chemoprevention,,,,Population & Society,Public Health,Not Site-Specific Cancer,Not Site-Specific Cancer,,,,,3.2 Nutritional Science in Cancer Prevention; 3.1 Interventions to Prevent Cancer: Personal Behaviors That Affect Cancer Risk,3.2 Nutritional Science in Cancer Prevention,,,,,usda,"'(FNS OR ""Food and Nutrition Service "") AND ( USDA OR "" Economic Research Service"") AND (WIC OR ""women, Infants and children"") AND (State AND (agency OR agencies))'",0.309178744,dataset-346
193,pub.1113331610,10.1016/j.jand.2019.02.006,www.doi.org/10.1016/j.jand.2019.02.006,30979634,,"The Academic, Behavioral, and Health Influence of Summer Child Nutrition Programs: A Narrative Review and Proposed Research and Policy Agenda",Journal of the Academy of Nutrition and Dietetics,,Elsevier,,2019,,J Nutr 145 9 2015,,Closed,article,"Turner, Lindsey; Calvert, Hannah G.","Turner, Lindsey (); Calvert, Hannah G. ()",,,,,,,,,,,0,0,0,0,,https://app.dimensions.ai/details/publication/pub.1113331610,1117 Public Health and Health Services,1117 Public Health and Health Services,,,,,Obesity; Basic Behavioral and Social Science; Clinical Research; Prevention; Pediatric; Behavioral and Social Science; Nutrition,Obesity,Basic Behavioral and Social Science,Clinical Research,Prevention,Pediatric,,,,,,,,,,,,,Population & Society,Public Health,,,,,,,,,,,,,usda,"'(FNS OR ""Food and Nutrition Service "") AND ( USDA OR "" Economic Research Service"") AND (WIC OR ""women, Infants and children"") AND (State AND (agency OR agencies))'",0.309178744,dataset-346
193,pub.1004028153,10.5993/ajhb.37.1.15,www.doi.org/10.5993/ajhb.37.1.15,22943110,,Rural versus Urban Texas WIC Participants' Fruit and Vegetable Consumption,American Journal of Health Behavior,,PNG Publications,"Adult; African Americans; Child, Preschool; Cross-Sectional Studies; Diet Surveys; Eating; Female; Fruit; Humans; Male; Mothers; Pregnancy; Rural Population; Texas; Urban Population; Vegetables",2013,37,1,130-140(11),Closed,article,"Ettienne-Gittens, Reynolette; McKyer, E Lisako J; Odum, Mary; Diep, Cassandra S; Li, Yan; Girimaji, Asha; Murano, Peter S","Ettienne-Gittens, Reynolette (University of Hawaii at Manoa); McKyer, E Lisako J (); Odum, Mary (); Diep, Cassandra S (); Li, Yan (); Girimaji, Asha (); Murano, Peter S ()",University of Hawaii at Manoa,grid.410445.0,Honolulu,Hawaii,United States,,,,,,9,3,0.63,1.53,,https://app.dimensions.ai/details/publication/pub.1004028153,1117 Public Health and Health Services; 1114 Paediatrics and Reproductive Medicine,1117 Public Health and Health Services,1114 Paediatrics and Reproductive Medicine,,,,Nutrition; Pediatric,Nutrition,Pediatric,,,,,,,,,,,,,,,,Population & Society,,,,,,,,,,,,,,usda,"'(FNS OR ""Food and Nutrition Service "") AND ( USDA OR "" Economic Research Service"") AND (WIC OR ""women, Infants and children"") AND (State AND (agency OR agencies))'",0.309178744,dataset-346
192,pub.1041053772,10.1177/089033440001600403,www.doi.org/10.1177/089033440001600403,11155599,,US National Surveillance of Breastfeeding Behavior,Journal of Human Lactation,,SAGE Publications,Breast Feeding; Centers for Disease Control and Prevention (U.S.); Female; Health Care Surveys; Health Policy; Humans; Mothers; Needs Assessment; Population Surveillance; United States,2000,16,4,283-290,Closed,article,"Grummer-Strawn, Laurence M.; Li, Ruowei","Grummer-Strawn, Laurence M. (Centers for Disease Control and Prevention); Li, Ruowei (Centers for Disease Control and Prevention)",Centers for Disease Control and Prevention,grid.416738.f,Atlanta,Georgia,United States,,,,,,25,2,0.92,2.16,,https://app.dimensions.ai/details/publication/pub.1041053772,1117 Public Health and Health Services,1117 Public Health and Health Services,,,,,Nutrition; Prevention; Pediatric,Nutrition,Prevention,Pediatric,,,,,,,,,,,,,,,,Public Health,,,,,,,,,,,,,usda,"'(FNS OR ""Food and Nutrition Service "") AND ( USDA OR "" Economic Research Service"") AND (WIC OR ""women, Infants and children"") AND (State AND (agency OR agencies))'",0.307568438,dataset-346
192,pub.1003880674,10.1016/j.jada.2005.11.006,www.doi.org/10.1016/j.jada.2005.11.006,16390677,,Position of the American Dietetic Association: Local Support for Nutrition Integrity in Schools,Journal of the Academy of Nutrition and Dietetics,,Elsevier,"Adolescent; Child; Child Nutritional Physiological Phenomena; Child, Preschool; Dietary Services; Dietetics; Female; Food Services; Humans; Male; Nutrition Policy; Schools; Societies; United States",2006,106,1,122-133,Closed,article,"Pilant, Vivian B","Pilant, Vivian B (South Carolina Department of Education)",South Carolina Department of Education,grid.437971.f,Columbia,South Carolina,United States,,,,,,46,3,1.51,4.33,,https://app.dimensions.ai/details/publication/pub.1003880674,1303 Specialist Studies In Education; 1117 Public Health and Health Services; 1111 Nutrition and Dietetics,1303 Specialist Studies In Education,1117 Public Health and Health Services,1111 Nutrition and Dietetics,,,Nutrition; Pediatric; Clinical Research; Prevention,Nutrition,Pediatric,Clinical Research,Prevention,,Metabolic and Endocrine; Cancer; Oral and Gastrointestinal,Metabolic and Endocrine,Cancer,Oral and Gastrointestinal,,,,,,,,,Population & Society,Public Health,,,,,,,,,,,,,usda,"'(FNS OR ""Food and Nutrition Service "") AND ( USDA OR "" Economic Research Service"") AND (WIC OR ""women, Infants and children"") AND (State AND (agency OR agencies))'",0.307568438,dataset-346
197,pub.1004465539,10.1007/s10995-012-1067-y,www.doi.org/10.1007/s10995-012-1067-y,22729661,,Measuring the Impact and Outcomes of Maternal Child Health Federal Programs,Maternal and Child Health Journal,,Springer Nature,Breast Feeding; Child; Child Health Services; Child Welfare; Evaluation Studies as Topic; Female; Government Programs; Humans; Male; Maternal Health Services; Maternal Welfare; Program Evaluation; Public Assistance; United States,2013,17,5,886-896,Closed,article,"Taylor, Yhenneko J.; Nies, Mary A.","Taylor, Yhenneko J. (University of North Carolina at Charlotte); Nies, Mary A. (University of North Carolina at Charlotte)",University of North Carolina at Charlotte,grid.266859.6,Charlotte,North Carolina,United States,,,,,,10,0,0.54,1.61,,https://app.dimensions.ai/details/publication/pub.1004465539,1117 Public Health and Health Services,1117 Public Health and Health Services,,,,,Clinical Research; Pediatric; Prevention; Health Services,Clinical Research,Pediatric,Prevention,Health Services,,Reproductive Health and Childbirth,Reproductive Health and Childbirth,,,,,,,,,,,Population & Society,Public Health,,,,,,,,,,,,,usda,"'(FNS OR ""Food and Nutrition Service "") AND (WIC OR ""women, infants and Children"") AND ""Program Data""'",0.305772231,dataset-346
197,pub.1005578333,10.1136/jech-2014-204034,www.doi.org/10.1136/jech-2014-204034,25012991,PMC4280007,Influences of the neighbourhood food environment on adiposity of low-income preschool-aged children in Los Angeles County: a longitudinal study,Journal of Epidemiology & Community Health,,BMJ,"Adipose Tissue; African Americans; Asian Americans; Body Height; Body Weight; Child, Preschool; Female; Food Assistance; Food Supply; Hispanic Americans; Humans; Longitudinal Studies; Los Angeles; Male; Mothers; Multilevel Analysis; Pediatric Obesity; Poverty Areas; Residence Characteristics; Risk Factors; Sex Distribution",2014,68,11,jech-2014-204034,"All OA; Green, Accepted",article,"Chaparro, M Pia; Whaley, Shannon E; Crespi, Catherine M; Koleilat, Maria; Nobari, Tabashir Z; Seto, Edmund; Wang, May C","Chaparro, M Pia (Stockholm University; University of California Los Angeles); Whaley, Shannon E (Public Health Foundation Enterprises); Crespi, Catherine M (University of California Los Angeles); Koleilat, Maria (); Nobari, Tabashir Z (University of California Los Angeles); Seto, Edmund (University of Washington); Wang, May C (University of California Los Angeles)",University of Washington; Stockholm University; Public Health Foundation Enterprises; University of California Los Angeles,grid.34477.33; grid.10548.38; grid.280537.b; grid.19006.3e,Seattle; Stockholm; Los Angeles; Los Angeles,Washington; ; California; California,United States; Sweden; United States; United States,American Heart Association; National Institute of Child Health and Human Development; National Center for Advancing Translational Sciences; National Cancer Institute,HRA; NIH,United States; United States; United States; United States,grant.2621390; grant.2438817; grant.2705215,R24HD041022; UL1TR000124; P30CA016042,10,7,1.17,1.88,http://europepmc.org/articles/pmc4280007?pdf=render,https://app.dimensions.ai/details/publication/pub.1005578333,1117 Public Health and Health Services,1117 Public Health and Health Services,,,,,Obesity; Pediatric; Clinical Research; Prevention; Nutrition,Obesity,Pediatric,Clinical Research,Prevention,Nutrition,Stroke; Metabolic and Endocrine; Cardiovascular; Cancer,Stroke,Metabolic and Endocrine,Cardiovascular,Cancer,,"2.3 Psychological, social and economic factors; 3.1 Primary prevention interventions to modify behaviours or promote well-being","2.3 Psychological, social and economic factors",3.1 Primary prevention interventions to modify behaviours or promote well-being,,,,Population & Society,Public Health,,,,,,,,,,,,,usda,"'(FNS OR ""Food and Nutrition Service "") AND (WIC OR ""women, infants and Children"") AND ""Program Data""'",0.305772231,dataset-346
