rank,publication_id,doi,url,pmid,pmcid,title,source_title,anthology_title,publisher,mesh_terms,pubyear,volume,issue,pagination,open_access,publication_type,authors,authors_affiliations,research_organizations_-_standardized,grid_ids,city_of_research_organization,state_of_research_organization,country_of_research_organization,funder,funder_group,funder_country,uids_of_supporting_grants,supporting_grants,times_cited,recent_citations,rcr,fcr,source_linkout,dimensions_url,for_(anzsrc)_categories,for_1,for_2,for_3,for_4,for_5,rcdc_categories,rcdc_1,rcdc_2,rcdc_3,rcdc_4,rcdc_5,hrcs_hc_categories,hrcs_hc_1,hrcs_hc_2,hrcs_hc_3,hrcs_hc_4,hrcs_hc_5,hrcs_rac_categories,hrcs_rac_1,hrcs_rac_2,hrcs_rac_3,hrcs_rac_4,hrcs_rac_5,health_research_areas,broad_research_areas,icrp_cancer_types,icrp_cancer_types_1,icrp_cancer_types_2,icrp_cancer_types_3,icrp_cancer_types_4,icrp_cancer_types_5,icrp_cso_categories,icrp_cso_1,icrp_cso_2,icrp_cso_3,icrp_cso_4,icrp_cso_5,domain,search_note,norm_rank,dataset
127,pub.1101785477,10.1017/s0007114518000417,www.doi.org/10.1017/s0007114518000417,29587887,,"Excess free fructose, high-fructose corn syrup and adult asthma: the Framingham Offspring Cohort",British Journal Of Nutrition,,Cambridge University Press (CUP),Adult; Asthma; Body Mass Index; Carbonated Beverages; Citrus sinensis; Cohort Studies; Energy Intake; Female; Follow-Up Studies; Fructose; Fruit; Fruit and Vegetable Juices; Glucose; High Fructose Corn Syrup; Humans; Male; Malus; Middle Aged; Obesity; Overweight; Prospective Studies; Risk Factors; Sweetening Agents,2018,119,10,1157-1167,Closed,article,"DeChristopher, Luanne R.; Tucker, Katherine L.","DeChristopher, Luanne R. (); Tucker, Katherine L. (University of Massachusetts Lowell)",University of Massachusetts Lowell,grid.225262.3,Lowell,Massachusetts,United States,National Heart Lung and Blood Institute; National Institute of Neurological Disorders and Stroke; National Institute on Aging,NIH,United States; United States; United States,grant.2430005; grant.2540388; grant.2538832; grant.2554724; grant.2448097; grant.2539910; grant.2540003; grant.2543220; grant.2536290; grant.2538602,N01HC025195; R01HL060040; R01AG028321; R01HL076784; R01HL080124; R01HL071039; R01NS017950; R01HL070100; R01HL077447; R01HL107385,5,5,0,0,,https://app.dimensions.ai/details/publication/pub.1101785477,1117 Public Health and Health Services,1117 Public Health and Health Services,,,,,Pediatric; Nutrition; Clinical Research; Lung; Asthma,Pediatric,Nutrition,Clinical Research,Lung,Asthma,,,,,,,,,,,,,Clinical,,,,,,,,,,,,,,usda,"'(FNS OR ""Food and Nutrition Service "") AND ( USDA OR "" Economic Research Service"") AND (WIC OR ""women, Infants and children"") AND (State AND (agency OR agencies))'",0.202898551,dataset-346
126,pub.1002298286,10.1177/1527154412442391,www.doi.org/10.1177/1527154412442391,22585673,,Risk Factors for Low Birth Weight in New York State Counties,Policy Politics & Nursing Practice,,SAGE Publications,"Adolescent; Adult; Cross-Sectional Studies; Female; Health Education; Health Knowledge, Attitudes, Practice; Humans; Incidence; Infant, Low Birth Weight; Infant, Newborn; Linear Models; Maternal Health Services; Multivariate Analysis; Needs Assessment; New York; Poverty; Predictive Value of Tests; Pregnancy; Pregnancy Complications; Pregnancy in Adolescence; Prenatal Care; Quality of Health Care; Risk Factors; Rural Population; Socioeconomic Factors; Urban Population; Young Adult",2012,13,1,17-26,Closed,article,"Darling, Rosa D.; Atav, A. Serdar","Darling, Rosa D. (Binghamton University); Atav, A. Serdar (Binghamton University)",Binghamton University,grid.264260.4,Binghamton,New York,United States,,,,,,10,4,0.83,1.39,,https://app.dimensions.ai/details/publication/pub.1002298286,1117 Public Health and Health Services,1117 Public Health and Health Services,,,,,Perinatal - Birth - Preterm (LBW); Prevention; Health Services; Pediatric; Clinical Research; Infant Mortality/ (LBW); Perinatal Period - Conditions Originating in Perinatal Period,Perinatal - Birth - Preterm (LBW),Prevention,Health Services,Pediatric,Clinical Research,,,,,,,,,,,,,Health services & systems,Health Services Research,,,,,,,,,,,,,usda,"'(FNS OR ""Food and Nutrition Service "") AND ( USDA OR "" Economic Research Service"") AND (WIC OR ""women, Infants and children"") AND (State AND (agency OR agencies))'",0.201288245,dataset-346
126,pub.1090381258,10.3390/nu9070726,www.doi.org/10.3390/nu9070726,28698460,PMC5537840,Adults and Children in Low-Income Households That Participate in Cost-Offset Community Supported Agriculture Have High Fruit and Vegetable Consumption,Nutrients,,MDPI,Adolescent; Adult; Agriculture; Child; Feeding Behavior; Female; Food Services; Food Supply; Fruit; Humans; Male; Middle Aged; Poverty; United States; Vegetables,2017,9,7,726,All OA; Pure Gold,article,"Hanson, Karla L; Kolodinsky, Jane; Wang, Weiwei; Morgan, Emily H; Pitts, Stephanie B Jilcott; Ammerman, Alice S; Sitaker, Marilyn; Seguin, Rebecca A","Hanson, Karla L (Cornell University); Kolodinsky, Jane (University of Vermont); Wang, Weiwei (University of Vermont); Morgan, Emily H (Cornell University); Pitts, Stephanie B Jilcott (East Carolina University); Ammerman, Alice S (University of North Carolina at Chapel Hill); Sitaker, Marilyn (The Evergreen State College); Seguin, Rebecca A (Cornell University)",The Evergreen State College; Cornell University; University of Vermont; East Carolina University; University of North Carolina at Chapel Hill,grid.264899.8; grid.5386.8; grid.59062.38; grid.255364.3; grid.10698.36,Olympia; Ithaca; Burlington; Greenville; Chapel Hill,Washington; New York; Vermont; North Carolina; North Carolina,United States; United States; United States; United States; United States,United States Department of Agriculture; National Institute of Food and Agriculture,USDA,United States; United States,,,6,6,2.55,3.5,https://www.mdpi.com/2072-6643/9/7/726/pdf,https://app.dimensions.ai/details/publication/pub.1090381258,1117 Public Health and Health Services,1117 Public Health and Health Services,,,,,Clinical Research; Clinical Trials and Supportive Activities; Pediatric,Clinical Research,Clinical Trials and Supportive Activities,Pediatric,,,,,,,,,,,,,,,,Public Health,,,,,,,,,,,,,usda,"'(FNS OR ""Food and Nutrition Service "") AND ( USDA OR "" Economic Research Service"") AND (WIC OR ""women, Infants and children"") AND (State AND (agency OR agencies))'",0.201288245,dataset-346
125,pub.1026545327,10.1215/03616878-15-2-319,www.doi.org/10.1215/03616878-15-2-319,2212528,,Domestic Food Policy in the United States,Journal of Health Politics Policy and Law,,Duke University Press,"Financing, Government; Food Services; Forecasting; Humans; Public Policy; Socioeconomic Factors",1990,15,2,319-339,Closed,article,"Lipsky, M; Thibodeau, M A","Lipsky, M (Massachusetts Institute of Technology); Thibodeau, M A ()",Massachusetts Institute of Technology,grid.116068.8,Cambridge,Massachusetts,United States,,,,,,5,1,0,0,,https://app.dimensions.ai/details/publication/pub.1026545327,1117 Public Health and Health Services,1117 Public Health and Health Services,,,,,,,,,,,,,,,,,,,,,,,,,,,,,,,,,,,,,usda,"'(FNS OR ""Food and Nutrition Service "") AND ( USDA OR "" Economic Research Service"") AND (WIC OR ""women, Infants and children"") AND (State AND (agency OR agencies))'",0.199677939,dataset-346
125,pub.1029869466,10.1016/j.ypmed.2015.07.008,www.doi.org/10.1016/j.ypmed.2015.07.008,26190366,PMC4547870,"Nicotine replacement therapy and other interventions for pregnant smokers: Pregnancy Risk Assessment Monitoring System, 2009–2010",Preventive Medicine,,Elsevier,Adult; Female; Humans; Maternal Behavior; Nicotine; Nicotinic Agonists; Pregnancy; Pregnancy Complications; Prenatal Care; Risk Assessment; Smoking; Smoking Cessation; Tobacco Use Cessation Products; United States; Young Adult,2015,78,,92-100,"All OA; Green, Accepted",article,"Kapaya, Martha; Tong, Van; Ding, Helen","Kapaya, Martha (); Tong, Van (National Center for Chronic Disease Prevention and Health Promotion); Ding, Helen ()",National Center for Chronic Disease Prevention and Health Promotion,grid.416781.d,Atlanta,Georgia,United States,Centers for Disease Control and Prevention,CDC,United States,,,4,1,0.34,0.95,http://europepmc.org/articles/pmc4547870?pdf=render,https://app.dimensions.ai/details/publication/pub.1029869466,1117 Public Health and Health Services,1117 Public Health and Health Services,,,,,Perinatal Period - Conditions Originating in Perinatal Period; Clinical Research; Brain Disorders; Cancer; Smoking and Health; Drug Abuse (NIDA Only); Substance Abuse; Conditions Affecting the Embryonic and Fetal Periods; Pediatric; Tobacco; Prevention,Perinatal Period - Conditions Originating in Perinatal Period,Clinical Research,Brain Disorders,Cancer,Smoking and Health,Respiratory; Reproductive Health and Childbirth; Cardiovascular; Cancer,Respiratory,Reproductive Health and Childbirth,Cardiovascular,Cancer,,3.1 Primary prevention interventions to modify behaviours or promote well-being,3.1 Primary prevention interventions to modify behaviours or promote well-being,,,,,Population & Society,Public Health,Lung Cancer; Laryngeal Cancer; Pharyngeal Cancer; Esophageal / Oesophageal Cancer,Lung Cancer,Laryngeal Cancer,Pharyngeal Cancer,Esophageal / Oesophageal Cancer,,3.1 Interventions to Prevent Cancer: Personal Behaviors That Affect Cancer Risk,3.1 Interventions to Prevent Cancer: Personal Behaviors That Affect Cancer Risk,,,,,usda,"'(FNS OR ""Food and Nutrition Service "") AND ( USDA OR "" Economic Research Service"") AND (WIC OR ""women, Infants and children"") AND (State AND (agency OR agencies))'",0.199677939,dataset-346
124,pub.1025033881,10.1353/hpu.2012.0116,www.doi.org/10.1353/hpu.2012.0116,24212167,,Chronic Health Conditions and Depressive Symptoms Strongly Predict Persistent Food Insecurity among Rural Low-income Families,Journal of Health Care for the Poor and Underserved,,Johns Hopkins University Press,Adult; Chronic Disease; Depression; Educational Status; Food Supply; Humans; Longitudinal Studies; Poverty; Risk Factors; Rural Population; United States,2012,23,3,1174-1188,Closed,article,"Hanson, Karla L.; Olson, Christine M.","Hanson, Karla L. (Cornell University); Olson, Christine M. ()",Cornell University,grid.5386.8,Ithaca,New York,United States,,,,,,12,10,0.88,1.67,,https://app.dimensions.ai/details/publication/pub.1025033881,1117 Public Health and Health Services,1117 Public Health and Health Services,,,,,Pediatric; Behavioral and Social Science; Prevention; Clinical Research; Mental Health; Basic Behavioral and Social Science; Depression; Rural Health; Nutrition,Pediatric,Behavioral and Social Science,Prevention,Clinical Research,Mental Health,Generic Health Relevance,Generic Health Relevance,,,,,,,,,,,Population & Society,Public Health,,,,,,,,,,,,,usda,"'(FNS OR ""Food and Nutrition Service "") AND ( USDA OR "" Economic Research Service"") AND (WIC OR ""women, Infants and children"") AND (State AND (agency OR agencies))'",0.198067633,dataset-346
124,pub.1039014434,10.1353/foc.2006.0007,www.doi.org/10.1353/foc.2006.0007,16532661,,The Role of Schools in Obesity Prevention,The Future of Children,,Johns Hopkins University Press,"Adolescent; Child; Child Nutritional Physiological Phenomena; Child, Preschool; Food Services; Health Education; Health Policy; Humans; National Health Programs; Obesity; Physical Education and Training; School Health Services; Schools; United States",2006,16,1,109-142,Closed,article,"Story, Mary; Kaphingst, Karen M; French, Simone","Story, Mary (University of Minnesota); Kaphingst, Karen M (); French, Simone ()",University of Minnesota,grid.17635.36,Minneapolis,Minnesota,United States,,,,,,278,46,9.43,22.19,,https://app.dimensions.ai/details/publication/pub.1039014434,1117 Public Health and Health Services,1117 Public Health and Health Services,,,,,Prevention; Nutrition; Obesity,Prevention,Nutrition,Obesity,,,Cardiovascular; Stroke; Oral and Gastrointestinal; Metabolic and Endocrine; Cancer,Cardiovascular,Stroke,Oral and Gastrointestinal,Metabolic and Endocrine,Cancer,3.1 Primary prevention interventions to modify behaviours or promote well-being,3.1 Primary prevention interventions to modify behaviours or promote well-being,,,,,Population & Society,Public Health,,,,,,,,,,,,,usda,"'(FNS OR ""Food and Nutrition Service "") AND ( USDA OR "" Economic Research Service"") AND (WIC OR ""women, Infants and children"") AND (State AND (agency OR agencies))'",0.198067633,dataset-346
124,pub.1046956892,10.1007/s10995-008-0430-5,www.doi.org/10.1007/s10995-008-0430-5,19082697,,A Quasi-Experimental Evaluation of a Breastfeeding Support Program for Low Income Women in Michigan,Maternal and Child Health Journal,,Springer Nature,"Breast Feeding; Consultants; Data Collection; Female; Health Education; Humans; Infant; Infant, Newborn; Michigan; Peer Group; Poverty; Program Evaluation; Young Adult",2010,14,1,86,Closed,article,"Olson, Beth H.; Haider, Steven J.; Vangjel, Lenisa; Bolton, Tracie A.; Gold, Jonathan G.","Olson, Beth H. (Michigan State University); Haider, Steven J. (Michigan State University); Vangjel, Lenisa (Michigan State University); Bolton, Tracie A. (Michigan State University); Gold, Jonathan G. (Michigan State University)",Michigan State University,grid.17088.36,East Lansing,Michigan,United States,Michigan Department of Health and Human Services,,United States,,,34,13,2.45,3.77,,https://app.dimensions.ai/details/publication/pub.1046956892,1117 Public Health and Health Services,1117 Public Health and Health Services,,,,,Pediatric; Clinical Research; Health Services; Prevention; Comparative Effectiveness Research,Pediatric,Clinical Research,Health Services,Prevention,Comparative Effectiveness Research,Reproductive Health and Childbirth,Reproductive Health and Childbirth,,,,,,,,,,,Health services & systems,Public Health,,,,,,,,,,,,,usda,"'(FNS OR ""Food and Nutrition Service "") AND ( USDA OR "" Economic Research Service"") AND (WIC OR ""women, Infants and children"") AND (State AND (agency OR agencies))'",0.198067633,dataset-346
127,pub.1038460415,10.1111/1475-6773.12199,www.doi.org/10.1111/1475-6773.12199,25039793,PMC4254137,An Evaluation of the Effects of a Breastfeeding Support Program on Health Outcomes,Health Services Research,,Wiley,"Breast Feeding; Female; Humans; Infant; Infant Welfare; Infant, Newborn; Male; Michigan; Outcome Assessment (Health Care); Patient Acceptance of Health Care; Program Evaluation",2014,49,6,2017-2034,"All OA; Green, Published",article,"Haider, Steven J.; Chang, Lenisa V.; Bolton, Tracie A.; Gold, Jonathan G.; Olson, Beth H.","Haider, Steven J. (Michigan State University); Chang, Lenisa V. (University of Cincinnati); Bolton, Tracie A. (); Gold, Jonathan G. (); Olson, Beth H. ()",Michigan State University; University of Cincinnati,grid.17088.36; grid.24827.3b,East Lansing; Cincinnati,Michigan; Ohio,United States; United States,Medical Research Council,cOAlition S; UKRI,United Kingdom,,,6,5,0.71,1.13,http://europepmc.org/articles/pmc4254137?pdf=render,https://app.dimensions.ai/details/publication/pub.1038460415,1117 Public Health and Health Services,1117 Public Health and Health Services,,,,,Pediatric; Infant Mortality/ (LBW); Health Services; Clinical Research; Prevention,Pediatric,Infant Mortality/ (LBW),Health Services,Clinical Research,Prevention,Reproductive Health and Childbirth,Reproductive Health and Childbirth,,,,,,,,,,,Health services & systems,Public Health,,,,,,,,,,,,,usda,"'(FNS OR ""Food and Nutrition Service "") AND (WIC OR ""women, infants and Children"") AND ""Program Data""'",0.196875,dataset-346
127,pub.1038460415,10.1111/1475-6773.12199,www.doi.org/10.1111/1475-6773.12199,25039793,PMC4254137,An Evaluation of the Effects of a Breastfeeding Support Program on Health Outcomes,Health Services Research,,Wiley,"Breast Feeding; Female; Humans; Infant; Infant Welfare; Infant, Newborn; Male; Michigan; Outcome Assessment (Health Care); Patient Acceptance of Health Care; Program Evaluation",2014,49,6,2017-2034,"All OA; Green, Published",article,"Haider, Steven J.; Chang, Lenisa V.; Bolton, Tracie A.; Gold, Jonathan G.; Olson, Beth H.","Haider, Steven J. (Michigan State University); Chang, Lenisa V. (University of Cincinnati); Bolton, Tracie A. (); Gold, Jonathan G. (); Olson, Beth H. ()",Michigan State University; University of Cincinnati,grid.17088.36; grid.24827.3b,East Lansing; Cincinnati,Michigan; Ohio,United States; United States,Medical Research Council,cOAlition S; UKRI,United Kingdom,,,6,5,0.71,1.13,http://europepmc.org/articles/pmc4254137?pdf=render,https://app.dimensions.ai/details/publication/pub.1038460415,1117 Public Health and Health Services,1117 Public Health and Health Services,,,,,Pediatric; Infant Mortality/ (LBW); Health Services; Clinical Research; Prevention,Pediatric,Infant Mortality/ (LBW),Health Services,Clinical Research,Prevention,Reproductive Health and Childbirth,Reproductive Health and Childbirth,,,,,,,,,,,Health services & systems,Public Health,,,,,,,,,,,,,usda,"'(FNS OR ""Food and Nutrition Service "") AND (WIC OR ""women, infants and Children"") AND ""Program Data""'",0.196567863,dataset-346
123,pub.1053400071,10.1016/s1499-4046(06)60069-9,www.doi.org/10.1016/s1499-4046(06)60069-9,12857544,,Measures of Food Insecurity/Security,Journal of Nutrition Education and Behavior,,Elsevier,Diet; Food Supply; Humans; Hunger; Nutrition Surveys; Nutritional Sciences; Nutritional Status,2001,33,,s49-s58,Closed,article,"Keenan, Debra Palmer; Olson, Christine; Hersey, James C.; Parmer, Sondra M.","Keenan, Debra Palmer (Rutgers University); Olson, Christine (Cornell University); Hersey, James C. (RTI International); Parmer, Sondra M. (Auburn University)",Auburn University; Cornell University; Rutgers University; RTI International,grid.252546.2; grid.5386.8; grid.430387.b; grid.62562.35,Auburn; Ithaca; New Brunswick; Durham,Alabama; New York; New Jersey; North Carolina,United States; United States; United States; United States,,,,,,71,14,2.12,4.61,,https://app.dimensions.ai/details/publication/pub.1053400071,1111 Nutrition and Dietetics,1111 Nutrition and Dietetics,,,,,Prevention; Nutrition,Prevention,Nutrition,,,,Oral and Gastrointestinal; Cardiovascular; Stroke; Metabolic and Endocrine,Oral and Gastrointestinal,Cardiovascular,Stroke,Metabolic and Endocrine,,,,,,,,Population & Society,Public Health,,,,,,,,,,,,,usda,"'(FNS OR ""Food and Nutrition Service "") AND ( USDA OR "" Economic Research Service"") AND (WIC OR ""women, Infants and children"") AND (State AND (agency OR agencies))'",0.196457327,dataset-346
122,pub.1016253723,10.1017/s1368980016002524,www.doi.org/10.1017/s1368980016002524,27641618,PMC5357581,"Food and beverage purchases in corner stores, gas-marts, pharmacies and dollar stores",Public Health Nutrition,,Cambridge University Press (CUP),Adult; Beverages; Choice Behavior; Consumer Behavior; Diet; Female; Food Preferences; Food Supply; Humans; Male; Micronutrients; Middle Aged; Pilot Projects; Residence Characteristics; Socioeconomic Factors,2017,20,14,11-Jan,All OA; Bronze,article,"Caspi, Caitlin E; Lenk, Kathleen; Pelletier, Jennifer E; Barnes, Timothy L; Harnack, Lisa; Erickson, Darin J; Laska, Melissa N","Caspi, Caitlin E (University of Minnesota System); Lenk, Kathleen (University of Minnesota System); Pelletier, Jennifer E (University of Minnesota System); Barnes, Timothy L (University of Minnesota System); Harnack, Lisa (University of Minnesota System); Erickson, Darin J (University of Minnesota System); Laska, Melissa N (University of Minnesota System)",University of Minnesota System,grid.437349.e,Minneapolis,Minnesota,United States,National Cancer Institute; National Center for Advancing Translational Sciences; National Institute of Child Health and Human Development; National Institute of Diabetes and Digestive and Kidney Diseases,NIH,United States; United States; United States; United States,grant.2622730; grant.2705213; grant.6375375; grant.2699299; grant.3858959,R25CA163184; T32CA163184; U54HD070725; R01DK104348; UL1TR000114,12,12,4.74,6.31,https://www.cambridge.org/core/services/aop-cambridge-core/content/view/169F8439A2A58588BAE4021E51FEA55F/S1368980016002524a.pdf/div-class-title-food-and-beverage-purchases-in-corner-stores-gas-marts-pharmacies-and-dollar-stores-div.pdf,https://app.dimensions.ai/details/publication/pub.1016253723,1111 Nutrition and Dietetics,1111 Nutrition and Dietetics,,,,,Nutrition; Prevention,Nutrition,Prevention,,,,Stroke; Metabolic and Endocrine; Oral and Gastrointestinal; Cardiovascular,Stroke,Metabolic and Endocrine,Oral and Gastrointestinal,Cardiovascular,,,,,,,,,,,,,,,,,,,,,,usda,"'(FNS OR ""Food and Nutrition Service "") AND ( USDA OR "" Economic Research Service"") AND (WIC OR ""women, Infants and children"") AND (State AND (agency OR agencies))'",0.194847021,dataset-346
122,pub.1113041401,10.1111/josh.12759,www.doi.org/10.1111/josh.12759,30919968,,School Wellness in Wisconsin: Evaluating Policies for Practices to Prevent Pediatric Obesity,Journal of School Health,,Wiley,,2019,,,,Closed,article,"Weymouth, Lindsay; Joyner, Hilary; Skalitzky, Erin; Cotter, Avery; Engstrom, Kellyn; Jorgensen, Lauren","Weymouth, Lindsay (University of Wisconsin–Madison); Joyner, Hilary (University of Wisconsin–Madison); Skalitzky, Erin (University of Wisconsin–Madison); Cotter, Avery (University of Wisconsin–Madison); Engstrom, Kellyn (University of Wisconsin–Madison); Jorgensen, Lauren (University of Wisconsin–Madison)",University of Wisconsin–Madison,grid.14003.36,Madison,Wisconsin,United States,,,,,,0,0,0,0,,https://app.dimensions.ai/details/publication/pub.1113041401,1117 Public Health and Health Services,1117 Public Health and Health Services,,,,,Prevention; Clinical Research; Obesity; Pediatric,Prevention,Clinical Research,Obesity,Pediatric,,Cancer,Cancer,,,,,,,,,,,,,,,,,,,,,,,,,usda,"'(FNS OR ""Food and Nutrition Service "") AND ( USDA OR "" Economic Research Service"") AND (WIC OR ""women, Infants and children"") AND (State AND (agency OR agencies))'",0.194847021,dataset-346
122,pub.1004791802,10.1016/j.jada.2009.09.018,www.doi.org/10.1016/j.jada.2009.09.018,19862847,,Position of the American Dietetic Association: Promoting and Supporting Breastfeeding,Journal of the Academy of Nutrition and Dietetics,,Elsevier,"Adult; Breast Feeding; Child Nutrition Sciences; Child Welfare; Child, Preschool; Dietetics; Educational Status; Female; Health Promotion; Humans; Infant; Infant Nutritional Physiological Phenomena; Infant, Newborn; Male; Maternal Welfare; Mothers; Nutrition Policy; Public Health; Societies; Socioeconomic Factors; United States; Young Adult",2009,109,11,1926-1942,Closed,article,"James, Delores C S; Lessen, Rachelle","James, Delores C S (University of Florida); Lessen, Rachelle ()",University of Florida,grid.15276.37,Gainesville,Florida,United States,,,,,,93,19,3.83,9.21,,https://app.dimensions.ai/details/publication/pub.1004791802,1117 Public Health and Health Services,1117 Public Health and Health Services,,,,,Perinatal Period - Conditions Originating in Perinatal Period; Rare Diseases; Patient Safety; Clinical Research; Prevention; Obesity; Infant Mortality/ (LBW); Nutrition; Pediatric,Perinatal Period - Conditions Originating in Perinatal Period,Rare Diseases,Patient Safety,Clinical Research,Prevention,Metabolic and Endocrine; Reproductive Health and Childbirth,Metabolic and Endocrine,Reproductive Health and Childbirth,,,,,,,,,,Population & Society,Public Health,,,,,,,,,,,,,usda,"'(FNS OR ""Food and Nutrition Service "") AND ( USDA OR "" Economic Research Service"") AND (WIC OR ""women, Infants and children"") AND (State AND (agency OR agencies))'",0.194847021,dataset-346
121,pub.1005548486,10.1207/s15327655jchn2202_5,www.doi.org/10.1207/s15327655jchn2202_5,15877540,,First Trimester Predictors of Diet and Birth Outcomes in Low-Income Pregnant Women,Journal of Community Health Nursing,,Taylor & Francis,"Adult; Birth Weight; Body Mass Index; Cohort Studies; Diet Surveys; Educational Status; Female; Food Services; Humans; Illinois; Infant, Newborn; Maternal Age; Maternal Nutritional Physiological Phenomena; Models, Statistical; Nutritional Sciences; Nutritional Status; Poverty; Predictive Value of Tests; Pregnancy; Pregnancy Outcome; Pregnancy Trimester, First; Pregnant Women; Surveys and Questionnaires",2005,22,2,117-130,Closed,article,"Fowles, Eileen R; Gabrielson, Marcena","Fowles, Eileen R (Illinois State University); Gabrielson, Marcena ()",Illinois State University,grid.257310.2,Normal,Illinois,United States,National Institute of Nursing Research,NIH,United States,grant.2685509,T32NR007107,16,4,0.66,1.22,,https://app.dimensions.ai/details/publication/pub.1005548486,1114 Paediatrics and Reproductive Medicine; 1111 Nutrition and Dietetics; 1117 Public Health and Health Services,1114 Paediatrics and Reproductive Medicine,1111 Nutrition and Dietetics,1117 Public Health and Health Services,,,Infant Mortality/ (LBW); Perinatal Period - Conditions Originating in Perinatal Period; Nutrition; Behavioral and Social Science; Pediatric; Obesity; Perinatal - Birth - Preterm (LBW); Prevention,Infant Mortality/ (LBW),Perinatal Period - Conditions Originating in Perinatal Period,Nutrition,Behavioral and Social Science,Pediatric,Reproductive Health and Childbirth,Reproductive Health and Childbirth,,,,,2.2 Factors relating to physical environment,2.2 Factors relating to physical environment,,,,,Population & Society,Public Health,,,,,,,,,,,,,usda,"'(FNS OR ""Food and Nutrition Service "") AND ( USDA OR "" Economic Research Service"") AND (WIC OR ""women, Infants and children"") AND (State AND (agency OR agencies))'",0.193236715,dataset-346
