rank,publication_id,doi,url,pmid,pmcid,title,source_title,anthology_title,publisher,mesh_terms,pubyear,volume,issue,pagination,open_access,publication_type,authors,authors_affiliations,research_organizations_-_standardized,grid_ids,city_of_research_organization,state_of_research_organization,country_of_research_organization,funder,funder_group,funder_country,uids_of_supporting_grants,supporting_grants,times_cited,recent_citations,rcr,fcr,source_linkout,dimensions_url,for_(anzsrc)_categories,for_1,for_2,for_3,for_4,for_5,rcdc_categories,rcdc_1,rcdc_2,rcdc_3,rcdc_4,rcdc_5,hrcs_hc_categories,hrcs_hc_1,hrcs_hc_2,hrcs_hc_3,hrcs_hc_4,hrcs_hc_5,hrcs_rac_categories,hrcs_rac_1,hrcs_rac_2,hrcs_rac_3,hrcs_rac_4,hrcs_rac_5,health_research_areas,broad_research_areas,icrp_cancer_types,icrp_cancer_types_1,icrp_cancer_types_2,icrp_cancer_types_3,icrp_cancer_types_4,icrp_cancer_types_5,icrp_cso_categories,icrp_cso_1,icrp_cso_2,icrp_cso_3,icrp_cso_4,icrp_cso_5,domain,search_note,norm_rank,dataset
94,pub.1084120541,10.1017/age.2016.39,www.doi.org/10.1017/age.2016.39,,,The Impact of Policy Changes on Milk and Beverage Consumption of Texas WIC Children,Agricultural and Resource Economics Review,,Cambridge University Press (CUP),,2017,46,3,421-442,All OA; Pure Gold,article,"Ishdorj, Ariun; Capps, Oral","Ishdorj, Ariun (); Capps, Oral ()",,,,,,,,,,,0,0,0,0,https://www.cambridge.org/core/services/aop-cambridge-core/content/view/7C71CBAA206EC4D15107D4EDDA09D0E9/S1068280516000393a.pdf/div-class-title-the-impact-of-policy-changes-on-milk-and-beverage-consumption-of-texas-wic-children-div.pdf,https://app.dimensions.ai/details/publication/pub.1084120541,1117 Public Health and Health Services,1117 Public Health and Health Services,,,,,Pediatric; Nutrition,Pediatric,Nutrition,,,,,,,,,,3.3 Nutrition and chemoprevention,3.3 Nutrition and chemoprevention,,,,,Clinical,,,,,,,,,,,,,,usda,"'(FNS OR ""Food and Nutrition Service "") AND ( USDA OR "" Economic Research Service"") AND (WIC OR ""women, Infants and children"") AND (State AND (agency OR agencies))'",0.149758454,dataset-346
94,pub.1023063634,10.1111/j.1532-5415.2008.02010.x,www.doi.org/10.1111/j.1532-5415.2008.02010.x,19112654,,Successful Dissemination of a Community‐Based Strength Training Program for Older Adults by Peer and Professional Leaders: The People Exercising Program,Journal of the American Geriatrics Society,,Wiley,Aged; Community Networks; Feasibility Studies; Female; Health Promotion; Humans; Longitudinal Studies; Male; Middle Aged; Resistance Training,2008,56,12,2323-2329,Closed,article,"Layne, Jennifer E.; Sampson, Susan E.; Mallio, Charlotte J.; Hibberd, Patricia L.; Griffith, John L.; Das, Sai Krupa; Flanagan, William J.; Castaneda‐Sceppa, Carmen","Layne, Jennifer E. (Tufts University); Sampson, Susan E. (Tufts University); Mallio, Charlotte J. (Tufts University); Hibberd, Patricia L. (Tufts University); Griffith, John L. (Tufts University); Das, Sai Krupa (Tufts University); Flanagan, William J. (Tufts University); Castaneda‐Sceppa, Carmen (Tufts University)",Tufts University,grid.429997.8,Medford,Massachusetts,United States,,,,,,30,10,1.26,2.89,,https://app.dimensions.ai/details/publication/pub.1023063634,1701 Psychology,1701 Psychology,,,,,Aging; Prevention; Clinical Research,Aging,Prevention,Clinical Research,,,,,,,,,,,,,,,Population & Society,Public Health,,,,,,,,,,,,,usda,"'(FNS OR ""Food and Nutrition Service "") AND ( USDA OR "" Economic Research Service"") AND (WIC OR ""women, Infants and children"") AND (State AND (agency OR agencies))'",0.149758454,dataset-346
94,pub.1046627648,10.1111/j.1744-6155.2008.00156.x,www.doi.org/10.1111/j.1744-6155.2008.00156.x,18638052,,"Ask the Expert 
Legislative Efforts to Combat Childhood Obesity",Journal for Specialists in Pediatric Nursing,,Wiley,Child; Child Welfare; Female; Health Education; Health Policy; Health Promotion; Humans; Male; Obesity; Public Health Practice; Socioeconomic Factors; United States,2008,13,3,223-225,Closed,article,"Rhodes, Ann M.","Rhodes, Ann M. ()",,,,,,,,,,,1,0,0.05,0,,https://app.dimensions.ai/details/publication/pub.1046627648,,,,,,,,,,,,,,,,,,,,,,,,,,,,,,,,,,,,,,,usda,"'(FNS OR ""Food and Nutrition Service "") AND ( USDA OR "" Economic Research Service"") AND (WIC OR ""women, Infants and children"") AND (State AND (agency OR agencies))'",0.149758454,dataset-346
94,pub.1027364065,10.1111/j.1748-720x.2007.00115.x,www.doi.org/10.1111/j.1748-720x.2007.00115.x,17341219,,Application of Law to the Childhood Obesity Epidemic,The Journal of Law Medicine & Ethics,,SAGE Publications,Adolescent; Advertising as Topic; Child; Disease Outbreaks; Exercise; Food Industry; Food Services; Health Policy; Health Promotion; Humans; Obesity; United States,2007,35,1,90-112,Closed,article,"Alderman, Jess; Smith, Jason A; Fried, Ellen J; Daynard, Richard A","Alderman, Jess (Northeastern University); Smith, Jason A (); Fried, Ellen J (); Daynard, Richard A ()",Northeastern University,grid.261112.7,Boston,Massachusetts,United States,,,,,,26,4,0.87,4.75,,https://app.dimensions.ai/details/publication/pub.1027364065,1117 Public Health and Health Services; 1801 Law,1117 Public Health and Health Services,1801 Law,,,,Nutrition; Prevention; Obesity,Nutrition,Prevention,Obesity,,,Metabolic and Endocrine; Cardiovascular; Stroke; Oral and Gastrointestinal,Metabolic and Endocrine,Cardiovascular,Stroke,Oral and Gastrointestinal,,,,,,,,Population & Society,Public Health,,,,,,,,,,,,,usda,"'(FNS OR ""Food and Nutrition Service "") AND ( USDA OR "" Economic Research Service"") AND (WIC OR ""women, Infants and children"") AND (State AND (agency OR agencies))'",0.149758454,dataset-346
94,pub.1015864102,10.1111/j.1746-1561.2011.00671.x,www.doi.org/10.1111/j.1746-1561.2011.00671.x,22239134,,The Effect of Nutrient‐Based Standards on Competitive Foods in 3 Schools: Potential Savings in Kilocalories and Grams of Fat*,Journal of School Health,,Wiley,Adolescent; Adolescent Nutritional Physiological Phenomena; Diet; Dietary Carbohydrates; Dietary Fats; Dietary Proteins; Energy Intake; Food Services; Health Promotion; Humans; Menu Planning; Nutritive Value; Schools,2012,82,2,91-96,Closed,article,"Snelling, Anastasia M.; Yezek, Jennifer","Snelling, Anastasia M. (American University); Yezek, Jennifer (American University)",American University,grid.63124.32,Washington D.C.,District of Columbia,United States,,,,,,3,2,0.23,0.4,,https://app.dimensions.ai/details/publication/pub.1015864102,1111 Nutrition and Dietetics,1111 Nutrition and Dietetics,,,,,Clinical Research; Nutrition; Obesity,Clinical Research,Nutrition,Obesity,,,Metabolic and Endocrine; Cardiovascular; Oral and Gastrointestinal; Stroke; Cancer,Metabolic and Endocrine,Cardiovascular,Oral and Gastrointestinal,Stroke,Cancer,,,,,,,,,,,,,,,,,,,,,usda,"'(FNS OR ""Food and Nutrition Service "") AND ( USDA OR "" Economic Research Service"") AND (WIC OR ""women, Infants and children"") AND (State AND (agency OR agencies))'",0.149758454,dataset-346
94,pub.1026441028,10.1007/978-0-387-47860-9_7,www.doi.org/10.1007/978-0-387-47860-9_7,,,The Role of Government in Preventing Obesity,,Handbook of Obesity Prevention,Springer Nature,,2007,,,129-170,Closed,chapter,"Haire-Joshu, Debra; Fleming, Christopher; Schermbeck, Rebecca","Haire-Joshu, Debra (); Fleming, Christopher (); Schermbeck, Rebecca ()",,,,,,,,,,,3,0,0,0,,https://app.dimensions.ai/details/publication/pub.1026441028,,,,,,,,,,,,,,,,,,,,,,,,,,,,,,,,,,,,,,,usda,"'(FNS OR ""Food and Nutrition Service "") AND ( USDA OR "" Economic Research Service"") AND (WIC OR ""women, Infants and children"") AND (State AND (agency OR agencies))'",0.149758454,dataset-346
94,pub.1042383876,10.1080/21551197.2015.1054572,www.doi.org/10.1080/21551197.2015.1054572,26267441,,Sustaining Our Nation's Seniors through Federal Food and Nutrition Programs,Journal of Nutrition in Gerontology and Geriatrics,,Taylor & Francis,"Adult; Aged; Aged, 80 and over; Child; Crops, Agricultural; Diet; Financing, Government; Food Assistance; Food Supply; Fruit; Health Policy; Humans; Independent Living; Interpersonal Relations; Middle Aged; Nutritional Physiological Phenomena; Nutritive Value; Poverty; Program Evaluation; United States; United States Department of Agriculture; Vegetables",2015,34,3,273-291,Closed,article,"Gergerich, Erika; Shobe, Marcia; Christy, Kameri","Gergerich, Erika (New Mexico State University); Shobe, Marcia (); Christy, Kameri ()",New Mexico State University,grid.24805.3b,Las Cruces,New Mexico,United States,,,,,,7,6,0.82,2.26,,https://app.dimensions.ai/details/publication/pub.1042383876,1402 Applied Economics; 1117 Public Health and Health Services,1402 Applied Economics,1117 Public Health and Health Services,,,,Clinical Research; Aging; Nutrition,Clinical Research,Aging,Nutrition,,,,,,,,,,,,,,,Population & Society,,,,,,,,,,,,,,usda,"'(FNS OR ""Food and Nutrition Service "") AND ( USDA OR "" Economic Research Service"") AND (WIC OR ""women, Infants and children"") AND (State AND (agency OR agencies))'",0.149758454,dataset-346
93,pub.1067826905,10.1542/peds.2008-0286,www.doi.org/10.1542/peds.2008-0286,18829785,,"A Brief Indicator of Household Energy Security: Associations With Food Security, Child Health, and Child Development in US Infants and Toddlers",Pediatrics,,American Academy of Pediatrics (AAP),"Child Development; Child Welfare; Child, Preschool; Cross-Sectional Studies; Energy-Generating Resources; Family Characteristics; Female; Food Supply; Humans; Infant; Male; Nutritional Status; Public Assistance; Retrospective Studies; Risk Factors; United States",2008,122,4,e867-e875,Closed,article,"Cook, John T.; Frank, Deborah A.; Casey, Patrick H.; Rose-Jacobs, Ruth; Black, Maureen M.; Chilton, Mariana; deCuba, Stephanie Ettinger; Appugliese, Danielle; Coleman, Sharon; Heeren, Timothy; Berkowitz, Carol; Cutts, Diana B.","Cook, John T. (Boston Medical Center); Frank, Deborah A. (Boston Medical Center); Casey, Patrick H. (University of Arkansas for Medical Sciences); Rose-Jacobs, Ruth (Boston Medical Center); Black, Maureen M. (University of Maryland, Baltimore); Chilton, Mariana (Drexel University); deCuba, Stephanie Ettinger (Boston University); Appugliese, Danielle (Boston University); Coleman, Sharon (Boston University); Heeren, Timothy (Boston University); Berkowitz, Carol (Harbor–UCLA Medical Center); Cutts, Diana B. (Hennepin County Medical Center)","Boston University; Hennepin County Medical Center; University of Arkansas for Medical Sciences; Harbor–UCLA Medical Center; Boston Medical Center; University of Maryland, Baltimore; Drexel University",grid.189504.1; grid.414021.2; grid.241054.6; grid.239844.0; grid.239424.a; grid.411024.2; grid.166341.7,Boston; Minneapolis; Little Rock; Torrance; Boston; Baltimore; Philadelphia,Massachusetts; Minnesota; Arkansas; California; Massachusetts; Maryland; Pennsylvania,United States; United States; United States; United States; United States; United States; United States,W.K. Kellogg Foundation; John A. Hartford Foundation,,United States; United States,,,59,13,1.29,5.29,,https://app.dimensions.ai/details/publication/pub.1067826905,1117 Public Health and Health Services,1117 Public Health and Health Services,,,,,Prevention; Pediatric; Behavioral and Social Science; Clinical Research,Prevention,Pediatric,Behavioral and Social Science,Clinical Research,,,,,,,,,,,,,,Population & Society,Public Health,,,,,,,,,,,,,usda,"'(FNS OR ""Food and Nutrition Service "") AND ( USDA OR "" Economic Research Service"") AND (WIC OR ""women, Infants and children"") AND (State AND (agency OR agencies))'",0.148148148,dataset-346
93,pub.1004715308,10.1136/bmj.i2351,www.doi.org/10.1136/bmj.i2351,27189229,PMC4870381,Potato intake and incidence of hypertension: results from three prospective US cohort studies,The BMJ,,BMJ,Adult; Aged; Cooking; Diet; Dietary Carbohydrates; Female; Follow-Up Studies; Humans; Hypertension; Incidence; Longitudinal Studies; Male; Middle Aged; Proportional Hazards Models; Prospective Studies; Risk Factors; Solanum tuberosum; United States,2016,353,,i2351,All OA; Hybrid,article,"Borgi, Lea; Rimm, Eric B; Willett, Walter C; Forman, John P","Borgi, Lea (Brigham and Women's Hospital); Rimm, Eric B (Brigham and Women's Hospital; Harvard University); Willett, Walter C (Brigham and Women's Hospital; Harvard University); Forman, John P (Brigham and Women's Hospital)",Harvard University; Brigham and Women's Hospital,grid.38142.3c; grid.62560.37,Cambridge; Boston,Massachusetts; Massachusetts,United States; United States,National Cancer Institute; National Heart Lung and Blood Institute; American Heart Association,HRA; NIH,United States; United States; United States,grant.2531899; grant.2705365; grant.2705362; grant.2531702; grant.3801883,R01HL034594; R01HL035464; UM1CA186107; UM1CA167552; UM1CA176726,30,23,2.7,10.1,https://www.bmj.com/content/353/bmj.i2351.full.pdf,https://app.dimensions.ai/details/publication/pub.1004715308,1117 Public Health and Health Services,1117 Public Health and Health Services,,,,,Cardiovascular; Clinical Research,Cardiovascular,Clinical Research,,,,,,,,,,,,,,,,Population & Society,Public Health,,,,,,,,,,,,,usda,"'(FNS OR ""Food and Nutrition Service "") AND ( USDA OR "" Economic Research Service"") AND (WIC OR ""women, Infants and children"") AND (State AND (agency OR agencies))'",0.148148148,dataset-346
93,pub.1049681779,10.1089/jwh.2016.5990,www.doi.org/10.1089/jwh.2016.5990,27463691,PMC5176340,"Five-Year Progress Update on the Surgeon General's Call to Action to Support Breastfeeding, 2011",Journal of Women's Health,,Mary Ann Liebert,"Breast Feeding; Centers for Disease Control and Prevention (U.S.); Female; Health Policy; Health Promotion; Humans; Postnatal Care; Pregnancy; Public Health; Social Support; United States; Women, Working",2016,25,8,768-776,"All OA; Green, Accepted",article,"Anstey, Erica H.; MacGowan, Carol A.; Allen, Jessica A.","Anstey, Erica H. (Centers for Disease Control and Prevention); MacGowan, Carol A. (Centers for Disease Control and Prevention); Allen, Jessica A. (Centers for Disease Control and Prevention)",Centers for Disease Control and Prevention,grid.416738.f,Atlanta,Georgia,United States,Centers for Disease Control and Prevention,CDC,United States,,,3,3,0.39,1.01,http://europepmc.org/articles/pmc5176340?pdf=render,https://app.dimensions.ai/details/publication/pub.1049681779,1117 Public Health and Health Services,1117 Public Health and Health Services,,,,,,,,,,,,,,,,,,,,,,,Population & Society,,,,,,,,,,,,,,usda,"'(FNS OR ""Food and Nutrition Service "") AND ( USDA OR "" Economic Research Service"") AND (WIC OR ""women, Infants and children"") AND (State AND (agency OR agencies))'",0.148148148,dataset-346
93,pub.1007464475,10.1111/j.1746-1561.2010.00538.x,www.doi.org/10.1111/j.1746-1561.2010.00538.x,21039551,,"School Wellness Policies: Perceptions, Barriers, and Needs Among School Leaders and Wellness Advocates*",Journal of School Health,,Wiley,Adolescent; Child; Child Nutritional Physiological Phenomena; Child Welfare; Exercise; Female; Health Policy; Health Promotion; Humans; Male; Obesity; Physical Education and Training; School Health Services; Schools; United States,2010,80,11,527-535,Closed,article,"Agron, Peggy; Berends, Victoria; Ellis, Karen; Gonzalez, Martin","Agron, Peggy (California Department of Public Health); Berends, Victoria (California Department of Public Health); Ellis, Karen (); Gonzalez, Martin ()",California Department of Public Health,grid.236815.b,Sacramento,California,United States,,,,,,51,15,2.54,5.65,,https://app.dimensions.ai/details/publication/pub.1007464475,1117 Public Health and Health Services,1117 Public Health and Health Services,,,,,Nutrition; Basic Behavioral and Social Science; Prevention; Clinical Research; Behavioral and Social Science; Obesity,Nutrition,Basic Behavioral and Social Science,Prevention,Clinical Research,Behavioral and Social Science,,,,,,,,,,,,,Population & Society,Public Health,,,,,,,,,,,,,usda,"'(FNS OR ""Food and Nutrition Service "") AND ( USDA OR "" Economic Research Service"") AND (WIC OR ""women, Infants and children"") AND (State AND (agency OR agencies))'",0.148148148,dataset-346
93,pub.1008481032,10.1016/j.jneb.2008.06.004,www.doi.org/10.1016/j.jneb.2008.06.004,19411049,,The Effect of Food Stamp Nutrition Education on the Food Insecurity of Low-income Women Participants,Journal of Nutrition Education and Behavior,,Elsevier,"Adolescent; Adult; Aged; Aged, 80 and over; Female; Food Services; Food Supply; Humans; Indiana; Middle Aged; Nutritional Sciences; Poverty; Public Assistance; Single-Blind Method; Women; Young Adult",2009,41,3,161-168,Closed,article,"Eicher-Miller, Heather A.; Mason, April C.; Abbott, Angela R.; McCabe, George P.; Boushey, Carol J.","Eicher-Miller, Heather A. (Purdue University); Mason, April C. (Colorado State University); Abbott, Angela R. (Purdue University); McCabe, George P. (Purdue University); Boushey, Carol J. (Purdue University)",Purdue University; Colorado State University,grid.169077.e; grid.47894.36,West Lafayette; Fort Collins,Indiana; Colorado,United States; United States,,,,,,30,11,1.34,2.6,,https://app.dimensions.ai/details/publication/pub.1008481032,1111 Nutrition and Dietetics,1111 Nutrition and Dietetics,,,,,Clinical Research; Prevention; Clinical Trials and Supportive Activities; Nutrition,Clinical Research,Prevention,Clinical Trials and Supportive Activities,Nutrition,,,,,,,,,,,,,,Population & Society,,,,,,,,,,,,,,usda,"'(FNS OR ""Food and Nutrition Service "") AND ( USDA OR "" Economic Research Service"") AND (WIC OR ""women, Infants and children"") AND (State AND (agency OR agencies))'",0.148148148,dataset-346
92,pub.1026905412,10.1177/0890334408324452,www.doi.org/10.1177/0890334408324452,19196856,,Breastfeeding in America: A History of Influencing Factors,Journal of Human Lactation,,SAGE Publications,"Adult; Breast Feeding; Choice Behavior; Female; Feminism; Health Knowledge, Attitudes, Practice; History, 19th Century; History, 20th Century; History, 21st Century; Humans; Infant Nutritional Physiological Phenomena; Infant, Newborn; Mothers; United States",2009,25,1,85-94,Closed,article,"Thulier, Diane","Thulier, Diane (University of Rhode Island)",University of Rhode Island,grid.20431.34,Kingston,Rhode Island,United States,,,,,,19,4,0.64,8.71,,https://app.dimensions.ai/details/publication/pub.1026905412,2002 Cultural Studies; 2103 Historical Studies,2002 Cultural Studies,2103 Historical Studies,,,,,,,,,,Reproductive Health and Childbirth,Reproductive Health and Childbirth,,,,,,,,,,,Population & Society,,,,,,,,,,,,,,usda,"'(FNS OR ""Food and Nutrition Service "") AND ( USDA OR "" Economic Research Service"") AND (WIC OR ""women, Infants and children"") AND (State AND (agency OR agencies))'",0.146537842,dataset-346
92,pub.1107982362,10.1016/j.socscimed.2018.11.001,www.doi.org/10.1016/j.socscimed.2018.11.001,30453112,,SNAP benefits and childhood asthma,Social Science & Medicine,,Elsevier,,2019,220,Popul. Res. Pol. Rev. 2018,203-211,Closed,article,"Heflin, Colleen; Arteaga, Irma; Hodges, Leslie; Ndashiyme, Felix; Rabbitt, Matthew P.","Heflin, Colleen (Syracuse University); Arteaga, Irma (University of Missouri); Hodges, Leslie (University of Wisconsin–Green Bay); Ndashiyme, Felix (University of Missouri); Rabbitt, Matthew P. (Economic Research Service)",University of Wisconsin–Green Bay; Syracuse University; University of Missouri; Economic Research Service,grid.267461.0; grid.264484.8; grid.134936.a; grid.482913.5,Green Bay; Syracuse; Columbia; Washington D.C.,Wisconsin; New York; Missouri; District of Columbia,United States; United States; United States; United States,United States Department of Agriculture,USDA,United States,,,0,0,0,0,,https://app.dimensions.ai/details/publication/pub.1107982362,1117 Public Health and Health Services,1117 Public Health and Health Services,,,,,Lung; Asthma; Health Services; Pediatric; Clinical Research,Lung,Asthma,Health Services,Pediatric,Clinical Research,Respiratory,Respiratory,,,,,,,,,,,Population & Society,,,,,,,,,,,,,,usda,"'(FNS OR ""Food and Nutrition Service "") AND ( USDA OR "" Economic Research Service"") AND (WIC OR ""women, Infants and children"") AND (State AND (agency OR agencies))'",0.146537842,dataset-346
92,pub.1031176684,10.1002/pam.21842,www.doi.org/10.1002/pam.21842,26106670,,INTENDED AND UNINTENDED EFFECTS OF THE WAR ON POVERTY: WHAT RESEARCH TELLS US AND IMPLICATIONS FOR POLICY,Journal of Policy Analysis and Management,,Wiley,Adult; Child; Child Development; Child Health Services; Child Welfare; Crime; Employment; Health Services; Humans; Income; Medicaid; Outcome Assessment (Health Care); Poverty; Program Evaluation; Public Assistance; Public Policy; Social Welfare; State Government; Taxes; United States,2015,34,3,639-696,All OA; Bronze,article,"Bitler, Marianne P; Karoly, Lynn A","Bitler, Marianne P (University of California, Irvine); Karoly, Lynn A (RAND Corporation)","University of California, Irvine; RAND Corporation",grid.266093.8; grid.34474.30,Irvine; Santa Monica,California; California,United States; United States,,,,,,9,7,0.48,4.06,http://onlinelibrary.wiley.com/doi/10.1002/pam.21842/pdf,https://app.dimensions.ai/details/publication/pub.1031176684,1402 Applied Economics,1402 Applied Economics,,,,,,,,,,,,,,,,,,,,,,,Population & Society,,,,,,,,,,,,,,usda,"'(FNS OR ""Food and Nutrition Service "") AND ( USDA OR "" Economic Research Service"") AND (WIC OR ""women, Infants and children"") AND (State AND (agency OR agencies))'",0.146537842,dataset-346
92,pub.1046332670,10.1111/j.1754-4505.1984.tb00167.x,www.doi.org/10.1111/j.1754-4505.1984.tb00167.x,6589799,,Access program reaches the elderly,Special Care in Dentistry,,Wiley,Aged; Dental Health Services; Health Services Accessibility; Health Services for the Aged; Humans,1984,4,3,108-109,Closed,article,"WARREN, KRIS","WARREN, KRIS ()",,,,,,,,,,,0,0,0,0,,https://app.dimensions.ai/details/publication/pub.1046332670,,,,,,,,,,,,,,,,,,,,,,,,,,,,,,,,,,,,,,,usda,"'(FNS OR ""Food and Nutrition Service "") AND ( USDA OR "" Economic Research Service"") AND (WIC OR ""women, Infants and children"") AND (State AND (agency OR agencies))'",0.146537842,dataset-346
92,pub.1035348295,10.2105/ajph.72.10.1103,www.doi.org/10.2105/ajph.72.10.1103,,,"Research Quality, Methodologic Rigor, Citation Counts, and Impact",American Journal of Public Health,,American Public Health Association,,1982,72,10,1103-1104,"All OA; Green, Submitted",article,"Bailar, John C.","Bailar, John C. ()",,,,,,,,,,,11,0,0,0,https://www.ncbi.nlm.nih.gov/pmc/articles/PMC1650174/pdf,https://app.dimensions.ai/details/publication/pub.1035348295,,,,,,,,,,,,,,,,,,,,,,,,,,,,,,,,,,,,,,,usda,"'(FNS OR ""Food and Nutrition Service "") AND ( USDA OR "" Economic Research Service"") AND (WIC OR ""women, Infants and children"") AND (State AND (agency OR agencies))'",0.146537842,dataset-346
91,pub.1040617766,10.1016/j.jmwh.2010.06.017,www.doi.org/10.1016/j.jmwh.2010.06.017,20974416,,Prenatal Nutrition: A Practical Guide for Assessment and Counseling,Journal of Midwifery & Women's Health,,Wiley,"Counseling; Feeding Behavior; Female; Health Education; Health Knowledge, Attitudes, Practice; Humans; Midwifery; Mothers; Nurse's Role; Practice Guidelines as Topic; Pregnancy; Pregnancy Complications; Prenatal Care; Prenatal Nutritional Physiological Phenomena; Women's Health",2010,55,6,540-549,Closed,article,"Widen, Elizabeth; Siega‐Riz, Anna Maria","Widen, Elizabeth (); Siega‐Riz, Anna Maria ()",,,,,,National Institute of Child Health and Human Development,NIH,United States,grant.2621420,R24HD050924,26,4,1.09,2.88,,https://app.dimensions.ai/details/publication/pub.1040617766,1117 Public Health and Health Services; 1111 Nutrition and Dietetics; 1114 Paediatrics and Reproductive Medicine,1117 Public Health and Health Services,1111 Nutrition and Dietetics,1114 Paediatrics and Reproductive Medicine,,,Clinical Research; Pediatric; Conditions Affecting the Embryonic and Fetal Periods; Infant Mortality/ (LBW); Prevention; Perinatal Period - Conditions Originating in Perinatal Period; Nutrition,Clinical Research,Pediatric,Conditions Affecting the Embryonic and Fetal Periods,Infant Mortality/ (LBW),Prevention,Cardiovascular; Generic Health Relevance; Reproductive Health and Childbirth,Cardiovascular,Generic Health Relevance,Reproductive Health and Childbirth,,,3.1 Primary prevention interventions to modify behaviours or promote well-being,3.1 Primary prevention interventions to modify behaviours or promote well-being,,,,,Population & Society,Public Health,,,,,,,,,,,,,usda,"'(FNS OR ""Food and Nutrition Service "") AND ( USDA OR "" Economic Research Service"") AND (WIC OR ""women, Infants and children"") AND (State AND (agency OR agencies))'",0.144927536,dataset-346
91,pub.1105482028,10.1080/00970050.1980.10618109,www.doi.org/10.1080/00970050.1980.10618109,,,The Federal Government and Nutrition,American Journal of Health Education,,Taylor & Francis,,1980,11,5,11-Jul,Closed,article,"Powers, Margaret A.","Powers, Margaret A. ()",,,,,,,,,,,0,0,0,0,,https://app.dimensions.ai/details/publication/pub.1105482028,,,,,,,,,,,,,,,,,,,,,,,,,,,,,,,,,,,,,,,usda,"'(FNS OR ""Food and Nutrition Service "") AND ( USDA OR "" Economic Research Service"") AND (WIC OR ""women, Infants and children"") AND (State AND (agency OR agencies))'",0.144927536,dataset-346
