api,doi,title,url,search_term,dataset,valid,pdf
pubmed,10.5696/2156-9614-9.23.190906,Pesticide Availability and Usage by Farmers in the Northern Region of Ghana.,https://www.ncbi.nlm.nih.gov/pubmed/31497369,Agricultural Resource Management Survey,dataset-870,,
pubmed,10.1016/j.scitotenv.2014.08.114,Pesticide concentrations in frog tissue and wetland habitats in a landscape dominated by agriculture.,https://www.ncbi.nlm.nih.gov/pubmed/25244036,Agricultural Resource Management Survey,dataset-870,,
pubmed,10.1007/s10653-019-00331-5,"Pesticides in the typical agricultural groundwater in Songnen plain, northeast China: occurrence, spatial distribution and health risks.",https://www.ncbi.nlm.nih.gov/pubmed/31129745,Agricultural Resource Management Survey,dataset-870,,
pubmed,10.1007/s11250-018-1557-z,Phenotypic characterization of beef cattle breeds and production practices in Liberia.,https://www.ncbi.nlm.nih.gov/pubmed/29546550,Agricultural Resource Management Survey,dataset-870,,
pubmed,,Phosphorus balance and use efficiency on 21 intensive grass-based dairy farms in the South of Ireland.,https://www.ncbi.nlm.nih.gov/pubmed/25926708,Agricultural Resource Management Survey,dataset-870,,
pubmed,,Plant biotechnology in China.,https://www.ncbi.nlm.nih.gov/pubmed/11809972,Agricultural Resource Management Survey,dataset-870,,
pubmed,,Plant breeding to control zinc deficiency in India: how cost-effective is biofortification?,https://www.ncbi.nlm.nih.gov/pubmed/17411470,Agricultural Resource Management Survey,dataset-870,,
openaire,10.22004/ag.econ.117969,Policy Reform in the Tobacco Industry: Producers Adapt to a Changing Market,http://dx.doi.org/10.22004/ag.econ.117969,Agricultural Resource Management Survey,dataset-870,,
dimensions,10.1093/aepp/ppy040,Population Density and Local Food Market Channels,https://app.dimensions.ai/discover/publication?search_type=kws&search_field=full_search&search_text=Population%20Density%20and%20Local%20Food%20Market%20Channels,Agricultural Resource Management Survey,dataset-870,,
openaire,10.22004/ag.econ.16097,"POPULATION PRESSURE, LAND TENURE, AND TREE RESOURCE MANAGEMENT IN UGANDA",http://dx.doi.org/10.22004/ag.econ.16097,Agricultural Resource Management Survey,dataset-870,,
pubmed,10.1001/jamaophthalmol.2015.3513,Population Prevalence of Need for Spectacles and Spectacle Ownership Among Urban Migrant Children in Eastern China.,https://www.ncbi.nlm.nih.gov/pubmed/26426113,Agricultural Resource Management Survey,dataset-870,,
pubmed,,Positive biodiversity-productivity relationship predominant in global forests.,https://www.ncbi.nlm.nih.gov/pubmed/27738143,Agricultural Resource Management Survey,dataset-870,,
dimensions,10.1093/ajae/aau002,Potential Effects of Climate Change on the Productivity of U.S. Dairies,https://app.dimensions.ai/discover/publication?search_type=kws&search_field=full_search&search_text=Potential%20Effects%20of%20Climate%20Change%20on%20the%20Productivity%20of%20U.S.%20Dairies,Agricultural Resource Management Survey,dataset-870,,
dimensions,10.2139/ssrn.2182028,Potential Farm-Level Effects of Eliminating Direct Payments,https://app.dimensions.ai/discover/publication?search_type=kws&search_field=full_search&search_text=Potential%20Farm-Level%20Effects%20of%20Eliminating%20Direct%20Payments,Agricultural Resource Management Survey,dataset-870,,
pubmed,10.1007/s10661-015-4283-2,Potential for the wider application of national forest inventories to estimate the contagion metric for landscapes.,https://www.ncbi.nlm.nih.gov/pubmed/25690607,Agricultural Resource Management Survey,dataset-870,,
pubmed,10.1073/pnas.1620229114,Prairie strips improve biodiversity and the delivery of multiple ecosystem services from corn-soybean croplands.,https://www.ncbi.nlm.nih.gov/pubmed/28973922,Agricultural Resource Management Survey,dataset-870,,
dimensions,10.1016/s1514-0326(12)60015-4,Precautionary wealth and income uncertainty: a household-level analysis,https://app.dimensions.ai/discover/publication?search_type=kws&search_field=full_search&search_text=Precautionary%20wealth%20and%20income%20uncertainty%3A%20a%20household-level%20analysis,Agricultural Resource Management Survey,dataset-870,,
pubmed,10.1002/eap.2015,Predicting functional responses in agro-ecosystems from animal movement data to improve management of invasive pests.,https://www.ncbi.nlm.nih.gov/pubmed/31596984,Agricultural Resource Management Survey,dataset-870,,
pubmed,10.1016/j.scitotenv.2019.05.156,Predicting hydrologic disturbance of streams using species occurrence data.,https://www.ncbi.nlm.nih.gov/pubmed/31181513,Agricultural Resource Management Survey,dataset-870,,
pubmed,10.1097/PHH.0000000000000050,"Predictors of capacity in public health, environmental, and agricultural laboratories.",https://www.ncbi.nlm.nih.gov/pubmed/24374360,Agricultural Resource Management Survey,dataset-870,,
openaire,10.22004/ag.econ.117776,Preliminary Assessment of Nitrous Oxide Offsets in a Cap and Trade Program,http://dx.doi.org/10.22004/ag.econ.117776,Agricultural Resource Management Survey,dataset-870,,
openaire,,Preliminary Assessment of Nitrous Oxide Offsets in a Cap and Trade Program,http://purl.umn.edu/117776,Agricultural Resource Management Survey,dataset-870,,
pubmed,10.1016/j.diabres.2014.06.005,"Prevalence, correlates and management of type 2 diabetes mellitus in Lebanon: findings from a national population-based study.",https://www.ncbi.nlm.nih.gov/pubmed/25005850,Agricultural Resource Management Survey,dataset-870,,
pubmed,,"PREVIOUSLY UNREPORTED POPULATION OF RHESUS MACAQUES  IN CHIANG RAI PROVINCE, THAILAND: PRELIMINARY OBSERVATIONS.",https://www.ncbi.nlm.nih.gov/pubmed/31844847,Agricultural Resource Management Survey,dataset-870,,
pubmed,,Privatisation of veterinary services in Jamaica: a case study.,https://www.ncbi.nlm.nih.gov/pubmed/15200106,Agricultural Resource Management Survey,dataset-870,,
pubmed,10.1007/s11250-010-9602-6,Production objectives and trait preferences of village poultry producers of Ethiopia: implications for designing breeding schemes utilizing indigenous chicken genetic resources.,https://www.ncbi.nlm.nih.gov/pubmed/20512411,Agricultural Resource Management Survey,dataset-870,,
dimensions,10.1093/aepp/ppv031,Productivity and Economic Growth in U.S. Agriculture: A New Look,https://app.dimensions.ai/discover/publication?search_type=kws&search_field=full_search&search_text=Productivity%20and%20Economic%20Growth%20in%20U.S.%20Agriculture%3A%20A%20New%20Look,Agricultural Resource Management Survey,dataset-870,,
dimensions,10.1017/s1742170511000408,Profitability of organic and conventional soybean production under ‘green payments’ in carbon offset programs,https://app.dimensions.ai/discover/publication?search_type=kws&search_field=full_search&search_text=Profitability%20of%20organic%20and%20conventional%20soybean%20production%20under%20%E2%80%98green%20payments%E2%80%99%20in%20carbon%20offset%20programs,Agricultural Resource Management Survey,dataset-870,,