api,doi,title,url,search_term,dataset_id,valid,pdf
dimensions,10.1017/aae.2015.10,A STOCHASTIC FRONTIER ANALYSIS TO EXAMINE RESEARCH PRIORITIES FOR GENETICALLY ENGINEERED PEANUTS,https://doi.org/10.1017/aae.2015.10,Agricultural Resource Management Survey,dataset-870,Yes,https://www.cambridge.org/core/services/aop-cambridge-core/content/view/A713AA6C1EBC2D228BA2B0E9B24C3287/S1074070815000103a.pdf/stochastic_frontier_analysis_to_examine_research_priorities_for_genetically_engineered_peanuts.pdf
openaire,10.22004/ag.econ.205348,A Structural Model of US Corn Farmers’ Pest Control Decisions: Rootworm Resistance in US Corn Fields,http://dx.doi.org/10.22004/ag.econ.205348,Agricultural Resource Management Survey,dataset-870,Yes,
dimensions,10.1007/s11482-013-9214-1,A Typology of Socioeconomic Disadvantage among Farm Operator Households: Assessment of Contributing Factors Using Evidence from a National Survey,https://app.dimensions.ai/discover/publication?search_type=kws&search_field=full_search&search_text=A%20Typology%20of%20Socioeconomic%20Disadvantage%20among%20Farm%20Operator%20Households%3A%20Assessment%20of%20Contributing%20Factors%20Using%20Evidence%20from%20a%20National%20Survey,Agricultural Resource Management Survey,dataset-870,Yes,https://link.springer.com/content/pdf/10.1007/s11482-013-9214-1.pdf
dimensions,10.1177/0885412219863199,Abstracts,https://doi.org/10.1177/0885412219863199,Agricultural Resource Management Survey,dataset-870,Yes,
dimensions,10.1108/00021461211250438,Accounting for complex entities: implications for ARMS,https://doi.org/10.1108/00021461211250438,Agricultural Resource Management Survey,dataset-870,Yes,
dimensions,10.1080/09692290.2017.1304434,"Accumulating through food crisis? Farmers, commodity traders and the distributional politics of financialization",https://app.dimensions.ai/discover/publication?search_type=kws&search_field=full_search&search_text=Accumulating%20through%20food%20crisis%3F%20Farmers%2C%20commodity%20traders%20and%20the%20distributional%20politics%20of%20financialization,Agricultural Resource Management Survey,dataset-870,Yes,https://www.tandfonline.com/doi/pdf/10.1080/09692290.2017.1304434?needAccess=true
dimensions,10.2139/ssrn.2502846,Additionality in U.S. Agricultural Conservation and Regulatory Offset Programs,https://app.dimensions.ai/discover/publication?search_type=kws&search_field=full_search&search_text=Additionality%20in%20U.S.%20Agricultural%20Conservation%20and%20Regulatory%20Offset%20Programs,Agricultural Resource Management Survey,dataset-870,Yes,