api,doi,title,url,search_term,dataset_id,valid,pdf,notes
dimensions,10.1108/afr-07-2016-0069,Following beginning farm income and wealth over time,https://app.dimensions.ai/discover/publication?search_type=kws&search_field=full_search&search_text=Following%20beginning%20farm%20income%20and%20wealth%20over%20time,Agricultural Resource Management Survey,dataset-870,1,https://www.emerald.com/insight/content/doi/10.1108/AFR-07-2016-0069/full/pdf?title=following-beginning-farm-income-and-wealth-over-time-a-cohort-analysis-using-arms,
openaire,10.22004/ag.econ.95591,Forage Outsourcing in the Dairy Sector: The Extent of Use and Impact on Farm Profitability,http://dx.doi.org/10.22004/ag.econ.95591,Agricultural Resource Management Survey,dataset-870,1,https://ageconsearch.umn.edu/record/95591/files/gillespie%20-%20current.pdf,
dimensions,10.1142/s201000781450002x,GREENHOUSE GAS OFFSETS: ANALYSIS OF BASELINE RULES AND ADDITIONALITY FOR REDUCED NITROGEN APPLICATION ON WHEAT,https://app.dimensions.ai/discover/publication?search_type=kws&search_field=full_search&search_text=GREENHOUSE%20GAS%20OFFSETS%3A%20ANALYSIS%20OF%20BASELINE%20RULES%20AND%20ADDITIONALITY%20FOR%20REDUCED%20NITROGEN%20APPLICATION%20ON%20WHEAT,Agricultural Resource Management Survey,"dataset-870, dataset-784",1,,"could not read the article, restricted access"
dimensions,10.2134/jeq2014.02.0085,Groundwater Quality and Nitrogen Use Efficiency in Nebraska's Central Platte River Valley,https://app.dimensions.ai/discover/publication?search_type=kws&search_field=full_search&search_text=Groundwater%20Quality%20and%20Nitrogen%20Use%20Efficiency%20in%20Nebraska%27s%20Central%20Platte%20River%20Valley,Agricultural Resource Management Survey,dataset-870,1,https://acsess.onlinelibrary.wiley.com/doi/epdf/10.2134/jeq2014.02.0085,
openaire,10.22004/ag.econ.34089,Growing Farm Size and the Distribution of Farm Payments,http://dx.doi.org/10.22004/ag.econ.34089,Agricultural Resource Management Survey,"dataset-870, dataset-062",1,https://ageconsearch.umn.edu/record/34089/files/eb060006.pdf,edge case with dataset 870. The publication also refers to an ARMS' predecessor dataset
dimensions,10.1093/ajae/aay016,Has Resistance Taken Root in U.S. Corn Fields? Demand for Insect Control,https://app.dimensions.ai/discover/publication?search_type=kws&search_field=full_search&search_text=Has%20Resistance%20Taken%20Root%20in%20U.S.%20Corn%20Fields%3F%20Demand%20for%20Insect%20Control,Agricultural Resource Management Survey,"dataset-870, dataset-694",1,https://onlinelibrary.wiley.com/doi/epdf/10.1093/ajae/aay016,
dimensions,10.1111/j.1574-0862.2011.00566.x,Health care expenditures of self‐employed farm households in the United States,https://app.dimensions.ai/discover/publication?search_type=kws&search_field=full_search&search_text=Health%20care%20expenditures%20of%20self%E2%80%90employed%20farm%20households%20in%20the%20United%20States,Agricultural Resource Management Survey,dataset-870,1,https://onlinelibrary.wiley.com/doi/epdf/10.1111/j.1574-0862.2011.00566.x,