api,doi,title,url,search_term,dataset,valid,pdf
openaire,10.1142/S0217595913500127,"AN IDENTIFICATION APPROACH OF TECHNICALLY EFFICIENT CATEGORY FOR CONTROLLABLE, CATEGORICAL FACTORS IN PRODUCTION AND AN APPLICATION TO A PRODUCTION PROCESS",http://www.worldscinet.com/cgi-bin/details.cgi?type=pdf&id=pii:S0217595913500127,Agricultural Resource Management Survey,dataset-870,yes,
openaire,10.22004/ag.econ.132407,Analysis of Market Segmentation in Farm Credit Markets,http://dx.doi.org/10.22004/ag.econ.132407,Agricultural Resource Management Survey,dataset-870,yes,
openaire,10.22004/ag.econ.119768,Analysis of Participation in Multifunctional Agriculture: U.S. Rice Farms,http://dx.doi.org/10.22004/ag.econ.119768,Agricultural Resource Management Survey,dataset-870,yes,
dimensions,10.1016/j.jpolmod.2012.04.004,Assessing participation in the Milk Income Loss Contract program and its impact on milk production,https://app.dimensions.ai/discover/publication?search_type=kws&search_field=full_search&search_text=Assessing%20participation%20in%20the%20Milk%20Income%20Loss%20Contract%20program%20and%20its%20impact%20on%20milk%20production,Agricultural Resource Management Survey,dataset-870,yes,
openaire,10.22004/ag.econ.114668,Assessing structural change in agriculture with a parametric Markov chain model. Illustrative applications to EU-15 and the USA,http://dx.doi.org/10.22004/ag.econ.114668,Agricultural Resource Management Survey,"dataset-870,dataset-922",yes,
