title,journal,url,authors,doi,search_term,dataset_id
Public Health Nurses’ Knowledge and Attitudes Regarding Climate Change,Environmental Health Perspectives,http://europepmc.org/articles/PMC3295355,"Polivka, Barbara J., Chaudry, Rosemary V., Mac Crawford, John",10.1289/ehp.1104025,U.S. Climate Divisions,dataset-640
Climate-related increase in the prevalence of urolithiasis in the United States,,https://europepmc.org/articles/PMC2474527/,"Brikowski, Tom H., Lotan, Yair, Pearle, Margaret S.",10.1073/pnas.0709652105,U.S. Climate Divisions,dataset-640
Contribution of landfalling tropical system rainfall to the hydroclimate of the eastern U.S. Corn Belt 1981–2012,Weather and Climate Extremes,http://dx.doi.org/10.1016/j.wace.2016.06.001,"Olivia Kellner, Dev Niyogi, Frank D. Marks",10.1016/j.wace.2016.06.001,U.S. Climate Divisions,dataset-640
Evaluating A Virtual Work Teams Program,,http://dx.doi.org/10.5281/zenodo.1158721,"Zeller, Donna",10.5281/zenodo.1158721,U.S. Climate Divisions,dataset-640
Evaluating A Virtual Work Teams Program,,http://dx.doi.org/10.5281/zenodo.1158722,"Zeller, Donna",10.5281/zenodo.1158722,U.S. Climate Divisions,dataset-640
Public Awareness of the Scientific Consensus on Climate,SAGE Open,https://doi.org/10.1177/2158244016676296,Lawrence C. Hamilton,10.1177/2158244016676296,U.S. Climate Divisions,dataset-640
Indiana's Water Shortage Plan,,http://docs.lib.purdue.edu/ddad2011/25,"Unterreiner, Jerry",,U.S. Climate Divisions,dataset-640
