datasets,doi,journal,search_term,title,url
dataset-622,10.1063/1.4954841,Biomicrofluidics,3DEP,Fifty years of dielectrophoretic cell separation technology,https://aip.scitation.org/doi/pdf/10.1063/1.4954841
dataset-622,10.14358/pers.82.4.271,"{'id': 'jour.1042026', 'title': 'Photogrammetric Engineering & Remote Sensing'}",3DEP,Estimating Forest and Woodland Aboveground Biomass Using Active and Passive Remote Sensing,
dataset-622,10.2175/193864716819706022,"{'id': 'jour.1170511', 'title': 'Proceedings of the Water Environment Federation'}",3DEP,Urban Flood Prediction and Warning – Challenges and Solutions,
dataset-622,10.1007/978-3-319-22789-4,,3DEP,"Geographic Information, Organization, Access, and Use",
dataset-622,10.1145/2949550.2949652,,3DEP,TopoLens: Building a CyberGIS Community Data Service for Enhancing the Usability of High-resolution National Topographic Datasets,http://dl.acm.org/ft_gateway.cfm?id=2949652&type=pdf
dataset-622,10.1039/c6an01596d,Analyst,3DEP,Accurate quantification of apoptosis progression and toxicity using a dielectrophoretic approach,https://pubs.rsc.org/en/content/articlepdf/2016/an/c6an01596d
dataset-622,10.4236/jgis.2016.86055,Journal of Geographic Information System,3DEP,Flood Forecasting GIS Water-Flow Visualization Enhancement (WaVE): A Case Study,http://www.scirp.org/journal/PaperDownload.aspx?paperID=72935
dataset-622,10.1145/2949550.2949582,,3DEP,Accelerating TauDEM for Extracting Hydrology Information from National-Scale High Resolution Topographic Dataset: Extended Abstract,http://dl.acm.org/ft_gateway.cfm?id=2949582&type=pdf
dataset-622,10.1016/j.jhydrol.2015.10.051,"{'id': 'jour.1126746', 'title': 'Journal of Hydrology'}",3DEP,Evaluation of the U.S. Geological Survey standard elevation products in a two-dimensional hydraulic modeling application for a low relief coastal floodplain,
dataset-622,10.1080/15230406.2015.1060869,"{'id': 'jour.1041893', 'title': 'Cartography and Geographic Information Science'}",3DEP,A rapid approach for automated comparison of independently derived stream networks,
dataset-622,10.1002/ece3.1669,Ecology and Evolution,3DEP,The conservation value of elevation data accuracy and model sophistication in reserve design under sea‐level rise,https://onlinelibrary.wiley.com/doi/pdf/10.1002/ece3.1669
dataset-622,10.1080/15230406.2015.1057229,"{'id': 'jour.1041893', 'title': 'Cartography and Geographic Information Science'}",3DEP,"Preparing The National Map for the 3D Elevation Program – products, process and research",
dataset-622,10.1080/15230406.2015.1060112,"{'id': 'jour.1041893', 'title': 'Cartography and Geographic Information Science'}",3DEP,On the map: American cartography in 2015,
dataset-622,10.1002/fgc.30035,"{'id': 'jour.1141619', 'title': 'Federal Grants & Contracts'}",3DEP,Grants Alert,
dataset-622,10.1002/elps.201500022,"{'id': 'jour.1093009', 'title': 'Electrophoresis'}",3DEP,Effects of cell detachment methods on the dielectric properties of adherent and suspension cells,
dataset-622,10.1016/j.compstruct.2015.01.022,Composite Structures,3DEP,A performance versus cost analysis of prepreg carbon fibre epoxy energy absorption structures,https://doi.org/10.1016/j.compstruct.2015.01.022
dataset-622,10.14358/pers.81.3.a1-a26,"{'id': 'jour.1042026', 'title': 'Photogrammetric Engineering & Remote Sensing'}",3DEP,ASPRS Positional Accuracy Standards for Digital Geospatial Data,
dataset-622,10.1002/term.1629,Journal of Tissue Engineering and Regenerative Medicine,3DEP,Characterization of human skeletal stem and bone cell populations using dielectrophoresis,http://epubs.surrey.ac.uk/809993/11/Ismail%20et%20al%202015.pdf
dataset-622,10.1039/c5ib00109a,"{'id': 'jour.1040252', 'title': 'Integrative Biology'}",3DEP,Apoptosis progression studied using parallel dielectrophoresis electrophysiological analysis and flow cytometry,
dataset-622,10.1039/c5an00796h,Analyst,3DEP,"A dielectrophoretic method of discrimination between normal oral epithelium, and oral and oropharyngeal cancer in a clinical setting",https://pubs.rsc.org/en/content/articlepdf/2015/an/c5an00796h
dataset-622,10.1177/0731684414537131,Journal of Reinforced Plastics and Composites,3DEP,Recycling solid residues recovered from glass fibre-reinforced composites – A review applied to wind turbine blade materials,http://orbit.dtu.dk/en/publications/recycling-solid-residues-recovered-from-glass-fibrereinforced-composites--a-review-applied-to-wind-turbine-blade-materials(4584b5d0-36ab-4911-b087-42a26ebdf76d).html
dataset-622,10.1063/1.4892036,Biomicrofluidics,3DEP,Dielectrophoretic sample preparation for environmental monitoring of microorganisms: Soil particle removal,http://europepmc.org/articles/pmc4189292?pdf=render
dataset-622,10.1299/jsmeted.2014._g142-1_,"{'id': 'jour.1298225', 'title': 'The Proceedings of the Thermal Engineering Conference'}",3DEP,G142 光学式マイクロ拡散センサの高感度化に関する研究,
dataset-622,10.1039/c3ib40255j,Integrative Biology,3DEP,Human oral cancer cells with increasing tumorigenic abilities exhibit higher effective membrane capacitance,http://epubs.surrey.ac.uk/808463/13/RacMacLac_%20corrected%20clean.pdf
dataset-622,10.1016/j.bbagen.2013.07.008,"{'id': 'jour.1327373', 'title': 'Biochimica et Biophysica Acta (BBA) - Lipids and Lipid Metabolism'}",3DEP,Epithelial cancer cells exhibit different electrical properties when cultured in 2D and 3D environments,
dataset-622,10.1016/j.conbuildmat.2013.05.101,Construction and Building Materials,3DEP,Reliability-based design optimization of concrete flexural members reinforced with ductile FRP bars,https://digitalcommons.wayne.edu/cgi/viewcontent.cgi?article=1011&context=ce_eng_frp
dataset-622,10.3390/w5041533,Water,3DEP,Flood Modeling Using a Synthesis of Multi-Platform LiDAR Data,https://www.mdpi.com/2073-4441/5/4/1533/pdf
dataset-622,10.1016/j.bpj.2012.10.023,Biophysical Journal,3DEP,Cytoplasm Resistivity of Mammalian Atrial Myocardium Determined by Dielectrophoresis and Impedance Methods,https://doi.org/10.1016/j.bpj.2012.10.023
dataset-622,10.1039/c1lc20701f,"{'id': 'jour.1029977', 'title': 'Lab on a Chip'}",3DEP,Isolation of prostate tumor initiating cells (TICs) through their dielectrophoretic signature,
dataset-622,10.1016/j.wasman.2010.09.019,Waste Management,3DEP,Recycling carbon fibre reinforced polymers for structural applications: Technology review and market outlook,http://spiral.imperial.ac.uk/bitstream/10044/1/12678/2/2011%20Pimenta%20and%20Pinho%20-%20Recycling%20carbon%20fibre%20reinforced%20polymers%20for%20structural%20applications%20-%20technology%20review%20and%20market%20outlook.pdf
dataset-622,10.1203/00006450-200508000-00241,Pediatric Research,3DEP,212 Results of Continuos Monitoring of Hemoglobin Saturation During the First Month of Life as Predictors of Retinopathy of Prematurity,https://www.nature.com/articles/pr2005464.pdf
dataset-622,10.1203/00006450-200508000-00236,Pediatric Research,3DEP,207 Neonatal Sepsis,https://www.nature.com/articles/pr2005459.pdf
dataset-622,10.1203/00006450-200508000-00240,Pediatric Research,3DEP,211 Vascular Endothelial Growth Factor and Insulin Growth Factor 1 Serum Concentrations in Very Low Birthweight Infants with Retinopathy,https://www.nature.com/articles/pr2005463.pdf
dataset-622,10.1203/00006450-200508000-00237,Pediatric Research,3DEP,208 Bone Morphogenetic Proteins Genes and Neural Tube Defects,https://www.nature.com/articles/pr2005460.pdf
dataset-622,10.1203/00006450-200508000-00239,Pediatric Research,3DEP,210 Congenital Cytomegalovirus (CMV) Infection and Agenesis of Corpus Callosum,https://www.nature.com/articles/pr2005462.pdf
dataset-622,10.1203/00006450-200508000-00238,Pediatric Research,3DEP,209 Executive Functions and Cerebral MRI in Adolescents with Very Low Birth Weight,https://www.nature.com/articles/pr2005461.pdf
dataset-622,10.1016/s0039-9140(02)00259-x,"{'id': 'jour.1076998', 'title': 'Talanta'}",3DEP,Arsenic speciation in contaminated soils,
dataset-622,10.1016/s0168-6054(00)80020-3,"{'id': 'jour.1017469', 'title': 'Annals of Physical and Rehabilitation Medicine'}",3DEP,Communications libres: Mises au point en rééducation (Sofmerr),
dataset-622,10.1539/sangyoeisei.kj00001990101,Journal of Occupational Health,3DEP,製造業従業員の循環器・自律神経機能 : (III)呼吸性不整脈、血圧、コレステロール,https://www.jstage.jst.go.jp/article/sangyoeisei/40/Special/40_KJ00001990101/_pdf
dataset-622,10.21236/ada434446,,3DEP,"Remedial Investigation Report, Presidio Main Installation, Presidio of San Francisco. Volume 5: Figures 7-15",http://www.dtic.mil/dtic/tr/fulltext/u2/a434446.pdf
dataset-622,10.1016/0168-1656(96)01411-3,"{'id': 'jour.1294801', 'title': 'Journal of Biotechnology'}",3DEP,Bioprocessing in microgravity: free flow electrophoresis of C. elegans DNA,
dataset-622,10.1080/08870448908400363,"{'id': 'jour.1098380', 'title': 'Psychology and Health'}",3DEP,Effects of social support on depression following coronary artery bypass graft surgery,
dataset-622,10.1016/0277-9536(86)90268-6,"{'id': 'jour.1093956', 'title': 'Social Science & Medicine'}",3DEP,Territorial justice and primary health care: An example from London,
