dataset,title,url,pdf,authors,doi,journal,search_term
"dataset-614, dataset-703, dataset-704",Methodology for assessing coastal change using terrestrial laser scanning,http://www.escholarship.org/uc/item/49z2x13x,https://pdfs.semanticscholar.org/4c0e/222116c3a875e0a7017cc33f056e9123f807.pdf?_ga=2.118708809.1373721342.1579017196-565885387.1574884320,"Olsen, Michael J.",10.1002/2014JB011538,,Coastal Change Analysis Program Data
dataset-623,Voluntary Restoration: Mitigation's Silent Partner in the Quest to Reverse Coastal Wetland Loss in the USA,https://www.frontiersin.org/article/10.3389/fmars.2019.00511/full,,"Rachel K. Gittman, Christopher J. Baillie, Katie K. Arkema, Katie K. Arkema, Richard O. Bennett, Jeff Benoit, Seth Blitch, Julien Brun, Anthony Chatwin, Allison Colden, Alyssa Dausman, Bryan DeAngelis, Nathaniel Herold, Jessica Henkel, Rachel Houge, Ronald Howard, A. Randall Hughes, Steven B. Scyphers, Tisa Shostik, Ariana Sutton-Grier, Jonathan H. Grabowski",10.3389/fmars.2019.00511/full,Frontiers in Marine Science,Coastal Change Analysis Program Data
dataset-705,An integrated approach to coastal and biological observations,http://www.vliz.be/imisdocs/publications/74/333474.pdf,http://www.vliz.be/imisdocs/publications/74/333474.pdf,"She, J., Muniz Piniella, A., Benedetti-Cecchi, L., Boehme, L., Boero, F., Christensen, A., Crowe, T., Darecki, M., Nogueira, E., Gremare, A., Hernandez, F., Kouts, T., Kromkamp, J., Petihakis, G., Sousa Pinto, I., Reissmann, J.H., Tuomi, L., Zingone, A.",10.3389/fmars.2019.00314,,Coastal Change Analysis Program Data
"dataset-668, dataset-706",Controls of Multimodal Wave Conditions in a Complex Coastal Setting,http://hdl.handle.net/10902/12914,,"Hegermiller, C. A., Rueda Zamora, Ana Cristina, Erikson, L. H., Barnard, P. L., Alvarez Antolinez, Jose Antonio, Mendez Incera, Fernando Javier",10.1002/2017GL075272,,Coastal Change Analysis Program Data
"dataset-623, dataset-668",A Climate Index Optimized for Longshore Sediment Transport Reveals Interannual and Multidecadal Littoral Cell Rotations,http://hdl.handle.net/10902/14564,,"Anderson, Dylan, Ruggiero, Peter, Alvarez Antolinez, Jose Antonio, Mendez Incera, Fernando Javier, Allan, Jonathan",10.1029/2018JF004689,,Coastal Change Analysis Program Data
dataset-623,The Multi-Resolution Land Characteristics (MRLC) Consortium - 20 Years of Development and Integration of USA National Land Cover Data,http://dx.doi.org/10.3390/rs6087424,,"Wickham, James, Homer, Collin, Vogelmann, James, McKerrow, Alexa, Mueller, Rick, Herold, Nate, Coulston, John",10.3390/rs6087424,Remote Sensing,Coastal Change Analysis Program Data
dataset-707,Chlorophyll and Suspended Sediment Exchange between Central San Francisco Bay and the Coastal Pacific Ocean,http://www.escholarship.org/uc/item/30r6w5jn,,"Martin, Maureen A.",10.1093/plankt/fbm088,,Coastal Change Analysis Program Data
"dataset-623, dataset-306",Quantifying Spatiotemporal Patterns and Major Explanatory Factors of Urban Expansion in Miami Metropolitan Area During 1992-2016,http://dx.doi.org/10.3390/rs11212493,,"Rifat, Shaikh Abdullah Al, Liu, Weibo",10.3390/rs11212493,Remote Sensing,Coastal Change Analysis Program Data