datasets,doi,journal,search_term,title,url,valid?,notes,pdf
dataset-621,10.1016/j.aap.2019.04.022,Accident Analysis & Prevention,ISD,Engineering judgment and road safety,,,,
dataset-621,10.1111/apt.15320,,ISD,"Uptake of endoscopic screening for gastroesophageal varices and factors associated with variceal bleeding in patients with chronic hepatitis C infection and compensated cirrhosis, 2005‐2016: a national database linkage study",https://onlinelibrary.wiley.com/doi/pdf/10.1111/apt.15320,,,
dataset-621,10.1038/s41409-018-0406-z,Bone Marrow Transplantation,ISD,Chemotherapy plus DLI for relapse after haploidentical HSCT: the biological characteristics of relapse influences clinical outcomes of acute leukemia patients,,,,
dataset-621,10.1103/physrevapplied.12.024018,Physical Review Applied,ISD,Imaging Graphene Field-Effect Transistors on Diamond Using Nitrogen-Vacancy Microscopy,,,,
dataset-621,10.1177/1523422319851437,Advances in Developing Human Resources,ISD,Toward Agentic HRD: A Translational Model of Albert Bandura’s Human Agency Theory,,,,
dataset-621,10.1534/genetics.119.302187,,ISD,Differences Between the Raw Material and the Products of de Novo Gene Birth Can Result from Mutational Biases,https://www.genetics.org/content/genetics/early/2019/06/21/genetics.119.302187.full.pdf,,,
dataset-621,10.1016/j.ab.2019.05.006,Analytical Biochemistry,ISD,Assessment of protein extraction and digestion efficiency of well-established shotgun protocols for heart proteomics,,,,
dataset-621,10.1016/j.bja.2019.02.025,,ISD,Cardiac output monitoring in a porcine model using the inspired sinewave technique: a proof-of-concept study,https://doi.org/10.1016/j.bja.2019.02.025,,,
dataset-621,10.1109/iccchina.2019.8855907,,ISD,Non-Orthogonal Coded Access Based Uplink Grant-Free Transmission for URLLC,,,,
dataset-621,10.1002/admt.201900108,Advanced Materials Technologies,ISD,Recent Progress in 2D Layered III–VI Semiconductors and their Heterostructures for Optoelectronic Device Applications,,,,
dataset-621,10.14900/cjpt.46s1.h2-211_2,,ISD,側方リーチにおける骨盤側方傾斜角と重心移動速度について,,,,
dataset-621,10.23919/jcc.2019.08.008,China Communications,ISD,Spectrum allocation and performance analysis for backhauling of UAV assisted cellular network,,,,
dataset-621,10.1002/nau.23878,,ISD,Autologous rectus fascia sling for treatment of stress urinary incontinence in women: A review of the literature,https://escholarship.org/content/qt4vf079w3/qt4vf079w3.pdf?t=pudr6s,,,
dataset-621,10.1109/jcn.2019.000024,Journal of Communications and Networks,ISD,Delay-aware fountain codes for video streaming with optimal sampling strategy,,,,
dataset-621,10.3310/hta23400,Health Technology Assessment,ISD,The 4 'A's test for detecting delirium in acute medical patients: a diagnostic accuracy study,,,,
dataset-621,10.1016/j.ssmph.2019.100421,,ISD,Do traditional economic theories of free riding behavior explain spatial clustering of HPV vaccine uptake?,https://doi.org/10.1016/j.ssmph.2019.100421,,,
dataset-621,10.24812/nictkenkyuhoukoku.24.127_121,,ISD,電離層観測衛星(ISS)研究運用システム,,,,
dataset-621,10.1177/0013161x18809343,Educational Administration Quarterly,ISD,The Relationship Between Open Enrollment and School Bond Voting,,,,
dataset-621,10.1016/j.chroma.2019.04.043,Journal of Chromatography A,ISD,Targeted proteomics to monitor the extraction efficiency and levels of barley α-amylase trypsin inhibitors that are implicated in non-coeliac gluten sensitivity,,,,
dataset-621,10.1109/tcad.2018.2852740,IEEE Transactions on Computer-Aided Design of Integrated Circuits and Systems,ISD,Timing-Driven and Placement-Aware Multibit Register Composition,,,,
dataset-621,10.1177/0033294118783917,Psychological Reports,ISD,The Conscientious Responders Scale Helps Researchers Verify the Integrity of Personality Questionnaire Data,,,,
dataset-621,10.1002/nau.24026,Neurourology and Urodynamics,ISD,Molecular aspects of collagenolysis associated with stress urinary incontinence in women with urethral hypermobility vs intrinsic sphincter deficiency,,,,
dataset-621,10.1111/cobi.13278,,ISD,On allegations of invasive species denialism,https://onlinelibrary.wiley.com/doi/pdf/10.1111/cobi.13278,,,
dataset-621,10.1111/1462-2920.14575,,ISD,Guttation capsules containing hydrogen peroxide: an evolutionarily conserved NADPH oxidase gains a role in wars between related fungi,https://onlinelibrary.wiley.com/doi/pdf/10.1111/1462-2920.14575,,,
dataset-621,10.1002/jor.24323,Journal of Orthopaedic Research®,ISD,Safe Supra‐Acetabular Pin Insertion in Relation to Intraosseous Depth,,,,
dataset-621,10.1016/j.jrp.2019.05.009,Journal of Research in Personality,ISD,Differentiating Conscientious from Indiscriminate Responders in Existing NEO-Five Factor Inventory-3 Data,,,,
dataset-621,10.1016/j.compind.2019.04.003,Computers in Industry,ISD,Is the trend your friend? An analysis of technology 4.0 investment decisions in agricultural SMEs,,,,
dataset-621,10.14900/cjpt.46s1.h2-211_1,,ISD,胸郭出口症候群の病態把握において重要な斜角筋三角底辺距離の調査,,,,
dataset-621,10.1007/s13361-019-02214-6,Journal of The American Society for Mass Spectrometry,ISD,General Mechanism of Cα–C Peptide Backbone Bond Cleavage in Matrix-Assisted Laser Desorption/Ionization In-Source Decay Mediated by Hydrogen Abstraction,,,,
dataset-621,10.1002/psb.1779,Prescriber,ISD,The polypharmacy programme in Scotland: realistic prescribing,,,,
dataset-621,10.1007/s00122-019-03362-9,,ISD,Genetics for low correlation between Fusarium head blight disease and deoxynivalenol (DON) content in a bread wheat mapping population,https://link.springer.com/content/pdf/10.1007%2Fs00122-019-03362-9.pdf,,,
dataset-621,10.1109/tasc.2019.2908586,IEEE Transactions on Applied Superconductivity,ISD,Status of the European Union Project FASTGRID,,,,
dataset-621,10.1002/pds.4864,Pharmacoepidemiology and Drug Safety,ISD,Abstracts,,,,
dataset-621,10.1016/j.socscimed.2019.05.048,,ISD,Details matter: Physician responses to multiple payments for the same activity,https://doi.org/10.1016/j.socscimed.2019.05.048,,,
dataset-621,10.1007/s10706-018-00776-y,Geotechnical and Geological Engineering,ISD,Case of Rock Burst Danger and Its Prediction and Prevention in Tunneling and Mining Period at an Irregular Coal Face,,,,
dataset-621,10.1007/s11701-018-0897-z,Journal of Robotic Surgery,ISD,Design methodology for a simulator of a robotic surgical system,,,,
dataset-621,10.1177/0017896919829775,Health Education Journal,ISD,Food and physical literacy: Exploring an obesity prevention approach using formative research,,,,
dataset-621,10.1016/j.desal.2019.03.012,Desalination,ISD,An optimization strategy for a forward osmosis-reverse osmosis hybrid process for wastewater reuse and seawater desalination: A modeling study,,,,
dataset-621,10.1016/j.mechatronics.2019.05.002,Mechatronics,ISD,Optimal design and experimental research of vehicle suspension based on a hydraulic electric inerter,,,,
dataset-621,10.1016/j.jaad.2019.08.055,Journal of the American Academy of Dermatology,ISD,"Gummy Smile, Dermatologist or Dentist?",,,,
dataset-621,,arXiv,ISD,Code based Cryptography: Classic McEliece,,,,
dataset-621,10.3390/app9153018,,ISD,QoS-Guaranteed Radio Resource Management in LTE-A Co-Channel Networks with Dual Connectivity,http://dx.doi.org/10.3390/app9153018,,,
dataset-621,10.11646/zootaxa.4647.1.6,Zootaxa,ISD,"Active postlarval forms of plume-footed Eatoniana (Trombidiformes: Parasitengona, Erythraeidae) in the Eocene Baltic amber",,,,
dataset-621,10.1080/19420862.2019.1635865,,ISD,"Characterization and prediction of positional 4-hydroxyproline and sulfotyrosine, two post-translational modifications that can occur at substantial levels in CHO cells-expressed biotherapeutics",https://www.tandfonline.com/doi/pdf/10.1080/19420862.2019.1635865?needAccess=true,,,
dataset-621,10.1093/ije/dyz137,,ISD,Data Resource Profile: The Systemic Anti-Cancer Therapy (SACT) Dataset,https://doi.org/10.1093/ije/dyz137,,,
dataset-621,10.1108/itp-02-2018-0102,Information Technology and People,ISD,Breaking the flow: a study of contradictions in information systems development (ISD),,,,
dataset-621,10.3390/en12142828,,ISD,Realization of Licensed/Unlicensed Spectrum Sharing Using eICIC in Indoor Small Cells for High Spectral and Energy Efficiencies of 5G Networks,https://www.mdpi.com/1996-1073/12/14/2828/pdf,,,
dataset-621,10.1002/joc.6212,International Journal of Climatology,ISD,Nonstationarity of summer temperature extremes in Texas,,,,
dataset-621,10.22478/ufpb.1807-8931.2019v15n7.46815,,ISD,Interacionismo sociodiscursivo e capacidades de linguagem: por uma pedagogia de gêneros aplicada ao ensino da leitura e da escrita,http://periodicos.ufpb.br/index.php/tematica/article/download/46815/23033,,,
dataset-621,10.1093/biolre/ioz124,,ISD,Endogenous retrovirus-encoded Syncytin-2 contributes to exosome-mediated immunosuppression of T cells,https://doi.org/10.1093/biolre/ioz124,,,
dataset-621,10.5194/esd-2019-39,,ISD,Changes in statistical distributions of sub-daily surface temperatures and wind speed,https://www.earth-syst-dynam-discuss.net/esd-2019-39/esd-2019-39.pdf,,,
dataset-621,10.1002/9781119529132,,ISD,"Guidelines for Investigating Process Safety Incidents, Third Edition",,,,
dataset-621,10.3390/heritage2030119,,ISD,"GC/MS Characterization of Beeswax, Protein, Gum, Resin, and Oil in Romano-Egyptian Paintings",https://www.mdpi.com/2571-9408/2/3/119/pdf,,,
dataset-621,10.1080/13557858.2019.1643009,,ISD,Differences in ill health and in socioeconomic inequalities in health by ethnic groups: a cross-sectional study using 2011 Scottish census,https://www.tandfonline.com/doi/pdf/10.1080/13557858.2019.1643009?needAccess=true,,,
dataset-621,10.1002/ijc.32126,International Journal of Cancer,ISD,Increased risk of HPV‐associated genital cancers in men and women as a consequence of pre‐invasive disease,,,,
dataset-621,10.3390/app9142820,,ISD,Experimental Study of High-Strength Concrete-Steel Plate Composite Shear Walls,https://www.mdpi.com/2076-3417/9/14/2820/pdf,,,
dataset-621,10.1108/itpd-05-2019-0002,,ISD,"Financial development, openness in financial services trade and economic growth",https://www.emerald.com:443/insight/content/doi/10.1108/ITPD-05-2019-0002/full/pdf?title=financial-development-openness-in-financial-services-trade-and-economic-growth-a-panel-data-analysis-in-brics-economies,,,
dataset-621,10.1117/12.2536209,,ISD,PROBA-3 formation-flying metrology: algorithms for the shadow position sensor system,https://www.spiedigitallibrary.org/conference-proceedings-of-spie/11180/1118082/PROBA-3-formation-flying-metrology--algorithms-for-the-shadow/10.1117/12.2536209.pdf,,,
dataset-621,10.3390/jcm8071017,,ISD,"Determinants of Early Response to Low-Intensity Extracorporeal Shockwaves for the Treatment of Vasculogenic Erectile Dysfunction: An Open-Label, Prospective Study",https://www.mdpi.com/2077-0383/8/7/1017/pdf,,,
dataset-621,10.1101/699066,,ISD,LRRK2 regulates innate immune responses and neuroinflammation during Mycobacterium tuberculosis infection,https://www.biorxiv.org/content/biorxiv/early/2019/07/11/699066.full.pdf,,,
dataset-621,10.1002/poi3.210,,ISD,Countering Violent Extremism Online: The Experiences of Informal Counter Messaging Actors,https://onlinelibrary.wiley.com/doi/pdf/10.1002/poi3.210,,,
dataset-621,10.1088/2053-1591/ab2d86,Materials Research Express,ISD,Effect of adding graphite nano/micro platelets on salt freeze-thaw resistance of nano-modificent concrete,,,,
dataset-621,10.1039/c9ra03648b,,ISD,Metal phthalocyanine organic thin-film transistors: changes in electrical performance and stability in response to temperature and environment,https://pubs.rsc.org/en/content/articlepdf/2019/ra/c9ra03648b,,,
dataset-621,10.1039/c9ta04470a,Journal of Materials Chemistry A,ISD,Thickness-dependent bandgap and electrical properties of GeP nanosheets,,,,
dataset-621,10.1088/1755-1315/252/2/022119,,ISD,Structural Design and Inertial Impact Analysis of Vehicle ISD Suspension,https://iopscience.iop.org/article/10.1088/1755-1315/252/2/022119/pdf,,,
dataset-621,10.3127/ajis.v23i0.1847,,ISD,Designing TRiDS: Treatments for Risks in Design Science,https://journal.acs.org.au/index.php/ajis/article/download/1847/893,,,
dataset-621,10.1371/journal.pone.0216350,,ISD,What causes the burden of stroke in Scotland? A comparative risk assessment approach linking the Scottish Health Survey to administrative health data,https://journals.plos.org/plosone/article/file?id=10.1371/journal.pone.0216350&type=printable,,,
dataset-621,10.3390/app9132744,,ISD,Power Control and Link Selection for Wireless Relay Networks with Hybrid Energy Sources,https://www.mdpi.com/2076-3417/9/13/2744/pdf,,,
dataset-621,10.15381/rivep.v30i2.14887,,ISD,Metabolitos sanguíneos y parámetros zootécnicos en lechones destetados a dos edades y con adición de antimicrobianos en el alimento,https://revistasinvestigacion.unmsm.edu.pe/index.php/veterinaria/article/download/14887/14063,,,
dataset-621,10.1080/10409238.2019.1659227,Critical Reviews in Biochemistry and Molecular Biology,ISD,Current insights into the mechanism of mammalian immunoglobulin class switch recombination,,,,
dataset-621,10.3389/fmicb.2019.01426,,ISD,Interferon-Inducible Protein 16 (IFI16) Has a Broad-Spectrum Binding Ability Against ssDNA Targets: An Evolutionary Hypothesis for Antiretroviral Checkpoint,https://www.frontiersin.org/articles/10.3389/fmicb.2019.01426/pdf,,,
dataset-621,10.3389/fnbeh.2019.00148,,ISD,Social Housing Conditions Modulate the Long-Lasting Increase in Cocaine Reward Induced by Intermittent Social Defeat,https://www.frontiersin.org/articles/10.3389/fnbeh.2019.00148/pdf,,,
dataset-621,10.1080/00273171.2018.1563520,,ISD,The Assessment and Impact of Careless Responding in Routine Outcome Monitoring within Mental Health Care,https://www.tandfonline.com/doi/pdf/10.1080/00273171.2018.1563520?needAccess=true,,,
dataset-621,10.1111/1911-3846.12502,Contemporary Accounting Research,ISD,CEO Hedging Opportunities and the Weighting of Performance Measures in Compensation Contracts,,,,
dataset-621,10.1080/01446193.2018.1532592,Construction Management and Economics,ISD,Effect of project complexity on cost and schedule performance in transportation projects,,,,
dataset-621,10.1080/10357823.2019.1625864,Asian Studies Review,ISD,Biography and History: The Historiography of Lee Kuan Yew,,,,
dataset-621,10.1080/00207543.2018.1529444,International Journal of Production Research,ISD,Contextualisation of the complexity in the selection of developing country outsourcees by developed country outsourcers,,,,
dataset-621,10.1080/17476348.2019.1624528,,ISD,Prescribing trends of inhaler treatments for asthma and chronic obstructive pulmonary disease within a resource-constrained environment in the Scottish national health service: findings and implications,https://www.tandfonline.com/doi/pdf/10.1080/17476348.2019.1624528?needAccess=true,,,
dataset-621,10.9771/cmbio.v18i1.27590,,ISD,Métodos para detectar a doença cárie em populações: uma revisão da literatura,https://portalseer.ufba.br/index.php/cmbio/article/download/27590/19155,,,
dataset-621,10.1007/s00779-019-01254-9,Personal and Ubiquitous Computing,ISD,Basketball culture event detection based on comprehensive integrated method,,,,
dataset-621,10.1101/688275,,ISD,Independent Control of the Thermodynamic and Kinetic Properties of Aptamer Switches,https://www.biorxiv.org/content/biorxiv/early/2019/07/02/688275.full.pdf,,,
dataset-621,10.1088/1755-1315/268/1/012164,,ISD,Early warning system on flood hazard in river flow area based on radio frequency,https://iopscience.iop.org/article/10.1088/1755-1315/268/1/012164/pdf,,,
dataset-621,10.5194/nhess-2019-197,,ISD,Evaluation of Global Fire Weather Database re-analysis and short-term forecast products,https://www.nat-hazards-earth-syst-sci-discuss.net/nhess-2019-197/nhess-2019-197.pdf,,,
dataset-621,10.11591/ijeecs.v15.i1.pp104-112,,ISD,Develop and implementation of PC based controller for humanoid robot using digital potentiometer,https://www.iaescore.com/journals/index.php/IJEECS/article/download/17554/12699,,,
dataset-621,10.5433/1519-5392.2019v19n1p309,Entretextos,ISD,Entre o trabalho planificado e o realizado: configurações do agir docente de uma professora de Inglês para crianças no estágio supervisionado,,,,
dataset-621,10.1371/journal.ppat.1007883,,ISD,HIV and HCV augments inflammatory responses through increased TREM-1 expression and signaling in Kupffer and Myeloid cells,https://journals.plos.org/plospathogens/article/file?id=10.1371/journal.ppat.1007883&type=printable,,,
dataset-621,10.5433/1519-5392.2019v19n1p65,Entretextos,ISD,A reescrita do gênero “resumo escolar” mediada pela lista de controle/constatações,,,,
dataset-621,10.5433/1519-5392.2019v19n1p109,Entretextos,ISD,“MC's de verdade não desejam sociedades sem diversidade”: o rap LGBT nas aulas de língua inglesa,,,,
dataset-621,10.5433/1519-5392.2019v19n1p193,Entretextos,ISD,O gênero micronarrativa em contexto digital pela perspectiva do Interacionismo Sociodiscursivo,,,,
dataset-621,10.5433/1519-5392.2019v19n1p331,Entretextos,ISD,Entre dizeres e fazeres: evidências de um processo de formação continuada,,,,
dataset-621,10.5433/1519-5392.2019v19n1p241,Entretextos,ISD,Produção de sequência didática com base no gênero infográfico em língua inglesa: um olhar para o processo de transposição didática,,,,
dataset-621,10.5433/1519-5392.2019v19n1p227,Entretextos,ISD,A realização da sequência narrativa no cordel,,,,
dataset-621,10.5433/1519-5392.2019v19n1p143,Entretextos,ISD,A Parábola como instrumento linguístico mediador na pedagogia de Jesus acerca do Reino,,,,
dataset-621,10.5433/1519-5392.2019v19n1p87,Entretextos,ISD,O gênero textual biografia como eixo organizador de uma proposta de intervenção didática na educação básica,,,,
dataset-621,10.1007/s00603-019-1734-z,Rock Mechanics and Rock Engineering,ISD,Evaluation on the Minimum Principal Stress State and Potential Hydraulic Jacking from the Shotcrete-Lined Pressure Tunnel: A Case from Nepal,,,,
dataset-621,10.1016/j.purol.2019.03.002,Progrès en Urologie,ISD,Sphincter urinaire artificiel robot chez la femme : début d’expérience,,,,
dataset-621,10.1038/s41409-019-0559-4,,ISD,The 45th Annual Meeting of the European Society for Blood and Marrow Transplantation: Physicians – Poster Session,https://www.nature.com/articles/s41409-019-0559-4.pdf,,,
dataset-621,10.1111/jsbm.12325,Journal of Small Business Management,ISD,Behavioral Integration as a Relational Governance Mechanism in Family Firms—The Moderating Role of Family Involvement in Management,,,,
dataset-621,10.1080/20464177.2019.1632673,Journal of Marine Engineering & Technology,ISD,Vibration performance improvement of D/G-set employing inerter-rubber vibration isolator,,,,
dataset-621,10.1007/s11356-019-05389-3,Environmental Science and Pollution Research,ISD,Virulence-associated traits and in vitro biofilm-forming ability of Escherichia coli isolated from a major river traversing Northern India,,,,
dataset-621,10.1177/0733464817705957,,ISD,Implementation of a Complex Intervention to Support Leadership Development in Nursing Homes: A Multimethod Participatory Study,http://openaccess.city.ac.uk/17379/3/Complexinterventionarticle%20Accepted.pdf,,,
dataset-621,10.1177/1942602x19852949,NASN School Nurse,ISD,Data Sharing: Partnering With Others to Advance Student Health,,,,
dataset-621,10.1017/s204710251900013x,Transnational Environmental Law,ISD,The Sun Behind the Clouds? Enforcement of Renewable Energy Awards in the EU,,,,
dataset-621,10.24810/jelbow.25.2_234,,ISD,肘痛を主訴とするオーバーヘッドスポーツ選手における胸郭出口症候群の関与,,,,
dataset-621,10.1016/j.heliyon.2019.e02105,,ISD,Investigating the influence of contributing factors and predicting visibility at road link-level,http://www.heliyon.com/article/e02105/pdf,,,
dataset-621,10.1109/ceap.2019.8883480,,ISD,Design and Simulation of an Incremental Sigma-Delta Converter for Improving the Noise Floor Level of CMOS Image Sensors,,,,
dataset-621,10.1140/epjst/e2019-900088-6,,ISD,HE-LHC: The High-Energy Large Hadron Collider,https://link.springer.com/content/pdf/10.1140%2Fepjst%2Fe2019-900088-6.pdf,,,
dataset-621,10.1109/isit.2019.8849244,2013 IEEE International Symposium on Information Theory,ISD,Cryptanalysis of a One-Time Code-Based Digital Signature Scheme,,,,
dataset-621,10.1177/2051415818821548,Journal of Clinical Urology,ISD,Female stress urinary incontinence MDT,,,,
dataset-621,10.1007/s00216-019-01819-w,Analytical and Bioanalytical Chemistry,ISD,Analysis of oligonucleotides by ion-pair reversed-phase liquid chromatography coupled with positive mode electrospray ionization mass spectrometry,,,,
dataset-621,10.1103/physrevapplied.12.014013,,ISD,Quantum Transport Properties of Industrial Si28/SiO228,http://arxiv.org/pdf/1810.06521,,,
dataset-621,10.1016/j.joule.2019.05.008,Joule,ISD,Thermal-Driven Phase Separation of Double-Cable Polymers Enables Efficient Single-Component Organic Solar Cells,,,,
dataset-621,10.1109/aiact.2019.8847905,,ISD,Radiation resistant FET-based Temperature Sensor for End Devices of IoT,,,,
dataset-621,10.1109/iccsa.2019.00013,,ISD,Holacracy In Software Development Teams: A Multivocal Literature Review,,,,
dataset-621,10.1016/j.jlp.2019.04.015,,ISD,Towards an inherently safer bioprocessing industry: A review,https://doi.org/10.1016/j.jlp.2019.04.015,,,
dataset-621,10.1002/sres.2558,Systems Research and Behavioral Science,ISD,The Unfolding and Resurfacing of Information Systems Knowledge over the Last 25 Years: A Systemic Perspective,,,,
dataset-621,10.1002/mmce.21720,International Journal of RF and Microwave Computer-Aided Engineering,ISD,Survey on parameter optimization of mobile communication band low noise amplifier design,,,,
dataset-621,10.1109/isemc.2019.8825195,,ISD,An Efficient Pico-Probe Error Box Removal Method,,,,
dataset-621,10.1109/icufn.2019.8806048,2017 Ninth International Conference on Ubiquitous and Future Networks (ICUFN),ISD,RAPEL: Robust and Adaptive method for PIT Entry Lifetime in Wireless Content-Centric Networks,,,,
dataset-621,10.1007/s00167-018-5051-y,"Knee Surgery, Sports Traumatology, Arthroscopy",ISD,Higher failure rate of two-stage revision for infected knee arthroplasties in significantly compromised (host-C) patients,,,,
dataset-621,10.1016/j.joca.2019.06.008,Osteoarthritis and Cartilage,ISD,Trends in gabapentinoid prescribing in patients with osteoarthritis: a United Kingdom national cohort study in primary care,,,,
dataset-621,10.1016/j.ejca.2019.03.024,European Journal of Cancer,ISD,Whether vitamin D supplementation protects against colorectal cancer risk remains an open question,,,,
dataset-621,10.1002/bjs.11151,,ISD,Reducing surgical mortality in Scotland by use of the WHO Surgical Safety Checklist,https://onlinelibrary.wiley.com/doi/pdf/10.1002/bjs.11151,,,
dataset-621,10.1055/s-0039-1685518,Seminars in Liver Disease,ISD,Hepatitis B Virus–Hepatocyte Interactions and Innate Immune Responses: Experimental Models and Molecular Mechanisms,,,,
dataset-621,10.1109/icufn.2019.8805919,2017 Ninth International Conference on Ubiquitous and Future Networks (ICUFN),ISD,Content Name Privacy in Tactical Named Data Networking,,,,
dataset-621,10.1109/embc.2019.8857822,2010 Annual International Conference of the IEEE Engineering in Medicine and Biology,ISD,A Convolutional Neural Network for Enhancing the Detection of SSVEP in the Presence of Competing Stimuli,,,,
dataset-621,10.1016/j.jshs.2019.07.006,,ISD,Transition to forefoot strike reduces load rates more effectively than altered cadence,https://doi.org/10.1016/j.jshs.2019.07.006,,,
dataset-621,10.1038/s41431-019-0408-3,,ISD,Abstracts from the 51st European Society of Human Genetics Conference: Electronic Posters,https://www.nature.com/articles/s41431-019-0408-3.pdf,,,
dataset-621,10.25559/sitito.15.201902.263-273,Международный научный журнал «Современные информационные технологии и ИТ-образование»,ISD,Модель обслуживания трафика одноадресных и многоадресных соединений высокочастотной сети 5G,,,,
dataset-621,10.1109/isit.2019.8849600,2013 IEEE International Symposium on Information Theory,ISD,On Decoding and Applications of Interleaved Goppa Codes,,,,
dataset-621,10.1016/j.bone.2019.04.003,Bone,ISD,Use of oral bisphosphonates and risk of hospital admission with osteonecrosis of the jaw: Large prospective cohort study in UK women,,,,
dataset-621,10.1109/embc.2019.8857796,2010 Annual International Conference of the IEEE Engineering in Medicine and Biology,ISD,Assessment of feeding teats: an experimental study,,,,
dataset-621,10.3310/hta23370,Health Technology Assessment,ISD,Low-dose oral theophylline combined with inhaled corticosteroids for people with chronic obstructive pulmonary disease and high risk of exacerbations: a RCT,,,,
dataset-621,10.1140/epjst/e2019-900087-0,,ISD,FCC-hh: The Hadron Collider,https://link.springer.com/content/pdf/10.1140%2Fepjst%2Fe2019-900087-0.pdf,,,
dataset-621,10.1177/2325967119s00304,,ISD,"Trends in US High School Football Concussion Reporting,
2012-2017",http://dx.doi.org/10.1177/2325967119s00304,,,
dataset-621,10.1109/compsac.2019.00018,,ISD,In Search of Scientific Agile,,,,
dataset-621,10.1016/j.ijbiomac.2019.04.011,International Journal of Biological Macromolecules,ISD,Phylomitogenomics of Phaneropteridae (Orthoptera): Combined data indicate a poorly conserved mitogenome,,,,
dataset-621,10.23919/chicc.2019.8866176,2008 27th Chinese Control Conference,ISD,Control Strategy of Mechatronic Inerter Based on Permanent Magnet Synchronous Motor,,,,
