datasets,doi,journal,search_term,title,url,valid?,notes,pdf
dataset-621,10.1109/redw.2019.8906601,,ISD,Radiation Evaluation of the Texas Instruments TPS7H2201-SP eFuse,,,,
dataset-621,10.26466/opus.565691,,ISD,Yumuşak Güç Kavramı Bağlamında Çin’in Sahraaltı Afrika’ya Yönelik Kamu Diplomasisi Faaliyetleri,http://dergipark.org.tr/download/article-file/737907,,,
dataset-621,10.15294/jpii.v8i2.18135,,ISD,A Comparison Study: Effects of the Group Investigation Model and Direct Instruction Model toward Science Concept Understanding,https://doi.org/10.15294/jpii.v8i2.18135,,,
dataset-621,10.18203/2349-2902.isj20192955,,ISD,Anatomical variations of the inguinal morphometric features in patients with inguinal hernia and its association with the type of inguinal hernia: a prospective clinical study,https://www.ijsurgery.com/index.php/isj/article/download/4106/2980,,,
dataset-621,10.3390/cryst9070333,,ISD,Monotype Organic Dual Threshold Voltage Using Different OTFT Geometries,https://www.mdpi.com/2073-4352/9/7/333/pdf,,,
dataset-621,10.1039/c9ra02337b,,ISD,Characterization of glycan isomers using magnetic carbon nanoparticles as a MALDI co-matrix,https://pubs.rsc.org/en/content/articlepdf/2019/ra/c9ra02337b,,,
dataset-621,,arXiv,ISD,Simultaneous Prediction Intervals for Patient-Specific Survival Curves,,,,
dataset-621,10.15407/cryo29.02.137,,ISD,Methodology of Cryotherapy Use in Medical Practice,http://cryo.org.ua/journal/index.php/probl-cryobiol-cryomed/article/download/1528/pdf,,,
dataset-621,10.3389/fphy.2019.00082,,ISD,Superconductive REBCO Thin Films and Their Nanocomposites: The Role of Rare-Earth Oxides in Promoting Sustainable Energy,https://www.frontiersin.org/articles/10.3389/fphy.2019.00082/pdf,,,
dataset-621,10.1080/15348431.2019.1613996,Journal of Latinos and Education,ISD,Exploring Institutional Processes in a District-Wide Dual Language Program: Who is it for? Who is Left Out?,,,,
dataset-621,10.1002/9781119468455.ch9,,ISD,Chlorophyll and Graphene: A New Paradigm of Biomimetic Symphony,,,,
dataset-621,10.1080/00949655.2019.1590579,Journal of Statistical Computation and Simulation,ISD,Identifiability and bias reduction in the skew-probit model for a binary response,,,,
dataset-621,10.1002/9781119519393,,ISD,Process Safety Leadership from the Boardroom to the Frontline,,,,
dataset-621,10.1002/mp.13581,,ISD,Deep learning‐based carotid media‐adventitia and lumen‐intima boundary segmentation from three‐dimensional ultrasound images,https://aapm.onlinelibrary.wiley.com/doi/pdf/10.1002/mp.13581,,,
dataset-621,10.1002/admt.201900262,,ISD,Real‐Time Monitoring of Glucose Export from Isolated Chloroplasts Using an Organic Electrochemical Transistor,https://onlinelibrary.wiley.com/doi/pdf/10.1002/admt.201900262,,,
dataset-621,10.1111/roie.12417,,ISD,Regulatory chill and the effect of investor state dispute settlements,https://www.cesifo-group.de/DocDL/cesifo1_wp6188.pdf,,,
dataset-621,10.1101/664045,,ISD,"Birth weight predicts psychiatric and physical health, cognitive function, and DNA methylation differences in an adult population",https://www.biorxiv.org/content/biorxiv/early/2019/06/09/664045.full.pdf,,,
dataset-621,10.1007/s10064-019-01544-9,,ISD,Detailed engineering geological assessment of a shotcrete lined pressure tunnel in the Himalayan rock mass conditions: a case study from Nepal,https://link.springer.com/content/pdf/10.1007%2Fs10064-019-01544-9.pdf,,,
dataset-621,10.1145/3311749,ACM Transactions on Multimedia Computing Communications and Applications,ISD,QoE for Mobile Clients with Segment-aware Rate Adaptation Algorithm (SARA) for DASH Video Streaming,,,,
dataset-621,10.1007/s11165-019-9860-x,Research in Science Education,ISD,A Framework for the Development of Schoolyard Pedagogy,,,,
dataset-621,10.1039/c9cp00083f,Physical Chemistry Chemical Physics,ISD,Hydrogen atom attachment to histidine and tryptophan containing peptides in the gas phase,,,,
dataset-621,10.1080/15348431.2019.1622115,Journal of Latinos and Education,ISD,“You Just Sit There and Be Quiet”: Latino/A Bilingual Educators in Texas,,,,
dataset-621,10.1002/advs.201900522,,ISD,Hybrid Silicon Nanowire Devices and Their Functional Diversity,https://onlinelibrary.wiley.com/doi/pdf/10.1002/advs.201900522,,,
dataset-621,10.7717/peerj.6959,,ISD,Plastome phylogenomics and characterization of rare genomic changes as taxonomic markers in plastome groups 1 and 2 Poeae (Pooideae; Poaceae),https://peerj.com/articles/6959.pdf,,,
dataset-621,10.1080/21645515.2018.1543522,Human Vaccines & Immunotherapeutics,ISD,Cost-impact study of rotavirus vaccination programme in Scotland,,,,
dataset-621,10.1080/1028415x.2017.1408946,Nutritional Neuroscience,ISD,Impact of maternal iron deficiency on the auditory functions in the young and adult guinea pig,,,,
dataset-621,10.2478/fhort-2019-0001,,ISD,Approved genetically modified (GM) horticultural plants: A 25-year perspective,https://content.sciendo.com/downloadpdf/journals/fhort/ahead-of-print/article-10.2478-fhort-2019-0001.pdf,,,
dataset-621,10.21608/jsre.2019.33875,,ISD,شکلان لتصمیم واجهات تفاعل التطبیقات التعلیمیة بالهواتف الذکیة وأثرهما على الحمل المعرفی لدى طالبات تکنولوجیا التعلیم والمعلومات,https://jsre.journals.ekb.eg/article_33875_2d84063949967380c2f0172bc8ca1259.pdf,,,
dataset-621,10.1140/epjst/e2019-900045-4,,ISD,FCC-ee: The Lepton Collider,https://link.springer.com/content/pdf/10.1140%2Fepjst%2Fe2019-900045-4.pdf,,,
dataset-621,10.1016/j.tws.2019.03.005,Thin-Walled Structures,ISD,Numerical modelling and simulation of fatigue damage in carbon fibre reinforced plastics at different stress ratios,,,,
dataset-621,10.1055/s-0043-112859,Klinische Monatsblätter für Augenheilkunde,ISD,Vergleich von Diskriminanzanalyse und Entscheidungsbäumen zur Erkennung des frühen Keratokonus,,,,
dataset-621,10.1016/j.ecolecon.2019.01.036,Ecological Economics,ISD,Assessing the effectiveness of Japan's community-based direct payment scheme for hilly and mountainous areas,,,,
dataset-621,10.1007/s10008-019-04261-1,Journal of Solid State Electrochemistry,ISD,Quantum conductance investigation on carbon nanotube–based antibiotic sensor,,,,
dataset-621,10.1038/s41432-019-0027-4,Evidence-Based Dentistry,ISD,Is there an association between prenatal oral healthcare and early childhood caries prevention?,,,,
dataset-621,10.1109/eucnc.2019.8802028,2018 European Conference on Networks and Communications (EuCNC),ISD,5G Component Carrier Management Evaluation by Means of System Level Simulations,,,,
dataset-621,10.1016/j.cca.2019.03.1466,Clinica Chimica Acta,ISD,A comprehensive framework for test evaluation under the new IVD regulation,,,,
dataset-621,10.7861/futurehosp.6-2-123,,ISD,"The Walton Centre neurology network – an equitable, sustainable and deliverable model for a large-scale neurology service",http://futurehospital.rcpjournal.org/content/6/2/123.full.pdf,,,
dataset-621,10.1109/metroaerospace.2019.8869551,2018 5th IEEE International Workshop on Metrology for AeroSpace (MetroAeroSpace),ISD,Fine positioning algorithms for the ESA/PROBA-3 formation flying mission,,,,
dataset-621,10.1109/fuzz-ieee.2019.8858924,2017 IEEE International Conference on Fuzzy Systems (FUZZ-IEEE),ISD,On D-implications derived by grouping functions,,,,
dataset-621,10.1016/j.paid.2019.02.015,Personality and Individual Differences,ISD,Noncompliant responding: Comparing exclusion criteria in MTurk personality research to improve data quality,,,,
dataset-621,10.1053/j.ajkd.2019.04.004,American Journal of Kidney Diseases,ISD,2 Patiromer to Enable Spironolactone in Patients with Resistant Hypertension and CKD: Primary Results of AMBER,,,,
dataset-621,10.1007/s13253-019-00351-9,"Journal of Agricultural, Biological and Environmental Statistics",ISD,Computation of Lacunarity from Covariance of Spatial Binary Maps,,,,
dataset-621,10.1109/tbc.2019.2912117,IEEE Transactions on Broadcasting,ISD,5G New Radio for Terrestrial Broadcast: A Forward-Looking Approach for NR-MBMS,,,,
dataset-621,10.1007/s11256-018-0481-x,The Urban Review,ISD,Educational Resilience at Risk? The Challenges of Attending an Early College High School,,,,
dataset-621,10.1177/1527002518798687,Journal of Sports Economics,ISD,Does the NCAA’s Collegiate Model Promote Competitive Balance? Power-5 Conference Football Versus the NFL,,,,
dataset-621,10.1038/s41579-019-0189-2,Nature Reviews Microbiology,ISD,Origins and evolutionary consequences of ancient endogenous retroviruses,,,,
dataset-621,10.1016/j.fusengdes.2019.03.077,Fusion Engineering and Design,ISD,Tritium transportation modeling and analysis for tritium extraction system of HCSB blanket,,,,
dataset-621,10.23919/ecc.2019.8795802,,ISD,Set Membership Identification and Control of an Iterative Process,,,,
dataset-621,10.1111/jfpe.13018,Journal of Food Process Engineering,ISD,Solar drying kinetics and bioactive compounds of blackberry (Rubus fruticosus),,,,
dataset-621,10.1109/metroaerospace.2019.8869628,2018 5th IEEE International Workshop on Metrology for AeroSpace (MetroAeroSpace),ISD,The Occulter Position Sensor Emitters (OPSE) metrology sub-system for the PROBA-3 mission,,,,
dataset-621,10.1016/j.cca.2019.03.1468,Clinica Chimica Acta,ISD,Improving clinical outcome using TDM in paediatric liver transplantation,,,,
dataset-621,10.1016/j.cca.2019.03.1469,Clinica Chimica Acta,ISD,Monitoring tacrolimus intracellular concentrations: Would it help better predicting graft clinical outcome?,,,,
dataset-621,10.1109/iccsn.2019.8905331,2017 IEEE 9th International Conference on Communication Software and Networks (ICCSN),ISD,Two Design Schemes for LT Codes Degree Distribution by Combining Degree Distribution,,,,
dataset-621,10.1109/eucnc.2019.8802036,2018 European Conference on Networks and Communications (EuCNC),ISD,A High Performance Low Complexity Muting Scheme for Interference Coordination,,,,
dataset-621,10.1134/s1064226919060093,Journal of Communications Technology and Electronics,ISD,Itakura–Saito Divergence as an Element of the Information Theory of Speech Perception,,,,
dataset-621,10.1053/j.ajkd.2019.04.005,American Journal of Kidney Diseases,ISD,"3 Intradialytic Aromatherapy Decreases Anxiety, Insomnia, and Emergency Department (ED) Visits",,,,
dataset-621,10.1016/j.cca.2019.03.1471,Clinica Chimica Acta,ISD,Instrument verification - Time well spent,,,,
dataset-621,10.1016/j.drugpo.2019.03.010,International Journal of Drug Policy,ISD,"‘We are still obsessed by this idea of abstinence’: A critical analysis of UK news media representations of proposals to introduce drug consumption rooms in Glasgow, UK",,,,
dataset-621,10.1136/bmjopen-2018-026687,,ISD,How do we evaluate the cost of nosocomial infection? The ECONI protocol: an incidence study with nested case-control evaluating cost and quality of life,https://doi.org/10.1136/bmjopen-2018-026687,,,
dataset-621,10.1016/j.engstruct.2019.03.033,Engineering Structures,ISD,Implications of modeling approaches on seismic performance of low- and mid-rise office and hospital shear wall buildings,,,,
dataset-621,10.1109/metroaerospace.2019.8869623,2018 5th IEEE International Workshop on Metrology for AeroSpace (MetroAeroSpace),ISD,"The in-flight calibration procedures of the Shadow Position Sensors (SPS), a very accurate optical metrology system of the ESA/PROBA-3 formation flying mission",,,,
dataset-621,10.1038/s41928-019-0259-5,,ISD,A CMOS dynamic random access architecture for radio-frequency readout of quantum devices,http://arxiv.org/pdf/1809.03894,,,
dataset-621,10.1053/j.ajkd.2019.04.003,American Journal of Kidney Diseases,ISD,"1 LOCK-IT-100: CRMD003, A Novel Taurolidine-Based Catheter Lock Solution Reduces Catheter-Related Bloodstream Infections in Hemodialysis",,,,
dataset-621,10.1016/j.job.2019.04.001,Journal of Oral Biosciences,ISD,Dental restorative composite materials: A review,,,,
dataset-621,10.1002/aelm.201900067,Advanced Electronic Materials,ISD,Solution Shearing of a High‐Capacitance Polymer Dielectric for Low‐Voltage Organic Transistors,,,,
dataset-621,10.1007/s12028-019-00692-w,Neurocritical Care,ISD,Neurostereologic Lesion Volumes and Spreading Depolarizations in Severe Traumatic Brain Injury Patients: A Pilot Study,,,,
dataset-621,10.1016/j.cca.2019.03.1467,Clinica Chimica Acta,ISD,Pharmacogenetic biomarkers predictive of the pharmacokinetics and pharmacodynamics of immunosuppressive drugs,,,,
dataset-621,10.1002/prop.201900037,Fortschritte der Physik,ISD,The Swampland: Introduction and Review,,,,
dataset-621,10.1002/prot.25667,Proteins Structure Function and Bioinformatics,ISD,Statistical analysis of disease‐causing and neutral mutations in human membrane proteins,,,,
dataset-621,10.1109/metroaerospace.2019.8869603,2018 5th IEEE International Workshop on Metrology for AeroSpace (MetroAeroSpace),ISD,The Shadow Position Sensors (SPS) metrology subsystem on-board PROBA-3 mission : Design and performance,,,,
dataset-621,10.1007/s11214-019-0597-7,Space Science Reviews,ISD,"Interplanetary Dust, Meteoroids, Meteors and Meteorites",,,,
dataset-621,10.1109/tasc.2018.2867797,IEEE Transactions on Applied Superconductivity,ISD,Influence of the Substrate Surface Morphology on the Texture of Magnesium Oxide Films Grown Via Inclined Substrate Deposition,,,,
dataset-621,10.1002/hed.25630,Head & Neck,ISD,Determinants of long‐term survival in a population‐based cohort study of patients with head and neck cancer from Scotland,,,,
dataset-621,10.1016/j.scitotenv.2019.03.306,The Science of The Total Environment,ISD,"Distribution, pollution status, and source apportionment of trace metals in lake sediments under the influence of the South-to-North Water Transfer Project, China",,,,
dataset-621,10.1111/emip.12256,Educational Measurement Issues and Practice,ISD,The Effects of Inattentive Responding on Construct Validity Evidence When Measuring Social–Emotional Learning Competencies,,,,
dataset-621,10.1016/j.jsis.2018.12.002,The Journal of Strategic Information Systems,ISD,Information technology and the search for organizational agility: A systematic review with future research possibilities,,,,
dataset-621,10.1109/tpel.2018.2870067,,ISD,A Novel Non-Intrusive Technique for BTI Characterization in SiC <sc>mosfet</sc>s,https://doi.org/10.1109/tpel.2018.2870067,,,
dataset-621,10.1007/s13361-019-02232-4,,ISD,67TH ASMS Conference on Mass Spectrometry and Allied Topics,http://downloads.hindawi.com/journals/ijg/2000/480263.pdf,,,
dataset-621,10.1016/j.im.2018.10.003,Information & Management,ISD,Effective Organizational Improvisation in Information Systems Development: Insights from the Tencent Messaging System Development,,,,
dataset-621,10.1053/j.ajkd.2019.04.006,American Journal of Kidney Diseases,ISD,4 Effect of Resistance Exercise Plus Cholecalciferol on Nutritional Status Indicators in Adults with Stage 4 CKD,,,,
dataset-621,10.1109/edssc.2019.8753994,,ISD,A Snapback-Free Reverse-Conducting IGBT with Integrated Schottky Diode in the Collector,,,,
dataset-621,10.1002/nau.24000,Neurourology and Urodynamics,ISD,Optimising the tension of an autologous fascia pubovaginal sling to minimize retentive complications,,,,
dataset-621,10.1109/metroi4.2019.8792913,,ISD,Trade-off between Performance and Security for Coding and Ring Learning With Errors-based Diffie-Hellman Cryptosystems,,,,
dataset-621,10.1016/j.electacta.2019.04.034,Electrochimica Acta,ISD,Electrolyte gated transistors modified by polypyrrole nanoparticles,,,,
dataset-621,10.1016/j.cca.2019.03.1470,Clinica Chimica Acta,ISD,The role of biomarkers in solid organ transplantation,,,,
dataset-621,10.1136/bmjopen-2018-028482,,ISD,Evaluating possible intended and unintended consequences of the implementation of alcohol minimum unit pricing (MUP) in Scotland: a natural experiment protocol,https://bmjopen.bmj.com/content/bmjopen/9/6/e028482.full.pdf,,,
dataset-621,10.1007/s11219-018-9425-7,Software Quality Journal,ISD,Coverage-based quality metric of mutation operators for test suite improvement,,,,
dataset-621,10.1097/01.hs9.0000559308.97847.d6,,ISD,UNMANIPULATED HID COMPARED TO MUD AND ISD HAD SIMILAR GRAFT ANTI-LEUKEMIA EFFECT ON MYELOABLATIVE HSCT FOR AML IN CR,https://doi.org/10.1097/01.hs9.0000559308.97847.d6,,,
dataset-621,10.1016/j.bbmt.2019.01.030,Biology of Blood and Marrow Transplantation,ISD,Comparable Outcomes after Hematopoietic Stem Cell Transplantation from Mother Donors and Matched Unrelated Donors in Patients with Hematopoietic Malignancies,,,,
dataset-621,10.1007/s10772-019-09613-w,International Journal of Speech Technology,ISD,Single channel speech enhancement using an MVDR filter in the frequency domain,,,,
dataset-621,10.11517/pjsai.jsai2019.0_2f1e303,,ISD,An Automated Negotiating Agent that Searches the Bids around Nash Bargaining Solution to Obtain High Joint Utilities,,,,
dataset-621,10.1111/aos.13968,Acta Ophthalmologica,ISD,IgG4‐related disease in patients with idiopathic orbital inflammation syndrome: data from the French SIOI prospective cohort,,,,
dataset-621,10.1016/j.ejogrb.2019.02.016,European Journal of Obstetrics & Gynecology and Reproductive Biology,ISD,Clinical score predictive of abdominal leak point pressure (ALPP) <60 cm H2O in the urodynamics study of women with stress urinary incontinence,,,,
dataset-621,10.1109/tasc.2018.2872903,IEEE Transactions on Applied Superconductivity,ISD,Stainless Steel as Substrate Material for High-Temperature Superconducting Tapes Processed Via the ISD MgO Route,,,,
dataset-621,10.1002/ehf2.12421,,ISD,Underuse of hydralazine and isosorbide dinitrate for heart failure in patients of African ancestry: a cross‐European survey,https://onlinelibrary.wiley.com/doi/pdf/10.1002/ehf2.12421,,,
dataset-621,10.1109/tim.2018.2882958,IEEE Transactions on Instrumentation and Measurement,ISD,Graphene Devices for Tabletop and High-Current Quantized Hall Resistance Standards,,,,
dataset-621,10.3390/socsci8060166,,ISD,Texas Rural vs. Nonrural School District Student Growth Trajectories on a High-Stakes Science Exam: A Multilevel Approach,https://www.mdpi.com/2076-0760/8/6/166/pdf,,,
dataset-621,10.4491/ksee.2019.41.5.278,,ISD,Study on the Quantitative Analysis of Styrene Oligomers Originated from Styrene-based Plastic Polymer Materials,http://jksee.or.kr/upload/pdf/KSEE-2019-41-5-278.pdf,,,
dataset-621,10.1002/9783527603978.mst0480,,ISD,Beyond Silicon MOS: An Electrical Study on Interface and Gate Dielectrics with ac Admittance Techniques,,,,
dataset-621,10.12948/ie2019.05.06,,ISD,CHALLENGES OF SCALING AGILE AT ORGANIZATION LEVEL,,,,
dataset-621,10.3390/agronomy9060276,,ISD,Potential Benefits of Polymers in Soil Erosion Control for Agronomical Plans: A Laboratory Experiment,https://www.mdpi.com/2073-4395/9/6/276/pdf,,,
dataset-621,10.1039/c9tc01373c,Journal of Materials Chemistry C,ISD,A universal strategy to improve the mechanical stability of flexible organic thin film transistors,,,,
dataset-621,10.3897/dez.66.34711,,ISD,"About Notiophilus Duméril, 1806 (Coleoptera, Carabidae): Species delineation and phylogeny using DNA barcodes",https://dez.pensoft.net/article/34711/download/pdf/,,,
dataset-621,10.1002/wcc.589,,ISD,Nationally Determined Contributions: Material climate commitments and discursive positioning in the NDCs,https://onlinelibrary.wiley.com/doi/pdf/10.1002/wcc.589,,,
dataset-621,10.1074/jbc.ra118.005731,,ISD,PtdIns3P phosphatases MTMR3 and MTMR4 negatively regulate innate immune responses to DNA through modulating STING trafficking,http://www.jbc.org/content/early/2019/04/03/jbc.RA118.005731.full.pdf,,,
dataset-621,10.3390/s19102384,,ISD,400 °C Sensor Based on Ni/4H-SiC Schottky Diode for Reliable Temperature Monitoring in Industrial Environments,https://www.mdpi.com/1424-8220/19/10/2384/pdf,,,
dataset-621,10.1136/flgastro-2018-101104,Frontline Gastroenterology,ISD,Recent advances in alcoholic hepatitis,,,,
dataset-621,10.1128/mbio.00919-19,,ISD,Herpes Simplex Virus 1 Tegument Protein UL46 Inhibits TANK-Binding Kinase 1-Mediated Signaling,https://mbio.asm.org/content/mbio/10/3/e00919-19.full.pdf,,,
dataset-621,10.1515/9783110479232-009,,ISD,Möglichkeiten und Herausforderungen der Deutschförderung japanischer Expatriates in Deutschland,,,,
dataset-621,10.1371/journal.ppat.1007691,,ISD,Human cytomegalovirus protein UL42 antagonizes cGAS/MITA-mediated innate antiviral response,https://journals.plos.org/plospathogens/article/file?id=10.1371/journal.ppat.1007691&type=printable,,,
dataset-621,10.33504/manutech.v10i02.60,,ISD,Petunjuk Waktu Untuk Tuna Netra Dengan Output Suara,http://ejournal.polman-babel.ac.id/index.php/manutech/article/download/60/77,,,
dataset-621,10.1111/jdv.15618,Journal of the European Academy of Dermatology and Venereology,ISD,Phenotypic analysis of atopic dermatitis in children aged 1–12 months: elaboration of novel diagnostic criteria for infants in China and estimation of prevalence,,,,
dataset-621,10.1136/bjophthalmol-2019-314206,British Journal of Ophthalmology,ISD,"Prevalence of treatment with glaucoma medication in Scotland, 2010–2017",,,,
dataset-621,10.3399/bjgpopen19x101644,,ISD,GP speciality training in areas of deprivation: factors influencing engagement. A qualitative study,https://bjgpopen.org/content/bjgpoa/early/2019/05/13/bjgpopen19X101644.full.pdf,,,
dataset-621,10.3233/jifs-179002,Journal of Intelligent & Fuzzy Systems,ISD,Color image share cryptography: a novel approach,,,,
dataset-621,10.3758/s13428-019-01227-z,Behavior Research Methods,ISD,Validation of constituent logographemes and radicals in Chinese characters using handwriting data,,,,
dataset-621,10.1007/s10270-019-00735-y,,ISD,Thirteen years of SysML: a systematic mapping study,https://link.springer.com/content/pdf/10.1007%2Fs10270-019-00735-y.pdf,,,
dataset-621,10.1080/09638288.2019.1611954,Disability and Rehabilitation,ISD,Being a peer support mentor for individuals who have had a lower limb amputation: an interpretative phenomenological analysis,,,,
dataset-621,10.1380/vss.62.288,Vacuum and Surface Science,ISD,残留ガス質量分析計の性能を引き出すには その1 センサーヘッドからのガス放出と対策,,,,
dataset-621,10.1088/1361-6528/ab029e,Nanotechnology,ISD,Highly tunable doping in Ge quantum dots/graphene composite with distinct quantum dot growth evolution,,,,
dataset-621,10.1080/15348431.2019.1612399,Journal of Latinos and Education,ISD,Broken Windows and Catching Frogs: Exploring Concepts of Historic and Contemporary Parental and Community Involvement,,,,
dataset-621,10.11158/saa.24.5.6,,ISD,Erythraeid larvae parasitizing dragonflies in Zambiadescription of Leptus (Leptus) chingombensis sp. nov. with data on biology and ecology of host-parasite interactions,https://biotaxa.org/saa/article/download/saa.24.5.6/44783,,,
dataset-621,10.1002/9781119549253,,ISD,PHR and SPHR Professional in Human Resources Certification Complete Study Guide,,,,
dataset-621,10.1080/23311886.2019.1615767,,ISD,"Development, measurement, and managerial implications of Chinese values",https://doi.org/10.1080/23311886.2019.1615767,,,
dataset-621,10.1002/poi3.204,Policy & Internet,ISD,Countering Violent Extremist Narratives Online: Lessons From Offline Countering Violent Extremism,,,,
dataset-621,10.1002/qj.3531,Quarterly Journal of the Royal Meteorological Society,ISD,The added value of convection‐permitting ensemble forecasts of sea breeze compared to a Bayesian forecast driven by the global ensemble,,,,
dataset-621,10.1080/14789450.2019.1601561,Expert Review of Proteomics,ISD,Molecular insights into cancer drug resistance from a proteomics perspective,,,,
dataset-621,10.1080/00958964.2019.1604479,The Journal of Environmental Education,ISD,Barriers and opportunities for climate change education: The case of Dallas-Fort Worth in Texas,,,,
dataset-621,10.1080/14703297.2018.1502091,Innovations in Education and Teaching International,ISD,To BlikBook or not to BlikBook: Exploring student engagement of an online discussion platform,,,,
dataset-621,10.1080/19401493.2018.1560500,Journal of Building Performance Simulation,ISD,An instructional design for building energy simulation e-learning: an interdisciplinary approach,,,,
dataset-621,10.1002/bmc.4548,Biomedical Chromatography,ISD,Development and validation of bioanalytical method for quantification of cycloserine in human plasma by liquid chromatography–tandem mass spectrometry: Application to pharmacokinetic study,,,,
dataset-621,10.1088/1361-6641/ab0efc,Semiconductor Science and Technology,ISD,Effects of uniaxial strain on the performance of armchair graphene nanoribbon resonant tunneling diode,,,,
dataset-621,10.2478/picbe-2019-0070,Proceedings of the International Conference on Business Excellence,ISD,"Towards a smart, inclusive and sustainable development. Investment in human capital and innovation. An empirical analysis",,,,
dataset-621,10.1109/tpami.2018.2829192,IEEE Transactions on Pattern Analysis and Machine Intelligence,ISD,What Makes Objects Similar: A Unified Multi-Metric Learning Approach,,,,
dataset-621,10.1002/bate.201800099,Bautechnik,ISD,Zur Fortentwicklung des Microplane‐Modells für die numerische Analyse von Betonstrukturen,,,,
dataset-621,10.1111/codi.14560,Colorectal Disease,ISD,Prehabilitation is feasible in patients with rectal cancer undergoing neoadjuvant chemoradiotherapy and may minimize physical deterioration: results from the REx trial,,,,
dataset-621,10.1109/iccw.2019.8756860,,ISD,Multi-Cell IDMA NOMA Performance in NR Deployment,,,,
dataset-621,10.1016/j.ppnp.2019.02.001,Progress in Particle and Nuclear Physics,ISD,Isoscalar and isovector dipole excitations: Nuclear properties from low-lying states and from the isovector giant dipole resonance,,,,
