author,year,publication and journal,dataset,datadrop origin,title,doi,url,pdf,valid
"Jackson, J. R., J. A. Jennings, E. Golembiewski, B. L. Brown-Podgorski and N. Menachemi ",2017,"""Black Graduates of Health Administration Doctoral Programs: Examining Trends."" The Journal of Health Administration Education 34(2): 213-227.",dataset-370,EndNote SED library 11/7/2017,Black Graduates of Health Administration Doctoral Programs: Examining Trends,,https://www.ingentaconnect.com/contentone/aupha/jhae/2017/00000034/00000002/art00004#,http://docserver.ingentaconnect.com/deliver/connect/aupha/07356722/v34n2/s4.pdf?expires=1587399386&id=0000&titleid=41000044&checksum=6FF3E7D701ABC22057F44FBC90DC399F,1
"Sumell, A. J., P. E. Stephan and J. D. Adams ",2005,"Capturing Knowledge: The Location Decision of New Ph.D.s Working in Industry. Science and Engineering Careers in the United States: An Analysis of Markets and Employment, University of Chicago Press.",dataset-370,EndNote SED library 11/7/2017,Capturing Knowledge: The Location Decision of New Ph.D.s Working in Industry,,https://www.nber.org/chapters/c11624,https://www.nber.org/chapters/c11624.pdf,1
"Sibulkin, A. E. and J. S. Butler ",2011,"""Diverse Colleges of Origin of African American Doctoral Recipients, 2001–2005: Historically Black Colleges and Universities and Beyond."" Research in Higher Education 52(8): 830-852.",dataset-370,EndNote SED library 11/7/2017,"Diverse Colleges of Origin of African American Doctoral Recipients, 2001–2005: Historically Black Colleges and Universities and Beyond",10.1007/s11162-011-9220-9,https://link.springer.com/article/10.1007/s11162-011-9220-9,https://link.springer.com/content/pdf/10.1007/s11162-011-9220-9.pdf,1
"Leggon, C. B. ",2010,"""Diversifying Science and Engineering Faculties: Intersections of Race, Ethnicity, and Gender."" American Behavioral Scientist 53(7): 1013-1028.","dataset-370, dataset-371, dataset-951",EndNote SED library 11/7/2017,"Diversifying Science and Engineering Faculties: Intersections of Race, Ethnicity, and Gender",10.1177/0002764209356236,https://journals.sagepub.com/doi/10.1177/0002764209356236,https://journals.sagepub.com/doi/pdf/10.1177/0002764209356236,1
"Huntoon, J. E. and M. J. Lane ",2007,"""Diversity in the Geosciences and Successful Strategies for Increasing Diversity."" Journal of Geoscience Education 55(6): 447-457.","dataset-370, dataset-493",EndNote SED library 11/7/2017,Diversity in the Geosciences and Successful Strategies for Increasing Diversity,10.5408/1089-9995-55.6.447,https://www.researchgate.net/publication/230889613_Diversity_in_the_Geosciences_and_Successful_Strategies_for_Increasing_Diversity,https://www.researchgate.net/publication/230889613_Diversity_in_the_Geosciences_and_Successful_Strategies_for_Increasing_Diversity,1
"Ehrenberg, R. G. and D. S. Rothstein ",1993,"Do Historically Black Institutions of Higher Education Confer Unique Advantages on Black Students: An Initial Analysis, NBER.","dataset-370, dataset-371, dataset-495",EndNote SED library 11/7/2017,Do Historically Black Institutions of Higher Education Confer Unique Advantages on Black Students: An Initial Analysis,10.3386/w4356,https://www.nber.org/papers/w4356,https://www.nber.org/papers/w4356.pdf,1