title,journal,authors,doi,search_term,dataset_id,valid?,notes,pdf
[Applications and advantages of a multimedia system for autopsies ].,Pathologica,"Gualco, M, Benzi, D, Fulcheri, E",,Integrated Surface Database,dataset-621,,,
An integrated software suite for surface-based analyses of cerebral cortex.,Journal of the American Medical Informatics Association : JAMIA,"Van Essen, D C, Drury, H A, Dickson, J, Harwell, J, Hanlon, D, Anderson, C H",,Integrated Surface Database,dataset-621,,,
An integrated epidemiologic and radiographic algorithm for canine urocystolith mineral type prediction.,Veterinary radiology & ultrasound : the official journal of the American College of Veterinary Radiology and the International Veterinary Radiology Association,"Weichselbaum, R C, Feeney, D A, Jessen, C R, Osborne, C A, Holte, J",,Integrated Surface Database,dataset-621,,,
Three-dimensional computer vision for tooth restoration.,Medical image analysis,"Paulus, D, Wolf, M, Meller, S, Niemann, H",,Integrated Surface Database,dataset-621,,,
Clinical application of an integrated 3-phase mapping technique for localization of the site of origin of idiopathic ventricular tachycardia.,Circulation,"Peeters, H A, SippensGroenewegen, A, Wever, E F, Ramanna, H, Linnenbank, A C, Potse, M, Grimbergen, C A, van Hemel, N M, Hauer, R N, Robles de Medina, E O",,Integrated Surface Database,dataset-621,,,
Quantitative trait loci affecting peak bone mineral density in mice.,Journal of bone and mineral research : the official journal of the American Society for Bone and Mineral Research,"Klein, R F, Mitchell, S R, Phillips, T J, Belknap, J K, Orwoll, E S",,Integrated Surface Database,dataset-621,,,
Simple sequence repeats in the Helicobacter pylori genome.,Molecular microbiology,"Saunders, N J, Peden, J F, Hood, D W, Moxon, E R",,Integrated Surface Database,dataset-621,,,
Somatic mutations that contribute to breast cancer.,Biochemical Society symposium,"Callahan,R",,Integrated Surface Database,dataset-621,,,
The application of geographic information systems to geochemical studies in Jamaica.,Environmental geochemistry and health,"Preston, J, Engel, B, Lalor, G C, Vutchkov, M K",10.1007/BF01771285,Integrated Surface Database,dataset-621,,,
Chronic stress tolerance levels for human articular cartilage: two nonuniform contact models applied to long-term follow-up of CDH.,Journal of biomechanics,"Maxian, T A, Brown, T D, Weinstein, S L",,Integrated Surface Database,dataset-621,,,
Medical workstations for applied imaging and graphics research.,Computerized medical imaging and graphics : the official journal of the Computerized Medical Imaging Society,"Ehricke, H H, Grunert, T, Buck, T, Kolb, R, Skalej, M",,Integrated Surface Database,dataset-621,,,
Noninvasive imaging and analysis of skin lesions for early detection of cutaneous malignant melanoma.,Biomedical instrumentation & technology,"Kini, P, Dhawan, A P",,Integrated Surface Database,dataset-621,,,
